,,,,,,,,,,Rollers and idlers,Rollers and idlers,Lubricated track rollers,Lubricated track rollers,,,3rd,11.8 km/h,15.8 km/h,,,,,,,,,,Suspension,Suspension,Oscillating equaliser bar and pivot shaft,Oscillating equaliser bar and pivot shaft,Number of track rollers,Number of track rollers,8,8,,,,,,,,,,,,,DEF tank,23.5 ltr,Float-down empty,12 sec,,Power-down,16 sec,,Power-down,16 sec,,Pumps:,"Two pumps, single package, end of alternator",,Power-down,23 sec,,Hoist and steering,"Dual, in-line, high-pressure",,Torque converter,"3-elements, 1-stage, 2-phase",Effective cylinder stroke (front suspension),250 mm,Maximum steering angle,38°,Effective cylinder stroke (front suspension),303 mm,Mechanical stopper,7.7°,Supplementary steering,"Meets ISO5010, SAEJ1511",Speed range,6 speeds forward and 2 reverse,Speed range,6 speeds forward and 2 reverse,Swing drive,7.1 ltr,Swing drive,15.6 ltr,Number of carrier rollers (each side),3,Arm size (m) & type,2.5 standard,Coolant,17.7 ltr,DEF tank,None,Ground clearance (mm),395,Fuel tank,200 ltr,Engine,16.0 ltr,"Final drive, each side",5.4 ltr,,,Engine,23.1 ltr,,Engine,120 ltr,Coolant,30.7 ltr,,Engine,23.1 ltr,Engine,23.1 ltr,,Hydraulic tank,126 ltr,,Hydraulic tank,126 ltr,,Engine,23.1 ltr,Engine,23.1 ltr,,Engine,23.1 ltr,Engine,37 ltr,,Operating weight,"250,000 - 261,000 kg","Final drive, each side",0.6 ltr,Engine,37 ltr,"Final drive, each side",0.6 ltr,Engine,35 ltr,Track type,Sealed track,,,Engine,37 ltr,Engine,37 ltr,"Final drive, each side",0.7 ltr,Engine,38 ltr,,,"Final drive, each side",0.7 ltr,Coolant,58 ltr,Coolant,58 ltr,,,DEF tank,None,,,Engine,53 ltr,Hydraulic tank,56 ltr,,,Circle reverse housing,7 ltr,,Circle reversing control hydraulic rotation,360°,,One gear pump for differential; capacity,17 ltr,,,,,,No. of steering cylinders,2,,Engine,280 ltr,,Fuel tank,133 ltr,Raise,5.7 sec,Lower (empty),3.2 sec,Lower (empty),3.3 sec,Dump,2.0 sec,,Dump,1.9 sec,,Dump,1.9 sec,Dump,1.8 sec,,Dump,1.8 sec,,Dump,2.0 sec,,Dump,1.6 sec,,Dump,1.6 sec,,Dump,1.9 sec,,Dump,1.7 sec,,Dump,1.7 sec,,Dump,2.3 sec,,Dump,2.3 sec,,Minimum turning radius at centre of outside tyre,3680 mm,,Torque converter and transmission,105 ltr,,Lower (empty),4.8 sec,,Cooling system,355 ltr,
,,,,,,,,,,K-Bogie undercarriage,K-Bogie undercarriage,Lubricated track rollers are resiliently mounted to the track frame with a bogie suspension system whose oscillating motion is cushioned by rubber pads.,Lubricated track rollers are resiliently mounted to the track frame with a bogie suspension system whose oscillating motion is cushioned by rubber pads.,,,Suspension,Suspension,Oscillating equalizer bar with shoulder pad and pivot shaft,Oscillating equalizer bar with shoulder pad and pivot shaft,,,,,,,,,Track roller frame,Track roller frame,"Cylindrical, high-tensile-strength steel construction","Cylindrical, high-tensile-strength steel construction",Number of carrier rollers,Number of carrier rollers,2,2,,,,,,,,,,,,,Hydraulic oil,69 ltr,Pumps:,"Two pumps, single package, end of alternator",,Float-down empty,17 sec,,Float-down empty,17 sec,,Hoist,Tandem gear pump with output of 1022 ltr/min at 1900 rpm and 17237 kPa,,Float-down empty,24 sec,,Brake component cabinet,"Above deck, easily accessible with diagnostic test connections",,Transmission,"Full-automatic, planetary-shaft type",Rear axle oscillation:,,Effective cylinder stroke (front suspension),250 mm,Rear axle oscillation:,,Torque converter,"3-elements, 1-stage, 2-phase",Minimum turning radius,10.1 m,Lockup clutch,"Wet, single-disc clutch",Lockup clutch,"Wet, single-disc clutch",Hydraulic tank,135 ltr,Swing motor,3.0 ltr,Number of track rollers (each side),8,Arm crowd force - ISO (kgf),6880,Engine,11.5 ltr,Operating weight,"14,560 - 14,870 kg",Boom size (m) & type,4.29 standard,Coolant,17.7 ltr,"Final drive, each side",3.3 ltr,Swing drive,4.5 ltr,,,"Final drive, each side",3.6 ltr,,"Travel gear, each side",85 ltr,Engine,23.1 ltr,,"Final drive, each side",5.0 ltr,"Final drive, each side",5.0 ltr,,DEF tank,13 ltr,,DEF tank,None,,"Final drive, each side",5.0 ltr,"Final drive, each side",8.5 ltr,,"Final drive, each side",8.0 ltr,"Final drive, each side",9.0 ltr,,Standard,15m3,Hydraulic tank,34 ltr,"Final drive, each side",9.0 ltr,Hydraulic tank,39 ltr,"Final drive, each side",9.0 ltr,Track adjuster,Hydraulic,,,"Final drive, each side",10.5 ltr,"Final drive, each side",10.5 ltr,Hydraulic tank,55 ltr,"Final drive, each side",11.0 ltr,,,Hydraulic tank,55 ltr,Engine,40 ltr,Engine,40 ltr,,,Operating weight,"7,960 kg",,,"Final drive, each side",20 ltr,DEF tank,None,,,Single piece rolled ring forging. Six circle support shoes with replaceable wear surface. Circle teeth hardened on front 180° of circle.,Single piece rolled ring forging. Six circle support shoes with replaceable wear surface. Circle teeth hardened on front 180° of circle.,,"A-shaped, u-section press formed and welded construction for maximum strength with a replaceable drawbar ball.","A-shaped, u-section press formed and welded construction for maximum strength with a replaceable drawbar ball.",,HYDRAULIC MOTOR:,,,,,,,Type,Double-action,,Hydraulic system,1300 ltr,,Engine,12.5 ltr,Dump,1.9 sec,Cooling system,17 ltr,Cooling system,22 ltr,Lower (empty),3.2 sec,,Lower (empty),3.5 sec,,Lower (empty),3.3 sec,Lower (empty),3.3 sec,,Lower (empty),3.3 sec,,Lower (empty),3.3 sec,,Lower (empty),3.1 sec,,Lower (empty),3.1 sec,,Lower (empty),3.8 sec,,Lower (empty),4.2 sec,,Lower (empty),4.2 sec,,Lower (empty),4.1 sec,,Lower (empty),4.1 sec,,Transmission,"Hydrostatic, 1 pump, 1 motor with speed range select","Hydrostatic, 1 pump, 1 motor with speed range select",Type,"Articulated type, fully hydraulic power steering",,Cooling system,337 ltr,,Fuel tank,1555 ltr,
,,,,,,,,,,Extreme service track shoes,Extreme service track shoes,Lubricated tracks. Unique seals prevent entry of foreign abrasives into pin to bushing clearances to provide extended service life. Track tension is easily adjusted with grease gun.,Lubricated tracks. Unique seals prevent entry of foreign abrasives into pin to bushing clearances to provide extended service life. Track tension is easily adjusted with grease gun.,,,Track roller frame,Track roller frame,"Cylindrical, high-tensile-strength steel construction","Cylindrical, high-tensile-strength steel construction",,,,,,,,,Rollers and idlers,Rollers and idlers,Lubricated track rollers,Lubricated track rollers,Extreme service shoes:,Ground contact area:,Ground pressure:,Ground pressure:,,,,,,,,,,,,,D85EXi-18,30590 kg,Hoist and brake cooling,Tandem gear pump with output of 666 ltr/min at 1900 rpm and 18961 kPa,,Pumps:,,,Pumps:,"Two pumps, single package, in-line",,Steering and brake,Pressure-compensating piston pump with output of 246 ltr/min at 1900 rpm and 18961 kPa,,Pumps:,"Two pumps, single package, end of alternator",,Hoist,"Two 3-stage dual-acting outboard cylinders, internal cushion valve, over-centre dampening",,Speed range,7 forward and 1 reverse,Oil stopper,6.8°,Rear axle oscillation:,,Oil stopper,6.8°,Transmission,"Full-automatic, planetary type",Maximum steering angle,41°,Forward,"Torque converter drive in 1st gear, direct drive in 1st lockup and all higher gears",Forward,"Torque converter drive in 1st gear, direct drive in 1st lockup and all higher gears",Generator motor,6 ltr,Hydraulic tank,188 ltr,Fuel tank,1360 ltr,Bucket crowd force - ISO (kgf),9520,"Final drive, each side",2.1 ltr,Boom size (m) & type,4.6 standard,Arm size (m) & type,2.13 standard,Engine,11.5 ltr,Swing drive,4.5 ltr,Hydraulic tank,121 ltr,,,Swing drive,6.5 ltr,,Swing drive,2 x 30 ltr,"Final drive, each side",5.0 ltr,,Swing drive,6.5 ltr,Swing drive,7.2 ltr,,Operating weight,,,Operating weight,,,Swing drive,7.2 ltr,Swing drive,8.2 ltr,,Swing drive,7.2 ltr,Swing drive,16.5 ltr,,Other optional available sizes,18m3,DEF tank,None,Swing drive,16.5 ltr,DEF tank,None,Swing drive,13.7 ltr,Number of shoes (each side),48,,,Swing drive,20 ltr,Swing drive,20 ltr,DEF tank,None,Swing drive,20 ltr,,,DEF tank,None,"Final drive, each side",10 ltr,"Final drive, each side",10 ltr,,,,,,,Swing drive,2 x 24.5 ltr,Operating weight,"8,500 - 8,750 kg",,,Diametre (outside),1530 mm,,Drawbar frame,210 x 22 mm,,Piston-type hydraulic motor. Output power used for blade rotation.,Piston-type hydraulic motor. Output power used for blade rotation.,,,,,,Bore diameter × stroke,60 × 369 mm,,"Differential, final drive, axle front",670 ltr,,Hydraulic system,47 ltr,Lower (empty),3.2 sec,Fuel tank,177 ltr,Fuel tank,186 ltr,Cooling system,33.3 ltr,,Cooling system,35.1 ltr,,Cooling system,25 ltr,Cooling system,30.5 ltr,,Cooling system,60.6 ltr,,Cooling system,32 ltr,,Cooling system,80 ltr,,Cooling system,78 ltr,,Cooling system,61 ltr,,Cooling system,133 ltr,,Cooling system,110 ltr,,Cooling system,147 ltr,,Cooling system,150 ltr,,Speed ranges,2,2,Steering angle,40° each direction,,Fuel tank,1555 ltr,,Engine,108 ltr,
,,,,,,,,,,Number of shoes (each side),Number of shoes (each side),39,39,,,Rollers and idlers,Rollers and idlers,Lubricated track rollers,Lubricated track rollers,,,,,,,,,K-Bogie undercarriage,K-Bogie undercarriage,Lubricated track rollers are resiliently mounted to the track frame with a bogie suspension system whose oscillating motion is cushioned by rubber pads.,Lubricated track rollers are resiliently mounted to the track frame with a bogie suspension system whose oscillating motion is cushioned by rubber pads.,910 mm  Additional weight - 1830 kg,82340 cm²,102 kPa / 1.04 kg/cm²,102 kPa / 1.04 kg/cm²,,,,,,,,,,,,,D85PXi-18,29520 kg,Steering and brake,Pressure-compensating piston pump with output of 254 ltr/min at 1900 rpm and 19134 kPa,,Hoist,Tandem gear pump with output of 851 ltr/min at 1900 rpm and 17240 kPa,,Hoist and brake cooling,Tandem gear pump with output of 931 ltr/min at 1900 rpm and 18960 kPa,,System relief pressures:,,,Hoist,Tandem gear pump with output of 1022 ltr/min at 1900 rpm and 17237 kPa,,Hoist times:,,,Lockup clutch,"Wet, multiple-disc clutch",Mechanical stopper,8.1°,Oil stopper,6.8°,Mechanical stopper,7.7°,Speed range,7 speeds forward and 1 reverse,Effective cylinder stroke:,,Reverse,Torque converter drive and direct drive in all gear,Reverse,Torque converter drive and direct drive in all gear,DEF tank,12.6 ltr,DEF tank,None,Coolant,142 ltr,Digging depth - maximum (mm),5520,Swing drive,2.5 ltr,Arm size (m) & type,2.5 standard,Arm crowd force - ISO (kgf),7300,"Final drive, each side",2.1 ltr,Hydraulic tank,121 ltr,DEF tank,29.6 ltr,,,Hydraulic tank,135 ltr,,Hydraulic tank,1300 ltr,Swing drive,6.5 ltr,,Hydraulic tank,135 ltr,Hydraulic tank,135 ltr,,PC228US-11,"23,520 - 24,300 kg",,PC228US-8 Without Blade,"23,070 - 23,210 kg",,Hydraulic tank,132 ltr,Hydraulic tank,132 ltr,,Hydraulic tank,132 ltr,Hydraulic tank,188 ltr,,,,Operating weight,"3,150 - 3,300 kg",Hydraulic tank,188 ltr,Operating weight,"3,620 - 3,770 kg",Hydraulic tank,188 ltr,Number of carrier rollers (each side),2,,,Hydraulic tank,248 ltr,Hydraulic tank,248 ltr,Operating weight,"4,860 - 4,980 kg",Hydraulic tank,248 ltr,,,Operating weight,"5,140 - 5,260 kg",Swing drive,2 x 13 ltr,Swing drive,2 x 13 ltr,,,,,,,Hydraulic tank,470 ltr,,,,,Circle reversing control hydraulic rotation,360°,,FRONT FRAME STRUCTURE,FRONT FRAME STRUCTURE,,Horsepower,49 kW / 66 HP,,,,,,Smallest turn (outer edge of  tyre 455/70 R20),4.130 mm,,"Differential, final drive, axle rear",670 ltr,,Axle front,14 ltr,Cooling system,26.5 ltr,Engine,15.5 ltr,Engine,23 ltr,Fuel tank,186 ltr,,Fuel tank,245 ltr,,Fuel tank,245 ltr,Fuel tank,300 ltr,,Fuel tank,300 ltr,,Fuel tank,325 ltr,,Fuel tank,380 ltr,,Fuel tank,380 ltr,,Fuel tank,413 ltr,,Fuel tank,473 ltr,,Fuel tank,473 ltr,,Fuel tank,718 ltr,,Fuel tank,718 ltr,,Travel speed,Forward & Reverse,Forward & Reverse,Minimum turning radius at centre of outside tyre,8280 mm,,Engine,130 ltr,,Hydraulic system,1020 ltr,
,,,,,,,,,,Grouser height - single grouser,Grouser height - single grouser,88 mm,88 mm,,,K-Bogie undercarriage,K-Bogie undercarriage,Lubricated track rollers are resiliently mounted to the track frame with a bogie suspension system whose oscillating motion is cushioned by rubber pads.,Lubricated track rollers are resiliently mounted to the track frame with a bogie suspension system whose oscillating motion is cushioned by rubber pads.,,,,,,,,,Extreme service track shoes,Extreme service track shoes,Lubricated tracks. Unique seals prevent entry of foreign abrasives into pin to bushing clearances to provide extended service life. Track tension is easily adjusted with grease gun.,Lubricated tracks. Unique seals prevent entry of foreign abrasives into pin to bushing clearances to provide extended service life. Track tension is easily adjusted with grease gun.,,,,,,,,,,,,,,,,,D85EXi-18 with Ripper,33090 kg,System relief pressures:,,,Steering and brake,Pressure-compensating piston pump with output of 246 ltr/min at 1900 rpm and 18961 kPa,,Steering and brake,Pressure-compensating piston pump with output of 246 ltr/min at 1900 rpm,,Hoist and brake cooling,17237 kPa,,Steering and brake,Pressure-compensating piston pump with output of 246 ltr/min at 1900 rpm and 18961 kPa,,Power-up loaded,21 sec,,Forward,Torque converter drive 1st and 2nd gear with direct drive lock-up in 1st through 7th,Torque converter,"3-elements, 1-stage, 2-phase",Mechanical stopper,8.1°,Torque converter,"3-elements, 1-stage, 2-phase",Lockup clutch,"Wet, single-disc clutch",Front suspension,320 mm,Shift control,Electronic shift control with automatic clutch modulation in all gear,Shift control,Electronic shift control with automatic clutch modulation in all gear,Operating weights,"21,810 - 22,050 kg",Operating weight,"35,680 - 36,220 kg",Engine,86 ltr,Digging reach - maximum (mm),8290,Hydraulic tank,69.0 ltr,Arm crowd force - ISO (kgf),6300,Bucket digging force - ISO (kgf),9000,Swing drive,2.5 ltr,DEF tank,None,Operating weight,"17,710 – 18,390 kg",,,DEF tank,None,,PTO,30 ltr,Hydraulic tank,132 ltr,,DEF tank,None,DEF tank,None,,PC228USLC-11,"23,890 - 24,670 kg",,PC228US-8 With Blade,"25,610 - 25,750 kg",,Hydraulic System,244 ltr,DEF tank,None,,Hydraulic system,253 ltr,DEF tank,None,,,,,,DEF tank,None,,,DEF tank,39 ltr,Number of track rollers (each side),8,,,DEF tank,None,DEF tank,None,,,DEF tank,39,,,,,Hydraulic tank,360 ltr,Hydraulic tank,360 ltr,,,,,,,DEF tank,None,,,,,"A-shaped, u-section press formed and welded construction for maximum strength with a replaceable drawbar ball.","A-shaped, u-section press formed and welded construction for maximum strength with a replaceable drawbar ball.",,Height,300 mm,,HYDRAULIC CYLINDERS:,HYDRAULIC CYLINDERS:,,,,,,Cabin in conformity with ISO 3471 with ROPS (roll over protective structure) in conformity with SAE J1040c and FOPS (falling object protective structure) in conformity with ISO 3449. The pressurised cabin is mounted upon hydro-bearings and is noise dampened. Tiltable for best servicing access.,,,Torque converter and transmission,350 ltr,,Axle rear,14.5 ltr,Fuel tank,177 ltr,Hydraulic system,58 ltr,Hydraulic system,67 ltr,Engine,23 ltr,,Engine,23 ltr,,Engine,23 ltr,Engine,23 ltr,,Engine,23 ltr,,Engine,30 ltr,,Engine,38 ltr,,Engine,38 ltr,,Engine,38 ltr,,Engine,37 ltr,,Engine,37 ltr,,Engine,86 ltr,,Engine,86 ltr,,1st,0 - 5 km/h,0 - 5 km/h,Torque converter,"Three-elements, single-stage, single-phase","Three-elements, single-stage, single-phase",Hydraulic system,725 ltr,,Axle front,370 ltr,
,,,,,,,,,,Shoe width (standard),Shoe width (standard),610 mm,610 mm,,,Extreme service track shoes,Extreme service track shoes,Lubricated tracks. Unique seals prevent entry of foreign abrasives into pin to bushing clearances to provide extended service life. Track tension is easily adjusted with grease gun.,Lubricated tracks. Unique seals prevent entry of foreign abrasives into pin to bushing clearances to provide extended service life. Track tension is easily adjusted with grease gun.,,,,,,,,,Number of shoes (each side),Number of shoes (each side),41,41,,,,,,,,,,,,,,,,,D85PXi-18 with Ripper,32020 kg,Hoist,17237 kPa,,System relief pressures:,,,System relief pressures:,,,Steering and brake,27579 kPa,,System relief pressures:,,,Power-down,16 sec,,Reverse,Torque converter drive,Transmission,"Full-automatic, planetary type",Torque converter,"3-elements, 1-stage, 2-phase",Transmission,"Full-automatic, planetary type",Forward,"Torque converter drive in 1st gear, direct drive in 1st lockup and all higher gears",Rear suspension,127 mm,Maximum travel speed,58.6 km/h,Maximum travel speed,55.9 km/h,"Length, overall (mm)",9425,"Length, overall (mm)",11145,"Final drive, each side",21 ltr,Maximum reach @ ground level,8170,DEF tank,12.6 ltr,Bucket crowd force - ISO (kgf),9500,Digging depth - maximum (mm),4820,Hydraulic tank,69.0 ltr,Operating weight,"17,370 - 17,440 kg","Length, overall (mm)",8690,,,Operating weight,,,DEF tank,None,Hydraulic system,234 ltr,,Operating weight,"23,330 kg",Operating weight,,,,PC228US-11,PC228USLC-11,PC228USLC-8 Without Blade,"23,750 - 23,990 kg",,DEF tank,23.1 ltr,Operating weight,,,DEF tank,23.1 ltr,Operating weight,,,,,,,Operating weight,"35,800 - 36,330 kg",,,Operating weight,"35,950 - 37,440 kg","Length, overall (mm)",11145,,,Operating weight,"44,400 - 44,850 kg",Operating weight,"46,440 - 47,470 kg",,,Operating weight,"47,890 - 49,680 kg",,,,,DEF tank,None,DEF tank,None,,,,,,,Operating weight,"78,600 - 79,800 kg",,,,,Drawbar frame,210 x 25 mm,,Width,300 mm,,"Double-acting piston type hydraulic cylinders: two for blade lifting, one for drawbar shifting, one for blade sideshifting, one for front wheel leaning, one for blade tipping, two for front wheel steering and two for frame articulation. Pilot check valves assure positive cylinder action (excluding a blade sideshift cylinder).","Double-acting piston type hydraulic cylinders: two for blade lifting, one for drawbar shifting, one for blade sideshifting, one for front wheel leaning, one for blade tipping, two for front wheel steering and two for frame articulation. Pilot check valves assure positive cylinder action (excluding a blade sideshift cylinder).",,,,,,,,,Brake oil,75 ltr,,Transmission,4.4 ltr,Engine,15.5 ltr,Axle front,18 ltr,Axle front,18 ltr,Hydraulic system,80 ltr,,Hydraulic system,92 ltr,,Hydraulic system,89 ltr,Hydraulic system,139 ltr,,Hydraulic system,142 ltr,,Hydraulic system,139 ltr,,Hydraulic system,173 ltr,,Hydraulic system,173 ltr,,Hydraulic system,173 ltr,,Hydraulic system,337 ltr,,Hydraulic system,337 ltr,,Hydraulic system,443 ltr,,Hydraulic system,443 ltr,,2nd,0 - 20 km/h,0 - 20 km/h,Transmission,"Full-powershift, automatic planetary type","Full-powershift, automatic planetary type",Axle front,360 ltr,,Axle rear,370 ltr,
,,,,,,,,,,Ground contact area,Ground contact area,42456 cm2,42456 cm2,,,Number of shoes (each side),Number of shoes (each side),41,41,,,,,,,,,Grouser height - single grouser,Grouser height - single grouser,105 mm,105 mm,,,,,,,,,,,,,,,,,,,Steering and brake,27580 kPa,,Hoist,17240 kPa,,Hoist and brake cooling,17237 kPa,,Quick disconnects standard for power disabled truck and for systems diagnostics,Quick disconnects standard for power disabled truck and for systems diagnostics,,Hoist and brake cooling,17237 kPa,,Float-down empty,17 sec,,Shift control,Electronic shift control with automatic clutch modulation in all gears,Speed range,7 speeds forward and 1 reverse,Transmission,"Full-automatic, planetary type",Speed range,7 speeds forward and 1 reverse,Reverse,Torque converter drive,Rear axle oscillation,6.5°,Standard tyre,23.5 R25,Standard tyre,29.5 R25,Track length on ground (mm),3655,Track length on ground (mm),4030,Swing drive,2 x 20 ltr,Swing radius (mm),2190,Operating weight,"15,140 – 15,500 kg",Digging depth - maximum (mm),5480,Digging reach - maximum (mm),7285,DEF tank,12.6 ltr,"Length, overall (mm)",8565,"Track length on ground (mm), Transport",4760,,,PC200-8M0,"20,940 - 21,180 kg",,Operating weight,"195,000 - 204,120 kg",DEF tank,23.1 ltr,,"Length, overall (mm)",9625,PC220-8M0,"24,110 - 24,440 kg",,"Length, overall (mm)",8830,8920,PC228USLC-8 With Blade,"26,430 - 26,670 kg",,Operating weight,"25,380 - 26,240 kg",PC270-8,"27,850 - 28,320 kg",,Operating weight,"29,800 - 31,210 kg",PC300-8M0,"33,490- 33,870 kg",,,,,,Boom size (m) & type,6.47 Heavy duty,,,"Length, overall (mm)",11145,Track length on ground (mm),4030,,,Boom size (m) & type,7.1 Standard,"Length, overall (mm)",11590,,,"Length, overall (mm)",11930,,,,,Operating weight,"60,200 - 61,900 kg",Operating weight,"63,300 kg",,,,,,,Boom size (m) & type,7.1 Heavy duty,,,,,FRONT FRAME STRUCTURE,FRONT FRAME STRUCTURE,,Side,16 / 32mm,,CONTROL VALVES:,CONTROL VALVES:,,,,,,,,,Brake cooling,290 ltr,,Type,"Articulated type, fully hydraulic power steering",Hydraulic system,58 ltr,Axle rear,18 ltr,Axle rear,18 ltr,Axle front,18.5 ltr,,Axle front,27 ltr,,Axle front,24 ltr,Axle front,40 ltr,,Axle front,40 ltr,,Axle front,49 ltr,,Axle front,57 ltr,,Axle front,57 ltr,,Axle front,59 ltr,,Axle front,95 ltr,,Axle front,95 ltr,,Axle front,155 ltr,,Axle front,185 ltr,,Standard tyres,12.5-R18,,Travel speed,Forward,Reverse,Axle rear,360 ltr,,Torque converter and transmission,180 ltr,
,,,,,,,,,,Ground pressure (tractor),Ground pressure (tractor),87.3 kPa / 0.89 kg/cm²,87.3 kPa / 0.89 kg/cm²,,,Grouser Height:,Grouser Height:,Grouser Height:,Grouser Height:,,,,,,,,,Shoe width (standard),Shoe width (standard),710 mm,710 mm,,,,,,,,,,,,,,,,,,,Cooling system,441 ltr,,Steering and brake,27580 kPa,,Steering and brake,20685 kPa,,Cooling system,719 ltr,,Steering and brake,27579 kPa,,Pumps:,"Two pumps, single package, in-line",,Maximum travel speed,56.5 km/h,Lockup clutch,"Wet, single-disc clutch",Speed range,7 speeds forward and 1 reverse,Lockup clutch,"Wet, single-disc clutch",Shift control,Electronic shift control with automatic clutch modulation in all gears,Torque converter,"3-elements, 1-stage, 2-phase",Empty weight,25395 kg,Empty weight,35005 kg,Track gauge (mm),2380,Track gauge (mm),2590,Hydraulic tank,670 ltr,,,"Length, overall (mm)",7260,Digging reach - maximum (mm),8300,Maximum reach @ ground level,7315,Operating weight,"15,630 – 16,030 kg",Track length on ground (mm),3170,Track gauge (mm),1990,,,PC200LC-8M0,"21,720 - 21,960 kg",,,,Operating weight,,,Track length on ground (mm),3655,PC220LC-8M0,"24,860 - 25,190 kg",,Track length on ground (mm),3460,3655,,PC228US-8,PC228USLC-8,Arm Length,3000 mm,PC270LC-8,"28,870 - 29,340 kg",,"Length, overall (mm)",10265,PC300LC-8M0,"34,140 - 34,520 kg",,,,,,Arm size (m) & type,3.2 Heavy duty,,,Track length on ground (mm),4030,Track gauge (mm),2590,,,Arm size (m) & type,3.4 Standard,Track length on ground (mm),4350,,,Track length on ground (mm),4350,,,,,Boom size (m) & type,7.7 Standard,"Length, overall (mm)",11980,,,,,,,Arm size (m) & type,2.945 Heavy duty,,,,,Height,300 mm,,"Upper, Lower",25 mm,,Two 5-spool type control valves for work equipment controls. Relief valve built into control valves for sure control.,Two 5-spool type control valves for work equipment controls. Relief valve built into control valves for sure control.,,,,,,,,,Type,"Articulated type, fully hydraulic power steering",,Steering angle,40° each direction,Axle front,18.5 ltr,Transfer case,5 ltr,Transfer case,5 ltr,Axle rear,18 ltr,,Axle rear,25.5 ltr,,Axle rear,24 ltr,Axle rear,40 ltr,,Axle rear,40 ltr,,Axle rear,40 ltr,,Axle rear,56 ltr,,Axle rear,56 ltr,,Axle rear,59 ltr,,Axle rear,95 ltr,,Axle rear,95 ltr,,Axle rear,155 ltr,,Axle rear,193 ltr,,Operating weight,"5,035 - 5,380 kg",,1st gear,6.4 km/h,7.1 km/h,Torque converter and transmission,140 ltr,,Type,"Articulated type, full-hydraulic power steering",
