HYDRAULICS & CONTROLS,"- SyncroSystem, Closed Load Sensing System (CLSS)  - Variable displacement axial piston pump and Load Independent Flow Divider.  - Proportional Pressure Controls (PPC) lock switch.  - Load Stabiliser System (LSS)  - Electro-hydraulic differential lock.  - Loader  - Proportional Pressure Controls (PPC) servo control type.  - Speed up function, self levelling and transmission kickdown.  - Bucket positioner, automatic (return to dig).  - Boom positioner / kickout.  - Backhoe (Sideshift arrangement)  - Proportional Pressure Controls (PPC) servo control type.  - Proportional Pressure Controls (PPC) servo control for stabilisers.  - Hydraulic sideshift.  - Power and Economy work mode selection.  - Electro-hydraulic boom lock and slide frame release lock.  - Swing transport lock and hydraulic cushions.  - Burst valve protection (boom and arm).  - Hammer piping (one way flow).  - Quick hitch piping, factory fitted.",,,Fuel tank,400 ltr,Final drive (each side),31 ltr,Ground pressure,1.03 kg/cm2,Hydraulic Oil Capacity (Refill):,Hydraulic Oil Capacity (Refill):,,,Final drive (each side),3.5 ltr,Number of ripper tilt cylinders,2,,,,,,,,,Hydraulic tank,60 ltr,Ripper tilt cylinder bore,225 mm,,,Minimum turning radius,4.6 m,,,Coolant,35 ltr,Fuel tank,372 ltr,Final drive (each side),8.1 ltr,Final drive (each side),24 - 27 ltr,Fuel tank,415 ltr,DEF tank,None,D85EXi-18,660 mm,Top and bottom plate thickness,32 mm,,Rail depth (minimum),864 mm,,Top and bottom plate thickness,32 mm,,Side plate thickness,25 mm,,Rail depth (minimum),864 mm,,Cranking motors,Two 24 V,,Type,Box-sectioned structure. Integral front bumper,Hoist cylinder,"Twin, two-stage telescopic type",Hoist cylinder,"Twin, two-stage telescopic type",Hoist cylinder,"Twin, two-stage telescopic type",Type,Box-sectioned structure,Hoist cylinder,"Twin, two-stage telescopic type",Engine oil,35 ltr,Engine oil,50 ltr,Service brake,Electric brake,Service brake,Electric brake,Drive method,Fully hydrostatic,Engine,11.5 ltr,Swing reduction,Planetary gear,Swing speed,11.0 rpm,Number of carrier rollers (each side),1,Hydraulic motor,,Swing reduction,Planetary gear,Swing reduction,Planetary gear,,,Swing reduction,Planetary gear,,Bottom Dump,2-180 mm x 600 mm,Swing reduction,Planetary gear,,Swing reduction,Planetary gear,Swing reduction,Planetary gear,,Swing lock,Mechanical disc brake,,Service brake,Hydraulic lock,,Swing reduction,Planetary gear,Swing reduction,Planetary gear,,Swing reduction,Planetary gear,Swing reduction,Planetary gear,,Hydraulic motors and drives,1,Swing reduction,Planetary gear,Swing reduction,Planetary gear,Swing reduction,Planetary gear,Swing reduction,Planetary gear,Swing reduction,Planetary gear,Engine oil,290 ltr,Swing reduction,Planetary gear,Swing reduction,Planetary gear,Swing reduction,Planetary gear,Swing reduction,Planetary gear,Number of carrier rollers (each side),3,Swing reduction,Planetary gear,Driven by,Hydrostatic,Driven by,Hydrostatic,Number of shoes (each side),48,Swing lock,Mechanical disc brake,Number of carrier rollers (each side),3,Driven by,Hydraulic motors,Swing circle lubrication,Grease-bathed,Engine,11.5 ltr,Right,2000 mm,,"Maximum blade angle, right or left",90 degrees,,No. cutting edges,2,,,,,,Operating brakes,"Combined inch brake pedal actuates maintenance free, wet multi-disc type brakes in the front axle Self-braking via the hydrostatic drive",,Type,"Double-acting, piston type",,Hydraulic pump,"Piston pump, in common with steering system",Loader Control:,Loader Control:,Capacity,54 ltr/min,Capacity,78 ltr/min,Hydraulic pump,"Piston pump, in common with steering system",,Hydraulic pump,"Piston pump, in common with steering system",,Hydraulic pump,Gear type pump,Hydraulic pump,Piston pump,,Hydraulic pump,Piston pump,,Hydraulic pump,Piston pump,,Hydraulic pump,Piston pump,,Hydraulic pump,Piston pump,,Hydraulic pump,Piston pump,,Hydraulic pump,Piston pump,,Hydraulic pump,Piston pump,,Hydraulic pump,Piston pump,,Hydraulic pump,Piston pump,,"Bucket cylinder, bore x stroke",85 mm x 522 mm,,Type,"Double-acting, piston type",,Capacity,405 ltr/min,,Capacity (at rated rpm),4 x 230 L/min,
OPERATOR ENVIRONMENT,"- Large wide view ROPS / FOPS ergonomic cabin.  - Two door cabin with fully opening rear window.  - Steering wheel, adjustable.  - Air suspension seat, fabric covered.  - Seat belt, 78mm, retractable.  - Safe position seat sensor.  - Easy to view gauge and switch clusters.  - Air conditioner.  - Rear view mirrors, inside and out.  - Floor mat.  - Tinted windows  - AM/FM/CD/MP3 radio, domestic frequency range.",,,Radiator,28 ltr,"Transmission, bear gear, and steering system",90 ltr,Coolant,104 ltr,SIGMADOZER or Semi-U dozer or Full-U dozer,130 ltr,,,DEF tank,None,Ripper tilt cylinder bore,180 mm,,,,,,,,,Final drive (each side),3.5 ltr,Hydraulic Oil Capacity (Refill):,Hydraulic Oil Capacity (Refill):,,,Gear,Forward,Reverse,,Fuel tank,270 ltr,Engine oil,27 ltr,Hydraulic tank,101 ltr,DEF tank,None,Engine oil,30.5 ltr,Operating weight,"D85EX-15EO 28,100 kg  D85PX-15EO 27,650 kg",D85PXi-18,910 mm,Side plate thickness,19 mm,,Top and bottom plate thickness,32 mm,,Side plate thickness - rear,16 mm,,Drive axle mounting,Pin and spherical bushing,,Top and bottom plate thickness,45 mm,,Plate material,482.6 MPa tensile strength steel,,Fuel tank,2120 ltr,Relief pressure,20.6 MPa  210 kg/cm2,Relief pressure,20.6 MPa  210 kg/cm2,Relief pressure,20.6 MPa  210 kg/cm2,Fuel tank,800 ltr,Relief pressure,20.6 MPa  210 kg/cm2,"Torque converter, transmission and retarder cooling",80 ltr,"Torque converter, transmission and retarder cooling",125 ltr,Swing lock,Mechanical disc break,Swing lock,Mechanical disc brake,Maximum drawbar pull,686 kN 70000 kgf,"Final drive, each side",2.1 ltr,Swing circle lubrication,Grease-bathed,Center frame,X-frame leg,Number of track rollers (each side),7,Swing reduction,Planetary gear,Swing circle lubrication,Grease-bathed,Swing circle lubrication,Grease-bathed,,,Swing circle lubrication,Grease-bathed,,Travel Gear,Planetary gear,Swing circle lubrication,Grease-bathed,,Swing circle lubrication,Grease-bathed,Swing circle lubrication,Grease-bathed,,Swing speed,11.0 rpm,,Swing lock,Mechanical disc brake,,Swing circle lubrication,Grease-bathed,Swing circle lubrication,Grease-bathed,,Swing circle lubrication,Grease-bathed,Swing circle lubrication,Grease-bathed,,"Swing brake, service",Hydraulic brake,Swing circle lubrication,Grease-bathed,Swing circle lubrication,Grease-bathed,Swing circle lubrication,Grease-bathed,Swing circle lubrication,Grease-bathed,Swing circle lubrication,Grease-bathed,Hydraulic system,"5,900 ltr",Swing circle lubrication,Grease-bathed,Swing circle lubrication,Grease-bathed,Swing circle lubrication,Grease-bathed,Swing circle lubrication,Grease-bathed,Number of track rollers (each side),7,Swing circle lubrication,Grease-bathed,Swing reduction,Planetary gear,Swing reduction,Planetary gear,Number of carrier rollers (each side),3,Swing speed,10 rpm,Number of track rollers (each side),8,Swing reduction,Planetary gear,Swing lock,Mechanical disc,"Differential, each side",9 ltr,Left,2000 mm,,Blade tip angle,40° forward / 5° backward,,Length,2438 mm,,,,,,Parking brake,Integrated wet multi-disc type brake,,Number of boom cylinders,2,,Capacity,123 ltr/min,Hydraulic pump,Gear type pump,Relief valve setting,20.6 MPa  210 kgf/cm2,Relief valve setting,20.6 MPa  210 kgf/cm2,Capacity,150 ltr/min,,Capacity,180 ltr/min,,Capacity,61 ltr/min,Capacity,205.5 ltr/min,,Capacity,205 ltr/min,,Capacity,205 ltr/min,,Capacity,260 ltr/min,,Capacity,260 ltr/min,,Capacity,260 ltr/min,,Capacity,320 ltr/min,,Capacity,320 ltr/min,,Capacity,239 + 239 ltr/min,,Capacity,239 + 239 ltr/min,,Control valve,3-spool type,,Number of boom cylinders,2,,Relief valve setting,31.4 MPa  320 kgf/cm2,,Relief valve setting,34.3 MPa  350 kgf/cm2,
OTHER STANDARD EQUIPMENT,"- Back-up alarm.  - Engine shut-off system, electric.  - Painting, Komatsu standard colouring.  - Marks and plates, English (Aus & NZ).  - Battery isolation switch.  - Cap lock and cover lock.  - Internal storage.  - Dual LED beacons, rotating type with guards.  - Komatsu Machine Tracking System, (KOMTRAX).  - Fire extinguisher.",,,Engine,26 ltr,DEF tank,None,Fuel tank,625 ltr,Ripper Equipment (Additional Volume):,Ripper Equipment (Additional Volume):,,,Operating weight,"7,670 - 8,540 kg",Hydraulic Oil Capacity (Refill):,Hydraulic Oil Capacity (Refill):,,,,,,,,,DEF tank,None,Semi-U dozer,180 ltr,,,1st,3.3 km/h,4.2 km/h,,Engine oil,20 ltr,Final drive (each side),8.1 ltr,DEF tank,20.6 ltr,Operating weight,"19,510 - 21,890 kg",Final drive (each side),16.5-22 ltr,,,Ground contact area:,,Drive axle mounting,Pin and spherical bushing,,Side plate thickness,16 mm,,Side plate thickness - front,16 mm,,Drive axle alignment,Swing link between frame and axle,,Side plate thickness,25 mm,,Casting material,620.5 MPa tensile strength steel,,Engine oil,230 ltr,Hoist time,10 sec,Hoist time,10 sec,Hoist time,11.5 sec,Engine oil,80 ltr,Hoist time,,Differentials (total),71.5 ltr,Differentials (total),108 ltr,Swing speed,12.4 rpm,Swing speed,9.5 rpm,Gradeability,70 %,Swing drive,2.5 ltr,Service brake,Hydraulic lock,Track frame,Box-bathed,Shoe size & type,500 mm steel city pattern,Swing circle lubrication,Grease-bathed,Service brake,Hydraulic lock,Swing lock,Mechanical disc brake,,,Service brake,Hydraulic lock,,Gradeability,65 %,Service brake,Hydraulic lock,,Service brake,Hydraulic lock,Service brake,Hydraulic lock,,Center frame,X-frame leg,,Center frame,X-frame leg,,Service brake,Hydraulic lock,Service brake,Hydraulic lock,,Service brake,Hydraulic lock,Service brake,Hydraulic lock,,"Service brake, parking","Wet, multiple-disc",Service brake,Hydraulic lock,Service brake,Hydraulic lock,Service brake,Hydraulic lock,Service brake,Hydraulic lock,Service brake,Hydraulic lock,Hydraulic oil tank,"3,900 ltr",Service brake,Hydraulic lock,Service brake,Hydraulic lock,Service brake,Hydraulic lock,Service brake,Hydraulic lock,Fuel tank,"10,355 ltr",Service brake,Hydraulic lock,Swing circle lubrication,Grease-bathed,Swing circle lubrication,Grease-bathed,Number of track rollers (each side),7,Center frame,X-frame leg,Fuel tank,"13,925 ltr",Swing circle lubrication,Grease-bathed,Swing speed,10 rpm,Swing drive,2.8 ltr,Maximum lift above ground,480 mm,,Service brake,"Foot operated, sealed oil disc brakes, hydraulically actuated on four tandem wheels.",,Height,254 mm,,,,,,Cooling system,22.3 ltr,,"Boom cylinder, bore x stroke",360 mm x 1835 mm,,Relief valve setting,20.6 MPa  210 kgf/cm2,Capacity,54 ltr/min 14.3 U.S gal/min at rated rpm,Hydraulic Cylinders:,Hydraulic Cylinders:,Hydraulic Cylinders:,Hydraulic Cylinders:,Relief valve setting,31.4 MPa  320 kgf/cm2,,Relief valve setting,30.4 MPa  310 kgf/cm2,,Relief valve setting,20.6 MPa  210 kgf/cm2,Relief valve setting,31.4 MPa  320 kgf/cm2,,Relief valve setting,31.4 MPa  320 kgf/cm2,,Relief valve setting,31.4 MPa  320 kgf/cm2,,Relief valve setting,34.3 MPa  350 kgf/cm2,,Relief valve setting,34.3 MPa  350 kgf/cm2,,Relief valve setting,34.3 MPa  350 kgf/cm2,,Relief valve setting,34.3 MPa  350 kgf/cm2,,Relief valve setting,34.3 MPa  350 kgf/cm2,,Relief valve setting,34.3 MPa  350 kgf/cm2,,Relief valve setting,34.3 MPa  350 kgf/cm2,,Hydraulic Cycle Time: (rated load in bucket),Hydraulic Cycle Time: (rated load in bucket),,"Boom cylinder, bore x stroke",225 mm x 1196 mm,,Hydraulic Cylinders:,Hydraulic Cylinders:,,Hydraulic Cylinders:,Hydraulic Cylinders:,
WORK EQUIPMENT,"- Loader  - Multi Purpose bucket.  - Backhoe  - Boom, ""S"" shape type.  - Arm, telescopic type.  - Bucket solutions are available on request.",,,"Final drive, each side",4.5 ltr,Operating weight,"39,500 kg",Engine oil,37 ltr,Giant ripper,38 ltr,,,,,Semi-U dozer or U dozer,130 ltr,,,,,,,,,Operating weight,"9,040 - 9,480 kg",U tilt dozer,180 ltr,,,2nd,6.2 km/h,8.0 km/h,,Hydraulic tank,63 ltr,Hydraulic tank,101 ltr,Operating weight,"19,647 kg",,,"Torque converter, transmission, bevel gear, and steering system",48 ltr,,,D85EXi-18,40.260 cm2,Drive axle alignment,Swing link between frame and axle,,Drive axle mounting,Pin and spherical bushing,,Drive axle mounting,Pin and spherical bushing,,Steering,Accumulator assisted twin double acting cylinders provide constant rate steering. Emergency steering automatically applied by accumulator.,,Drive axle mounting,Pin and spherical bushing,,Rail width,305 mm,,Differential,439 ltr,Type,Box-sectioned structure,Type,Box-sectioned structure,Type,Box-sectioned structure,"Torque converter, transmission and retarder cooling",215 ltr,Raise,13 sec,Final drives (total),23 ltr,Final drives (total),32 ltr,Center frame,X-frame leg,Center frame,X-frame leg,Travel speeds,2.1 / 3.2 km/h,Hydraulic tank,90 ltr,Swing lock,"Wet, multiple-disc brake",Track type,Sealed track,Fuel tank,195 ltr,Service brake,Hydraulic lock,Swing lock,Mechanical disc brake,Swing speed,12 rpm,,,Swing lock,Mechanical disc brake,,Travel speeds,1.7 / 2.7 km/h,Swing lock,Mechanical disc brake,,Swing lock,Mechanical disc brake,Swing lock,Mechanical disc brake,,Track frame,Box-section,,Track frame,Box-section,,Swing lock,Mechanical disc brake,Swing lock,Mechanical disc brake,,Swing lock,Mechanical disc brake,Swing lock,Mechanical disc brake,,Swing ring teeth,External,Swing lock,Mechanical disc brake,Swing lock,Mechanical disc brake,Swing lock,Mechanical disc brake,Swing lock,Mechanical disc brake,Swing lock,Mechanical disc brake,DEF tank,587ltr,Swing lock,Mechanical disc brake,Swing lock,Mechanical disc brake,Swing lock,Mechanical disc brake,Swing lock,Mechanical disc brake,Coolant,2 x 360 ltr,Swing lock,Mechanical disc brake,Service brake,Hydraulic lock,Service brake,Hydraulic lock,Fuel tank,"13,033 ltr",Track frame,Box-section,Coolant,2 x 430 ltr,Swing lock,Oil disc brake,Center frame,X-frame leg,Hydraulic tank,140 ltr,Maximum cutting depth,615 mm,,Parking brake,"Manually actuated, spring applied, hydraulically released caliper.",,Thickness,25 mm,,,,,,Fuel tank,110 ltr,,Number of bucket cylinders,2,,Hydraulic Cylinders:,Hydraulic Cylinders:,Relief valve setting,"20.6 MPa 210 kgf/cm2 3,000 psi",Type,"Double-acting, piston type",Type,"Double-acting, piston type",Hydraulic Cylinders:,Hydraulic Cylinders:,,Hydraulic Cylinders:,Hydraulic Cylinders:,,Hydraulic Cylinders:,Hydraulic Cylinders:,Hydraulic Cylinders:,Hydraulic Cylinders:,,Hydraulic Cylinders:,Hydraulic Cylinders:,,Hydraulic Cylinders:,Hydraulic Cylinders:,,Hydraulic Cylinders:,Hydraulic Cylinders:,,Hydraulic Cylinders:,Hydraulic Cylinders:,,Hydraulic Cylinders:,Hydraulic Cylinders:,,Hydraulic Cylinders:,Hydraulic Cylinders:,,Hydraulic Cylinders:,Hydraulic Cylinders:,,Hydraulic Cylinders:,Hydraulic Cylinders:,,Hydraulic Cylinders:,Hydraulic Cylinders:,,Raise,5.3 sec,,Number of bucket cylinders,1,,Type,"Double-acting, piston type",,Type,"Double-acting, piston type",
MATERIALS,- Operation and maintenance manual.  - Parts book.,,,Hydraulic system,209 ltr,,,Final drive (each side),31 ltr,Multi-shank ripper,38 ltr,,,,,Ripper Equipment (Additional Volume):,Ripper Equipment (Additional Volume):,,,,,,,,,,,Ripper Equipment (Additional Volume):,Ripper Equipment (Additional Volume):,,,3rd,11.2 km/h,14.0 km/h,,Final drive (each side),4.0 ltr,DEF tank,None,,,,,DEF tank,23.5 ltr,,,D85PXi-18,63.340 cm2,Steering,Accumulator assisted with twin double acting cylinders provide constant rate steering. Secondary steering automatically supplied by accumulator,,Drive axle alignment,Swing link between frame and axle,,Drive axle alignment,Swing link between frame and axle,,Turning circle diameter (SAE),29.7 m,,Drive axle alignment,Swing link between frame and axle,,Rail depth (minimum),864 mm,,Final drives (total),214 ltr,Fuel tank,484 ltr,Fuel tank,456 ltr,Fuel tank,780 ltr,Differentials,95 ltr,Lower,14 sec,Hydraulic system,103 ltr,Hydraulic system,167 ltr,Track frame,Box-section,Track frame,Box-section,Service brake,Hydraulic lock,DEF tank,None,Swing speed,11.0 rpm,Track adjuster,Hydraulic,Coolant,12.4 ltr,Swing lock,"Wet, multiple-disc brake",Swing speed,12 rpm,Centre frame,X-frame leg,,,Swing speed,12.4 rpm,,Parking brake,Mechanical disc brake,Swing speed,12.4 rpm,,Swing speed,12.4 rpm,Swing speed,11.7 rpm,,Track type,Sealed track,,Track type,Sealed track,,Swing speed,11.7 rpm,Swing speed,10.5 rpm,,Swing speed,10.5 rpm,Swing speed,9.5 rpm,,Swing speed,4.6 rpm,Swing speed,9 rpm,Swing speed,9.5 rpm,Swing speed,9 rpm,Swing speed,9.5 rpm,Swing speed,9.5 rpm,Operating weight,"393,000 - 409,000 kg",Swing speed,9.1 rpm,Swing speed,9.1 rpm,Swing speed,9 rpm,Swing speed,9.1 rpm,Engine oil,2 x 190 ltr,Swing speed,9 rpm,Swing lock,Oil disc brake,Swing lock,Oil disc brake,Coolant,2 x 440 ltr,Track type,Sealed track,Engine oil,2 x 290 ltr,Swing speed,6.8 rpm,Track frame,Box-section,DEF tank,None,"Maximum blade angle, right or left",90°,,Fuel tank,390 ltr,,FRONT FRAME STRUCTURE,FRONT FRAME STRUCTURE,,,,,,Engine,10.5 ltr,,"Bucket cylinder, bore x stroke",300 mm x 985 mm,,Type,"Double-acting, piston type",Hydraulic Cylinders:,Hydraulic Cylinders:,Number of boom cylinders,2,Number of boom cylinders,2,Type,"Double-acting, piston type",,Type,"Double-acting, piston type",,Type,"Double-acting, piston type",Type,"Double-acting, piston type",,Type,"Double-acting, piston type",,Type,"Double-acting, piston type",,Type,"Double-acting, piston type",,Type,"Double-acting, piston type",,Type,"Double-acting, piston type",,Type,"Double-acting, piston type",,Type,"Double-acting, piston type",,Type,"Double-acting, piston type",,Type,"Double-acting, piston type",,Dump,1.0 sec,,"Bucket cylinder, bore x stroke",280 mm x 729 mm,,Number of boom cylinders,2,,"Number of cylinders, bore x stroke:",,
WARRANTY,"- Premium warranty 36 months / 6,000 hours.  ""Specification on either backhoe variant unit is subject to change without notice""",,,,,,,"Transmission, bear gear, and steering system",90 ltr,Tractor weight,"Including rated capacity of lubricant, coolant, full fuel tank, operator, and standard equipment.",37680 kg,,,,Giant ripper (variable),45 ltr,,,,,,,,,,,Giant ripper,130 ltr,,,Suspension,Suspension,Oscillating equaliser bar and pivot shaft,Oscillating equaliser bar and pivot shaft,DEF tank,None,Operating weight,"17,890 - 20,527 kg",,,,,Operating weight,"20,740 - 24,293 kg",,,Ground pressure:,,Turning circle diameter (SAE),27.2 m,,Steering,Accumulator assisted with twin double acting cylinders provide constant rate steering. Secondary steering automatically supplied by accumulator,,Steering,Accumulator assisted with twin double acting cylinders provide constant rate steering. Secondary steering automatically supplied by accumulator.,,Reservoir,947 ltr,,Steering,Accumulator assisted twin double acting cylinders provide constant rate steering. Emergency steering automatically applied by accumulator.,,Top and bottom plate thickness,45 mm,,Hydraulic system,316 ltr,Engine oil,50 ltr,DEF tank,34.7 ltr,Engine oil,80 ltr,Final drives (total),42 ltr,Type,Box-sectioned structure. Integral front bumper,Suspension (total),10.4 ltr,Suspension (total),21.4 ltr,Track type,Sealed track,Track type,Sealed track,Driven by,Hydraulic Motors,Operating weight,,Swing torque,2991 kg.m,Number of shoes (each side),43,Engine,11 ltr,Swing speed,11.0 rpm,Center frame,X-frame leg,Track frame,Box-section,,,Center frame,X-frame leg,,Swing Gear,2 x Planetary gear,Swing torque,6900 kgm,,Center frame,X-frame leg,Center frame,X-frame leg,,Track adjuster,Hydraulic,,Track adjuster,Hydraulic,,Center frame,X-frame leg,Center frame,X-frame leg,,Center frame,X-frame leg,Center frame,X-frame leg,,Track adjuster,Automatic Hydraulic type,Center frame,X-frame leg,Center frame,X-frame,Center frame,X-frame leg,Center frame,X-frame,Fuel tank,605 ltr,,,Center frame,X-frame leg,Center frame,X-frame leg,Center frame,X-frame leg,Center frame,X-frame leg,Hydraulic system,"6,000 ltr",Center frame,X-frame leg,Swing speed,8.3 rpm,Swing speed,8.3 rpm,Engine oil,2 x 236 ltr,Track adjuster,Hydraulic,Hydraulic system,"11,500 ltr",Center frame,H-frame leg,Track type,Sealed track,Operating weight,"9,950 - 10,500 kg",Blade tip angle,40° forward / 5° backward,,DEF tank,37 ltr,,Frames are articulated by two hydraulic cylinders. Box-sectioned front and rear frames are steel plate welded construction and connected with an articulation pin. One-piece-frame design for the front frame in which hydraulic piping is installed offering excellent front visibility for more precise operations.,Frames are articulated by two hydraulic cylinders. Box-sectioned front and rear frames are steel plate welded construction and connected with an articulation pin. One-piece-frame design for the front frame in which hydraulic piping is installed offering excellent front visibility for more precise operations.,,,,,,Hydraulic system,50 ltr,,Control valve,2-spool type,,Number of boom cylinders,2,Type,"Double-acting, piston type","Boom cylinder, bore x stroke",125 mm x 673.5 mm,"Boom cylinder, bore x stroke",130 mm x 717 mm,Number of boom cylinders,2,,Number of boom cylinders,2,,Number of boom cylinders,2,Number of boom cylinders,2,,Number of boom cylinders,2,,Number of boom cylinders,2,,Number of boom cylinders,2,,Number of boom cylinders,2,,Number of boom cylinders,2,,Number of boom cylinders,2,,Number of boom cylinders,2,,Number of boom cylinders,2,,Number of boom cylinders,2,,Lower (empty),3.0 sec,,Control valve,2-spool type,,"Boom cylinder, bore x stroke",260 mm x 1368 mm,,Lift cylinder,2 – 260 mm x 1495 mm,
,,,,,,,,DEF tank,39 ltr,Operating weight,"Including Strengthened Dual tilt SIGMADOZER, giant ripper, steel cab, ROPS, operator, standard equipment, rated capacity of lubricant, coolant, and full fuel tank.",51530 kg,,,,Multi-shank ripper (variable),45 ltr,,,,,,,,,,,Multi-shank ripper,130 ltr,,,Track roller frame,Track roller frame,"Cylindrical, high-tensile-strength steel construction","Cylindrical, high-tensile-strength steel construction",Operating weight,"12,710 - 13,100 kg",,,,,,,,,,,D85EXi-18,0.61 kgf/cm2,Reservoir,511 ltr,,Turning circle diameter (SAE),28.4 m,,Turning circle diameter (SAE),29.3 m,,Filtration,In-line replaceable elements,,Turning circle diameter (SAE),29.7 m,,Side plate thickness - rear,25 mm,,Transmission,129 ltr,"Torque converter, transmission and retarder cooling",90 ltr,Engine oil,50 ltr,"Torque converter, transmission and retarder cooling",215 ltr,Hydraulic system,149 ltr,Fuel tank,1308 ltr,Type,"Articulated type, fully hydraulic power steering with double-acting cylinders",Type,"Articulated type, fully hydraulic power steering with two double-acting cylinders",Track adjuster,Hydraulic,Track adjuster,Hydraulic,Swing reduction,Planetary gear,Without Blade,"12,920 - 13,060 kg",Center frame,X-frame leg,Number of carrier rollers (each side),1,"Final drive, each side",2.5 ltr,Swing torque,2991 kg.m,Track frame,Box-section,Track type,Sealed track,,,Track frame,Box-section,,Swing holding brakes,Mechanical disc brakes,Center frame,X-frame leg,,Track frame,Box-section,Track frame,Box-bathed,,Number of shoes (each side),49,,Number of shoes (each side),45 - 49,,Track frame,Box-section,Track frame,Box-section,,Track frame,Box-section,Track frame,Box-section,,Number of shoes (each side),46,Track frame,Box-section,Track frame,Box-section,Track frame,Box-section,Track frame,Box-section,Coolant,37 ltr,,,Track frame,Box-section,Track frame,Box-section,Track frame,Box-section,Track frame,Box-section,Hydraulic oil tank,"3,715 ltr",Track frame,Box-section,Centre frame,H-frame leg,Center frame,X-frame leg,Hydraulic system,"9,500 ltr",Number of shoes (each side),39,Hydraulic oil tank,"7,750 ltr",Track frame,Box-section,Track adjuster,Hydraulic,,,Service brake,"Foot operated, oil disc brakes, hydraulically actuated on four tandem wheels, 13691 cm2 total braking surface.",,Cooling system,30 ltr,,Height,400 mm,,,,,,Axle front,9.1 ltr,,Control Positions:,Control Positions:,,"Boom cylinder, bore x stroke",110 mm x 628 mm,Number of lift cylinders,2,Number of bucket cylinders,1,Number of bucket cylinders,1,"Boom cylinder, bore x stroke",110 mm x 717 mm,,"Boom cylinder, bore x stroke",120 mm x 729 mm,,"Boom cylinder, bore x stroke",140 mm x 729 mm,"Boom cylinder, bore x stroke",130 mm x 713 mm,,"Boom cylinder, bore x stroke",130 mm x 713 mm,,"Boom cylinder, bore x stroke",130 mm x 776 mm,,"Boom cylinder, bore x stroke",140 mm x 764 mm,,"Boom cylinder, bore x stroke",140 mm x 764 mm,,"Boom cylinder, bore x stroke",140 mm x 881 mm,,"Boom cylinder, bore x stroke",160 mm x 898 mm,,"Boom cylinder, bore x stroke",160 mm x 898 mm,,"Boom cylinder, bore x stroke",200 mm x 1067 mm,,"Boom cylinder, bore x stroke",200 mm x 1067 mm,,Cooling system,9.1 ltr,,Control Positions:,Control Positions:,,Number of bucket cylinders,1,,Bucket cylinder,1 – 300 mm x 995 mm,
