dozers_d31ex-22,dozers_d31ex-22_specs-1,dozers_d85exi-pxi-18,dozers_d85exi-pxi-18_specs-1,dozers_d155ax-6,dozers_d155ax-6_specs-1,dozers_d85ex-px-15e0,dozers_d85ex-px-15e0_specs-1,dozers_d61exi-pxi-23,dozers_d61exi-pxi-23_specs-1,crushers_br380jg-1e0,crushers_br380jg-1e0_specs-1,dozers_d51ex-px-22,dozers_d51ex-px-22_specs-1,dump-trucks_980e-4,dump-trucks_980e-4_specs-1,dump-trucks_980e-4_specs-2,excavators_pc170lc-11,excavators_pc170lc-11_specs-1,dozers_d65exi-pxi-18,dozers_d65exi-pxi-18_specs-1,dozers_d39ex-22,dozers_d39ex-22_specs-1,dozers_d61exi-pxi-24,dozers_d61exi-pxi-24_specs-1,dozers_d65ex-px-wx-16,dozers_d65ex-px-wx-16_specs-1,motor-graders_gd655-7,motor-graders_gd655-7_specs-1,motor-graders_gd655-7_specs-2,dump-trucks_930e-4se,dump-trucks_930e-4se_specs-1,dump-trucks_930e-4se_specs-2,backhoe_wb97s-5,backhoe_wb97s-5_specs-1,dump-trucks_830e-5,dump-trucks_830e-5_specs-1,dump-trucks_830e-5_specs-2,motor-graders_gd825a-2,motor-graders_gd825a-2_specs-1,motor-graders_gd825a-2_specs-2,backhoe_wb97r-5,backhoe_wb97r-5_specs-1,motor-graders_gd555-5,motor-graders_gd555-5_specs-1,motor-graders_gd555-5_specs-2,dump-trucks_hd605-7e0,dump-trucks_hd605-7e0_specs-1,dump-trucks_930e-5,dump-trucks_930e-5_specs-1,dump-trucks_930e-5_specs-2,dump-trucks_830e-1ac,dump-trucks_830e-1ac_specs-1,dump-trucks_830e-1ac_specs-2,wheel-loaders_wa1200-6,wheel-loaders_wa1200-6_specs-1,wheel-loaders_wa1200-6_specs-2,dump-trucks_hd405-8,dump-trucks_hd405-8_specs-1,wheel-loaders_wa480-6,wheel-loaders_wa480-6_specs-1,wheel-loaders_wa480-6_specs-2,dump-trucks_hd785-7,dump-trucks_hd785-7_specs-1,excavators_pc350lc-8m0,excavators_pc350lc-8m0_specs-1,dump-trucks_hd605-8,dump-trucks_hd605-8_specs-1,wheel-loaders_wa900-8r,wheel-loaders_wa900-8r_specs-1,wheel-loaders_wa900-8r_specs-2,excavators_pc360lc-11,excavators_pc360lc-11_specs-1,excavators_hb335lc-1,excavators_hb335lc-1_specs-1,excavators_pc300-lc-8m0,excavators_pc300-lc-8m0_specs-1,excavators_pc300-lc-8m0_specs-2,excavators_pc220-lc-8m0,excavators_pc220-lc-8m0_specs-1,excavators_pc220-lc-8m0_specs-2,excavators_pc290lc-11,excavators_pc290lc-11_specs-1,excavators_pc270-lc-8,excavators_pc270-lc-8_specs-1,excavators_pc270-lc-8_specs-2,excavators_pc228us-lc-8,excavators_pc228us-lc-8_specs-1,excavators_pc228us-lc-8_specs-2,excavators_pc210lci-10,excavators_pc210lci-10_specs-1,excavators_pc360lci-11,excavators_pc360lci-11_specs-1,excavators_pc200-lc-8m0,excavators_pc200-lc-8m0_specs-1,excavators_pc200-lc-8m0_specs-2,excavators_hb215lc-1m0,excavators_hb215lc-1m0_specs-1,excavators_pc240lc-11,excavators_pc240lc-11_specs-1,wheel-loaders_wa800-3e0,wheel-loaders_wa800-3e0_specs-1,wheel-loaders_wa800-3e0_specs-2,wheel-loaders_wa700-3,wheel-loaders_wa700-3_specs-1,wheel-loaders_wa700-3_specs-2,wheel-loaders_wa600-8-lc,wheel-loaders_wa600-8-lc_specs-1,wheel-loaders_wa600-8-lc_specs-2,excavators_pc450lc-8,excavators_pc450lc-8_specs-1,excavators_pc210-lc-11,excavators_pc210-lc-11_specs-1,excavators_pc210-lc-11_specs-2,excavators_pc4000-11,excavators_pc4000-11_specs-1,excavators_pc8000-6,excavators_pc8000-6_specs-1,excavators_pc2000-8,excavators_pc2000-8_specs-1,excavators_pc3000-6,excavators_pc3000-6_specs-1,excavators_pc1250sp-8r,excavators_pc1250sp-8r_specs-1,excavators_pc850se-8e0,excavators_pc850se-8e0_specs-1,excavators_pc7000-11,excavators_pc7000-11_specs-1,excavators_pc228us-lc-11,excavators_pc228us-lc-11_specs-1,excavators_pc228us-lc-11_specs-2,excavators_pc600lc-8e0se,excavators_pc600lc-8e0se_specs-1,excavators_pc600lc-8e0,excavators_pc600lc-8e0_specs-1,excavators_pc490lc-11,excavators_pc490lc-11_specs-1,excavators_pc450lc-8se,excavators_pc450lc-8se_specs-1,wheel-loaders_wa500-7,wheel-loaders_wa500-7_specs-1,wheel-loaders_wa500-7_specs-2,excavators_pc5500-6,excavators_pc5500-6_specs-1,wheel-loaders_wa500-8-yl,wheel-loaders_wa500-8-yl_specs-1,wheel-loaders_wa500-8-yl_specs-2,dump-trucks_hm400-5,dump-trucks_hm400-5_specs-1,dump-trucks_hd1500-8,dump-trucks_hd1500-8_specs-1,dump-trucks_730e-8,dump-trucks_730e-8_specs-1,dump-trucks_730e-8_specs-2,wheel-loaders_wa600-6,wheel-loaders_wa600-6_specs-1,wheel-loaders_wa600-6_specs-2,dump-trucks_hm300-5,dump-trucks_hm300-5_specs-1,wheel-loaders_wa470-8,wheel-loaders_wa470-8_specs-1,wheel-loaders_wa470-8_specs-2,wheel-loaders_wa380-8,wheel-loaders_wa380-8_specs-1,wheel-loaders_wa380-8_specs-2,wheel-loaders_wa380-6,wheel-loaders_wa380-6_specs-1,wheel-loaders_wa380-6_specs-2,wheel-loaders_wa470-7,wheel-loaders_wa470-7_specs-1,wheel-loaders_wa470-7_specs-2,wheel-loaders_wa320-8,wheel-loaders_wa320-8_specs-1,wheel-loaders_wa320-8_specs-2,wheel-loaders_wa270-8,wheel-loaders_wa270-8_specs-1,wheel-loaders_wa270-8_specs-2,wheel-loaders_wa200pz-6,wheel-loaders_wa200pz-6_specs-1,wheel-loaders_wa320pz-6,wheel-loaders_wa320pz-6_specs-1,wheel-loaders_wa430-6,wheel-loaders_wa430-6_specs-1,wheel-loaders_wa430-6_specs-2,wheel-loaders_wa250pz-6,wheel-loaders_wa250pz-6_specs-1,wheel-loaders_wa70-7,wheel-loaders_wa70-7_specs-1,wheel-loaders_wa70-7_specs-2,dump-trucks_hd405-7,dump-trucks_hd405-7_specs-1,wheel-loaders_wa200-8,wheel-loaders_wa200-8_specs-1,excavators_pc160lc-8,excavators_pc160lc-8_specs-1,skidsteer_sk820-5sf,skidsteer_sk820-5sf_specs-1,wheel-loaders_wa150-5,wheel-loaders_wa150-5_specs-1,excavators_pc138us-8os,excavators_pc138us-8os_specs-1,wheel-loaders_wa100m-8e0,wheel-loaders_wa100m-8e0_specs-1,wheel-loaders_wa100m-8e0_specs-2,skidsteer_sk714-5,skidsteer_sk714-5_specs-1,excavators_pc138uslc-11,excavators_pc138uslc-11_specs-1,excavators_pc138us-11,excavators_pc138us-11_specs-1,excavators_pc130-8,excavators_pc130-8_specs-1,excavators_pw98mr-10,excavators_pw98mr-10_specs-1,excavators_pc45mr-5,excavators_pc45mr-5_specs-1,excavators_pc78uu-10,excavators_pc78uu-10_specs-1,excavators_pc35mr-5,excavators_pc35mr-5_specs-1,excavators_pc88mr-10,excavators_pc88mr-10_specs-1,excavators_pc138us-8,excavators_pc138us-8_specs-1,dozers_d475a-5e0,dozers_d475a-5e0_specs-1,dozers_d475a-5e0_specs-2,dozers_d475a-5e0_specs-3,excavators_pc30mr-5,excavators_pc30mr-5_specs-1,dozers_d475asd-5e0,dozers_d475asd-5e0_specs-1,dozers_d475asd-5e0_specs-2,dozers_d475asd-5e0_specs-3,excavators_pc55mr-5,excavators_pc55mr-5_specs-1,excavators_pc18mr-3,excavators_pc18mr-3_specs-1,dozers_d275ax-5e0,dozers_d275ax-5e0_specs-1,dozers_d275ax-5e0_specs-2,dozers_d275ax-5e0_specs-3,dozers_d375a-8,dozers_d375a-8_specs-1,dozers_d375a-8_specs-2,dozers_d375a-8_specs-3,dozers_d375a-8_specs-4,dozers_d375a-8_specs-5,dozers_d375a-8_specs-6,dozers_d375a-8_specs-7,dozers_d375a-8_specs-8,dozers_d375a-8_specs-9,dozers_d155axi-8,dozers_d155axi-8_specs-1
Model,Komatsu SAA4D95LE-5,Model,Komatsu SAAD125E-7,Model,Komatsu SAA6D140E-5,Model,Komatsu SAA6D125E-5,Model,Komatsu SAA6D107E-2,Model,Komatsu SAAD107E-1,Model,Komatsu SAA6D107E-1,Model,Komatsu SSDA18V170,,Model,Komatsu SAA4D107E-3* Tier 4 Final,Model,Komatsu SAAD114E-6,Model,Komatsu SAA4D107E-1,Model,Komatsu SAA6D107E-3,Model,Komatsu SAA6D114E-3,Model,SAA6D107E-3*,,Model,Komatsu SSDA18V170,,Model,Komatsu SAA4D104E-1,Model,Komatsu SDA16V160,,Model,S6D140E,,Model,Komatsu SAA4D104E-1,Model,SAA6D107E-1,,Model,Komatsu SAA6D170E-5,Model,Komatsu SSDA16V160,,Model,Komatsu SDA16V160,,Model,Komatsu SSD16V160E-2,,Model,Komatsu SAA6D140E-7,Model,Komatsu SAA6D125E-5,,Model,Komatsu SAA12V140E-3,Model,Komatsu SAA6D114E-3,Model,Komatsu SAA6D170E-7,Model,Komatsu SAA12V140E-7,,Model,Komatsu SAA6D114E-6,Model,Komatsu SAA6D114E-5,Model,Komatsu SAA6D114E-3,,Model,Komatsu SAA6D107LE-1,,Model,Komatsu SAA6D107E-3,Model,Komatsu SAA6D107E-1,,Model,Komatsu SAA6D107E-1,,Model,Komatsu SAA6D107E-2,Model,Komatsu SAA6D114E-6,Model,Komatsu SAA6D107E-1,,Model,Komatsu SAA4D107E-1-A,Model,Komatsu SAA6D107LE-3,Model,Komatsu SAA12V140E-3,,Model,Komatsu SAA6D170E-3,,Model,Komatsu SAA6D170E-7,,Model,Komatsu SAA6D125E-5,Model,Komatsu SAA6D107E-3,,Version 1 - Tier 2 engine:,,Model,2 x Komatsu SDA16V160E-2,Model,Komatsu SAA12V140E-3,Version 1 - Tier 1 engine:,,Model,Komatsu SAA6D170E-5,Model,Komatsu SAA6D140E-5,Model,Komatsu SSDA16V159E-2,Model,Komatsu SAA6D107E-3,,Model,Komatsu SAA6D140E-5,Model,Komatsu SAA6D140E-5,Model,Komatsu SAA6D125E-7,Model,Komatsu SAA6D125E-5,Model,Komatsu SAA6D140E-6,,Model,2 x Komatsu SDA12V159E-2,Model,Komatsu SAA6D140E-7,,Model,Komatsu SAA6D140E-7,Model,Komatsu SDA16V159E-3,Model,Komatsu SSDA16V159-E2,,Model,Komatsu SAA6D170E-5,,Model,Komatsu SAA6D125E-7,Model,Komatsu SAA6D125E-7,,Model,Komatsu SAA6D107E-3,,Model,Komatsu SAA6D107E-1,,Model,Komatsu SAA6D125E-6,,Model,Komatsu SAA6D107E-3,,Model,Komatsu SAA6D107E-3,,Model,Komatsu SAA6D107E-1,Model,Komatsu SAA6D107E-1,Model,Komatsu SAA6D114E-3,,Model,Komatsu SAA6D107E-1,Model,Komatsu 4D95LWE-5,,Model,Komatsu SAA6D140E-5,Model,Komatsu SAA4D107E-3,Model,Komatsu SAA4D107E-1,Model,Komatsu S4D84E-1FD,Model,Komatsu SAA4D102E-2,Model,Komatsu SAA4D95LE-5,Model,Komatsu SAA4D94LE-3,,Model,Komatsu 4D88E-1FD,Model,Komatsu SAA4D95LE-7,Model,Komatsu SAA4D95LE-7,Model,Komatsu SAAD95LE-5,Model,Komatsu SAAD95LE-6,Model,Komatsu 4D88E-7,Model,Komatsu SAAD95LE-6,Model,Komatsu 3D88E-7,Model,Komatsu SAAD95LE-6,Model,Komatsu SAAD95LE-5,Model,Komatsu SAA12V140E-3,,,Model,Komatsu 3D88E-7,Model,Komatsu SAA12V140E-3,,,Model,Komatsu 4D88E-7,Model,Komatsu 3D67E-2,Model,Komatsu SAA6D140E-5,,,Model,Komatsu SAA6D170E-7,,,,,,,,,Model,Komatsu SAA6D140E-7
Type,"4-cycle, water-cooled, direct injection",Type,"4-cycle, water-cooled, direct injection",Type,"4-cycle, water-cooled, direct injection",Type,"4-cycle, water-cooled, direct injection",Type,"4-cycle, water-cooled, direct injection",Type,"4-cycle, water-cooled, overhead valve, turbocharged diesel engine",Type,"4-cycle, water-cooled, direct injection",Fuel,Diesel,,Type,"Water-cooled, 4-cycle, direct injection",Type,"4-cycle, water-cooled, direct injection",Type,"4-cycle, water-cooled, direct injection",Type,"4-cycle, water-cooled, direct injection",Type,"4-cycle, water-cooled, direct injection",Type,"Water-cooled, 4-cycle, direct injection",,Fuel,Diesel,,"Horsepower, Net - EEC 80/1269 (kW)",74,Fuel,Diesel,,Type,"4-cycle, watercooled, overhead valve, turbocharged diesel engine",,"Horsepower, Net - EEC 80/1269 (kW)",74,Type,"Water-cooled, 4-cycle, direct injection",,Type,"Four-cycle, water-cooled, direct injection",Fuel,Diesel,,Fuel,Diesel,,Type,"Four-cycle, water-cooled, modular common rail direct injection",,Type,"Four-cycle, water-cooled, direct injection",Type,"Four-cycle, water-cooled, direct injection",,Type,"Four-cycle, water-cooled, direct injection",Type,"Water-cooled, 4-cycle, direct injection",Type,"Four-cycle, water-cooled, direct injection",Type,"Four-cycle, water-cooled",,Type,"Water-cooled, 4-cycle, direct injection",Type,"Water-cooled, 4-cycle, direct injection",Type,"Water-cooled, 4-cycle, direct injection",,Type,"Water-cooled, 4-cycle, direct injection",,Type,"Water-cooled, 4-cycle, direct injection",Type,"Water-cooled, 4-cycle, direct injection",,Type,"Water-cooled, 4-cycle",,Type,"Water-cooled, 4-cycle, direct injection",Type,"Water-cooled, 4-cycle, direct injection",Type,"Water-cooled, 4-cycle, direct injection",,Type,"Water-cooled, 4-cycle, direct injection",Type,"Water-cooled, 4-cycle, direct injection",Type,"Four-cycle, water-cooled, direct injection",,Type,"Four-cycle, water-cooled, direct injection",,Type,"Four-cycle, water-cooled, direct injection",,Type,"Water-cooled, 4-cycle, direct injection",Type,"Water-cooled, 4-cycle, direct injection",,Model,Komatsu SDA16V160E-2,Type,"Water-cooled, 4-cycle, direct injection",Type,"Water-cooled, 4-cycle, direct injection",Model,Komatsu SSA12V159,Type,"Water-cooled, 4-cycle, direct injection",Type,"Water-cooled, 4-cycle, direct injection",Type,"Water-cooled, 4-cycle, direct injection",Type,"Water-cooled, 4-cycle",,Type,"Water-cooled, 4-cycle, direct injection",Type,"Water-cooled, 4-cycle, direct injection",Type,"Water-cooled, 4-cycle, direct injection",Type,"Water-cooled, 4-cycle, direct injection",Type,"Four-cycle, water-cooled, direct injection",,Type,"Water-cooled, 4-cycle, direct injection",Type,"Four-cycle, water-cooled, direct injection",,Type,"Four-cycle, water-cooled, direct injection",Type,"Four-cycle, water-cooled, direct injection",Fuel,Diesel,,Type,"Four-cycle, water-cooled, direct injection",,Type,"Four-cycle, water-cooled, direct injection",Type,"Four-cycle, water-cooled, direct injection",,Type,"Four-cycle, water-cooled, direct injection",,Type,"Four-cycle, water-cooled, direct injection",,Type,"Four-cycle, water-cooled, direct injection",,Type,"Four-cycle, water-cooled, direct injection",,Type,"Four-cycle, water-cooled, direct injection",,Type,"Four-cycle, water-cooled, direct injection",Type,"Four-cycle, water-cooled, direct injection",Type,"Four-cycle, water-cooled, direct injection",,Type,"Four-cycle, water-cooled, direct injection",Number of cylinders,4,,Type,"Four-cycle, water-cooled, direct injection",Type,"Water-cooled, 4-cycle",Type,"Water-cooled, 4-cycle, direct injection","Horsepower, - SAE J1349 (kW)",38.9,Type,"Four-cycle, water-cooled, direct injection",Type,"Water-cooled, 4-cycle, direct injection",Type,"Common rail direct injection, water-cooled, emissionised, turbocharged, after-cooled diesel",,"Horsepower, - SAE J1349 (kW)",34.7,Type,"Water-cooled, 4-cycle, direct injection",Type,"Water-cooled, 4-cycle, direct injection",Type,"Water-cooled, 4-cycle, direct injection",Type,"Water-cooled, 4-cycle, direct injection",Type,"Water-cooled, 4-cycle, direct injection",Type,"Water-cooled, 4-cycle, direct injection",Type,"Water-cooled, 4-cycle, direct injection",Type,"Water-cooled, 4-cycle, direct injection",Type,"Water-cooled, 4-cycle, direct injection",Type,"Four-cycle, water-cooled, direct injection",,,Type,"Water-cooled, 4-cycle, direct injection",Type,"Four-cycle, water-cooled, direct injection",,,Type,"Water-cooled, 4-cycle, direct injection",Type,Swirl Chamber,Type,"Four-cycle, water-cooled, direct injection",,,Type,"Four-cycle, water-cooled, direct injection",,,,,,,,,Type,"4-cycle, water-cooled, direct injection"
Number of Cylinders,4,Aspiration,"Turbocharged, after-cooled",Aspiration,"Turbocharged, after-cooled, cooled EGR",Aspiration,"Turbocharged, after-cooled, cooled EGR",Aspiration,"Turbocharged, after-cooled, cooled EGR",Aspiration,"Turbocharged, air to air aftercooled",Aspiration,"Turbocharged, after-cooled diesel",Number of cylinders,18,,Aspiration,"Variable geometry turbocharged,  aftercooled, cooled EGR",Aspiration,"Turbocharged, after-cooled, cooled EGR",Aspiration,"Turbocharged, aftercooled",Aspiration,"Turbocharged, after-cooled, cooled EGR",Aspiration,"Turbocharged, after-cooled",Aspiration,"Turbocharged, aftercooled, cooled EGR",,Number of cylinders,18,,Engine Displacement (litre),4.485,Number of cylinders,16,,Aspiration,Turbocharged,,Engine Displacement (litre),4.485,Aspiration,Turbocharged and air to air aftercooled,,Aspiration,"Turbo-charged, after-cooled, cooled EGR",Number of cylinders,16,,Number of cylinders,16,,Aspiration,"Turbo-charged, after-cooled",,Aspiration,"Turbo-charged, after-cooled, cooled EGR",Aspiration,"Turbo-charged, after-cooled, cooled EGR",,Aspiration,"Turbo-charged, after-cooled",Aspiration,"Turbocharged, aftercooled",Aspiration,"Turbo-charged, after-cooled, cooled EGR",Aspiration,"Turbocharged, aftercooled",,Aspiration,"Turbocharged, aftercooled",Aspiration,"Turbocharged, aftercooled, cooled EGR",Aspiration,"Turbocharged, aftercooled",,Aspiration,"Turbocharged, aftercooled",,Aspiration,"Turbocharged, aftercooled, cooled EGR",Aspiration,"Turbocharged, aftercooled",,Aspiration,"Turbocharged, aftercooled",,Aspiration,"Turbocharged, aftercooled, cooled EGR",Aspiration,"Variable geometry turbocharged, aftercooled",Aspiration,"Turbocharged, aftercooled",,Aspiration,"Turbocharged, aftercooled",Aspiration,"Turbocharged, aftercooled, Cooled EGR",Aspiration,"Turbo-charged, after-cooled",,Aspiration,"Turbo-charged, after-cooled",,Aspiration,"Turbo-charged, after-cooled, cooled EGR",,Aspiration,"Turbocharged, aftercooled, cooled EGR",Aspiration,"Turbocharged, aftercooled, cooled EGR",,Type,"4-cycle, water-cooled, direct injection",Aspiration,"Turbocharged, aftercooled",Aspiration,"Turbocharged, aftercooled",Type,"Water-cooled, 4-cycle, direct injection",Aspiration,"Turbocharged, aftercooled",Aspiration,"Turbocharged, aftercooled, cooled EGR",Aspiration,"Turbocharged, aftercooled",Aspiration,"Turbocharged, aftercooled",,Aspiration,"Turbocharged, aftercooled, cooled EGR",Aspiration,"Turbocharged, aftercooled, cooled EGR",Aspiration,"Turbocharged, aftercooled",Aspiration,"Turbocharged, aftercooled, cooled EGR",Aspiration,"Turbo-charged, after-cooled, cooled EGR",,Aspiration,"Turbocharged, aftercooled",Aspiration,"Turbo-charged, after-cooled, cooled EGR",,Aspiration,"Turbo-charged, after-cooled, cooled EGR",Aspiration,"Turbo-charged, after-cooled",Number of cylinders,16,,Aspiration,"Turbo-charged, after-cooled, cooled EGR",,Aspiration,"Turbo-charged, after-cooled, cooled EGR",Aspiration,"Turbo-charged, after-cooled, cooled EGR",,Aspiration,"Turbo-charged, after-cooled, cooled EGR",,Aspiration,"Turbo-charged, after-cooled",,Aspiration,"Turbo-charged, after-cooled, cooled EGR",,Aspiration,"Turbo-charged, after-cooled, cooled EGR",,Aspiration,"Turbo-charged, after-cooled, cooled EGR",,Aspiration,"Turbo-charged, after-cooled",Aspiration,"Turbo-charged, after-cooled",Aspiration,"Turbo-charged, after-cooled",,Aspiration,"Turbo-charged, after-cooled",Bore x stroke,95 mm x 115 mm,,Aspiration,"Turbo-charged, after-cooled, cooled EGR",Aspiration,"Variable geometry, turbo-charged,  after-cooled, cooled EGR",Aspiration,"Turbocharged, aftercooled","Horsepower, Net - 80/1269/EC",38,Aspiration,"Turbo-charged, after-cooled",Aspiration,"Variable flow, turbocharged, air-to-air aftercooled",Cylinders,4,,"Horsepower, Net - 80/1269/EC",34,Aspiration,"Variable flow, turbocharged, air-to-air aftercooled",Aspiration,"Variable flow, turbocharged, air-to-air aftercooled",Aspiration,"Variable flow, turbocharged, Water-cooled",Aspiration,"Turbocharged, aftercooled",Aspiration,Cooled EGR,Aspiration,"Turbocharged, aftercooled, cooled EGR",Aspiration,Cooled EGR,Aspiration,"Turbocharged, aftercooled, cooled EGR",Aspiration,"Variable flow, turbocharged, air-to-air aftercooled",Aspiration,"Turbo-charged, after-cooled",,,Aspiration,Cooled EGR,Aspiration,"Turbo-charged, after-cooled",,,Aspiration,Cooled EGR,Number of Cylinders,3,Aspiration,"Turbo-charged, after-cooled, cooled EGR",,,Aspiration,"Turbo-charged, after-cooled, cooled EGR",,,,,,,,,Aspiration,"Turbocharged, after-cooled"
bore x stroke,95 mm x 115 mm,Number of Cylinders,6,Number of Cylinders,6,Number of Cylinders,6,Number of Cylinders,6,No. Cylinders,6,Number of Cylinders,6,Operating Cycle,4 cycle,,Number of Cylinders,4,Number of Cylinders,6,Number of Cylinders,4,Number of Cylinders,6,Number of Cylinders,6,No. Cylinders,6,,Operating Cycle,4 cycle,,Number of cylinders,4,Operating Cycle,4 cycle,,No. Cylinders,6,,Number of cylinders,4,No. Cylinders,6,,Number of cylinders,6,Operating Cycle,4 cycle,,Operating Cycle,4 cycle,,Number of cylinders,16,,Number of cylinders,6,Number of cylinders,6,,Number of cylinders,12,Number of Cylinders,6,Number of cylinders,6,Number of cylinders,12,,Number of Cylinders,6,Number of Cylinders,6,Number of Cylinders,6,,Number of Cylinders,6,,Number of Cylinders,6,Number of Cylinders,6,,Number of Cylinders,6,,Number of Cylinders,6,Number of Cylinders,6,Number of Cylinders,6,,Number of Cylinders,4,Number of Cylinders,6,Number of cylinders,12,,Number of cylinders,6,,Number of cylinders,6,,Number of Cylinders,6,Number of Cylinders,6,,Aspiration,"Turbocharged, aftercooled",Number of Cylinders,16,Number of Cylinders,12,Aspiration,"Turbocharged, aftercooled",Number of Cylinders,6,Number of Cylinders,6,Number of Cylinders,16,Number of Cylinders,6,,Number of Cylinders,6,Number of Cylinders,6,Number of Cylinders,6,Number of Cylinders,6,Number of cylinders,6,,Number of Cylinders,12,Number of cylinders,6,,Number of cylinders,6,Number of cylinders,16,Operating Cycle,4 cycle,,Number of cylinders,6,,Number of cylinders,6,Number of cylinders,6,,Number of cylinders,6,,Number of cylinders,6,,Number of cylinders,6,,Number of cylinders,6,,Number of cylinders,6,,Number of cylinders,4,Number of cylinders,6,Number of cylinders,6,,Number of cylinders,6,Displacement,3.3 ltr,,Number of cylinders,6,Number of cylinders,4,Number of Cylinders,4,Number of cylinders,4,Number of cylinders,4,Number of Cylinders,4,Bore x stroke,94 mm x 110 mm,,Number of cylinders,4,Number of Cylinders,4,Number of Cylinders,4,Number of Cylinders,4,Number of Cylinders,4,Number of Cylinders,4,Number of Cylinders,4,Number of Cylinders,3,Number of Cylinders,4,Number of Cylinders,4,Number of cylinders,12,,,Number of Cylinders,3,Number of cylinders,12,,,Number of Cylinders,4,Piston Displacement,0.78 ltr,Number of cylinders,6,,,Number of cylinders,6,,,,,,,,,Number of Cylinders,6
"Horsepower, Gross - SAE J1995",60 kW / 80 HP,bore x stroke,125 mm x 150 mm,bore x stroke,140 mm x 165 mm,bore x stroke,125 mm x 150 mm,bore x stroke,107 mm x 124 mm,Bore,107 mm,bore x stroke,107 mm x 124 mm,"Horsepower, Gross",2610 kW / 3500 HP,,Bore x Stroke,107 mm x 124 mm,bore x stroke,114 mm x 144.5 mm,bore x stroke,107 mm x 124 mm,bore x stroke,107 mm x 124 mm,bore x stroke,114 mm x 135 mm,Bore,107mm,,"Horsepower, Gross",2611 kW / 3500 HP,,Bucket capacity SAE,8660 kg,"Horsepower, Gross",1865 kW / 2500 HP,,Bore,140 mm,,Operating weight - (kg),Standard: 8070,Bore,107mm,,Bore x stroke,170 mm x 170 mm,"Horsepower, Gross",2014 kW / 2700 HP,,"Horsepower, Gross",1865 kW / 2500 HP,,Bore x stroke,159 mm x 190 mm,,Bore x stroke,140 mm x 165 mm,Bore x stroke,125 mm x 150 mm,,Bore x stroke,140 mm x 165 mm,Bore x Stroke,114 mm x 135 mm,Bore x stroke,170 mm x 170 mm,Bore x stroke,140 mm x 165 mm,,Bore x Stroke,114 mm x 144.5 mm,Bore x Stroke,114 mm x 145 mm,Bore x Stroke,114 mm x 135 mm,,Bore x Stroke,107 mm x 124 mm,,Bore x Stroke,107 mm x 124 mm,Bore x Stroke,107 mm x 124 mm,,Bore x Stroke,107 mm x 124 mm,,Bore x Stroke,107 mm x 124 mm,Bore x Stroke,114 mm x 144.5 mm,Bore x Stroke,107 mm x 124 mm,,Bore x Stroke,107 mm x 124 mm,Bore x Stroke,107 mm x 124 mm,Bore x stroke,140 mm x 165 mm,,Bore x stroke,170 mm x 170 mm,,Bore x stroke,170 mm x 170 mm,,Bore x Stroke,125 mm x 150 mm,Bore x Stroke,107 mm x 124 mm,,Number of Cylinders,16,"Horsepower, Net - ISO 9249 / SAE J1349",2 x 1500 kW / 2 x 2010 HP,Bore x Stroke,140 mm x 165 mm,Number of Cylinders,12,Bore x Stroke,170 mm x 170 mm,Bore x Stroke,140 mm x 165 mm,"Horsepower, Net - ISO 9249 / SAE J1349",2 x 1250 kW / 2 x 1675 HP,Bore x Stroke,107 mm x 124 mm,,Bore x Stroke,140 mm x 165 mm,Bore x Stroke,140 mm x 165 mm,Bore x Stroke,125 mm x 150 mm,Bore x Stroke,125 mm x 150 mm,Bore x stroke,140 mm x 165 mm,,"Horsepower, Net - ISO 9249 / SAE J1349",2 x 940 kW / 2 x 1260 HP,Bore x stroke,140 mm x 165 mm,,Bore x stroke,140 mm x 165 mm,Bore x stroke,159 mm x 159 mm,"Horsepower, Gross",1492 kW / 2000 HP,,Bore x stroke,170 mm x 170 mm,,Bore x stroke,125 mm x 150 mm,Bore x stroke,125 mm x 150 mm,,Bore x stroke,107 mm x 124 mm,,Bore x stroke,107 mm x 124 mm,,Bore x stroke,125 mm x 150 mm,,Bore x stroke,107 mm x 124 mm,,Bore x stroke,107 mm x 124 mm,,Bore x stroke,107 mm x 124 mm,Bore x stroke,107 mm x 124 mm,Bore x stroke,114 mm x 135 mm,,Bore x stroke,107 mm x 124 mm,Horsepower ISO 14396,36.9 kW / 49.5 HP,,Bore x stroke,140 mm x 165 mm,Bore x stroke,"107 mm 4.21"" x 124 mm 4.88""",Bore x Stroke,107 mm x 124 mm,Operating weight - total (kg),2940,Bore x stroke,102 mm x 120 mm,Bore x Stroke,95 mm x 115 mm,Displacement,3.05 ltr,,Operating weight - total (kg),2530,Bore x Stroke,95 mm x 115 mm,Bore x Stroke,95 mm x 115 mm,Piston Displacement,3.26 ltr,Bore x Stroke,95 mm x 115 mm,Bore x Stroke,88 mm x 90 mm,Bore x Stroke,95 mm x 115 mm,Bore x Stroke,88 mm x 90 mm,Bore x Stroke,95 mm x 115 mm,Bore x Stroke,95 mm x 115 mm,Bore x stroke,140 mm x 165 mm,,,Bore x Stroke,88 mm x 90 mm,Bore x stroke,140 mm x 165 mm,,,Bore x Stroke,88 mm x 90 mm,"Horsepower, Gross - SAE J1995",11.2 kW,Bore x stroke,140 mm x 165 mm,,,Bore x stroke,170 mm x 170 mm,,,,,,,,,bore x stroke,140 mm x 165 mm
