Pump type,Variable displacement piston,Pump type,Variable displacement piston,Crusher,230 ltr/min,Blade tilt,1 x 160 mm,Blade tilt,1 x 160 mm,Relief valve setting,27.5 MPa  280 kg/cm²,,,Type,"Dual-path, hydrostatic transmission System","Closed-center load sensing system (CLSS) designed for precise and responsive control, and for efficient simultaneous operation.","Closed-center load sensing system (CLSS) designed for precise and responsive control, and for efficient simultaneous operation.",,,,,,,,,Blade angle,2 x 80 mm,All spool valves externally mounted beside the hydraulic tank. Plunger type hydraulic pump with capacity (discharge flow) of 542 ltr/min for at rated engine rpm.,All spool valves externally mounted beside the hydraulic tank. Plunger type hydraulic pump with capacity (discharge flow) of 542 ltr/min for at rated engine rpm.,,,All spool valves externally mounted beside the hydraulic tank. Plunger type hydraulic pump with capacity (discharge flow) of 542 ltr/min for at rated engine rpm.,All spool valves externally mounted beside the hydraulic tank. Plunger type hydraulic pump with capacity (discharge flow) of 542 ltr/min for at rated engine rpm.,,,Blade angle,2 x 90 mm,Blade angle,2 x 110 mm,Blade angle,2 x 110 mm,Blade angle,2 x 110 mm,Blade angle,2 x 110 mm,Ripper lift,2 x 130 mm,Blade angle (SIGMADOZER),1 x 150 mm,Wheel brake locks,Switch-activated,,Emergency brakes,Automatically applied prior to hydraulic system pressure dropping below level required to meet secondary stopping requirements,,Wheel brake locks,Switch-activated,,Wheel brake locks,Switch-activated,,Secondary brakes,Automatically applied prior to hydraulic system pressure dropping below level required to meet secondary stopping requirements,,Total friction area per brake,103729 cm2,,Target area (inside length x width),8150 mm x 5800 mm,Payload,41000 kg,Payload,40000 kg,Payload,63000 kg,Payload,63000 kg,Payload,91700 kg,Target area (inside length x width),5250 mm x 2685 mm,Target area (inside length x width),5667 mm x 3194 mm,Relief Valve Setting,,Relief Valve Setting,,Travel,2 x axial piston motor with parking brake,Service brake,Hydraulic lock,Swing,1 x piston motor with swing holding brake,Implement circuits,355 kgf/cm3,Travel circuit,355 kgf/cm3,Swing,1 x piston motor with swing holding brake,Swing,1 x axial piston motor with swing holding brake,Swing,1 x axial piston motor with swing holding brake,Maximum drawbar pull,1700 kg,Swing,1 x axial piston motor with swing holding brake,,Hydraulic Motors,,Swing,1 x axial piston motor with swing holding brake,,Swing,1 x axial piston motor with swing holding brake,Swing,1 x axial piston motor with swing holding brake,,Implement circuits,380 kgf/cm3,,Implement circuits,355 kgf/cm3,,Swing,1 x axial piston motor with swing holding brake,Swing,1 x axial piston motor with swing holding brake,,Swing,1 x axial piston motor with swing holding brake,Swing,1 x axial piston motor with swing holding brake,,Swing flow rate,800 ltr/min,Swing,1 x axial piston motor with swing holding brake,Swing,1 x axial piston motor with swing holding brake,Swing,1 x axial piston motor with swing holding brake,Swing,1 x axial piston motor with swing holding brake,Swing,1 x axial piston motor with swing holding brake,Swing flow rate,"1,590 ltr/min",Swing,1 x axial piston motor with swing holding brake,Swing,1 x axial piston motor with swing holding brake,Swing,1 x axial piston motor with swing holding brake,Swing,1 x axial piston motor with swing holding brake,Travel control,2 foot pedals,Swing,1 x axial piston motor with swing holding brake,Swing,2 x axial piston motor with swing holding brake,Swing,2 x axial piston motor with swing holding brake,Travel control,2 foot pedals,Relief Valve Setting,,Travel control,2 foot pedals,Swing,2 x axial piston motor with swing holding brake,Swing,1 x piston motor with swing holding brake,Swing,1 x piston motor with swing holding brake,NET FLYWHEEL HORSEPOWER (MANUAL MODE):,NET FLYWHEEL HORSEPOWER (MANUAL MODE):,,P-mode,,,Parking brake,"Mechanical, dry, disc type actuated on transmission output shaft. Spring-applied and air-released.",,ELECTRICAL SYSTEM,"- Alternator, 12 Volt 40 Ampere.  - Batteries, 1 x 12 Volt, 80 Ah.  - Starting Motor, 12 Volt.",ELECTRICAL SYSTEM,"- Alternator, 12 Volt 40 Ampere.  - Batteries, 1 x 12 Volt, 80 Ah.  - Starting Motor, 12 Volt.",Maximum pump flow,75 l/min,,Breakout force,1275 kN  130000 kgf,,"Static tipping load, full turn",5460 kg,Breakout force,"11,000 kgf",Breakout force,106 kN  10840 kgf,Breakout force,131 kN  13380 kgf,"Static tipping load, full turn",8930 kg,,"Static tipping load, full turn",9780 kg,,"Static tipping load, full turn",9500 kg,"Static tipping load, full turn","13,435 kg",,"Static tipping load, full turn",13440 kg,,"Static tipping load, full turn","13,710 kg",,"Static tipping load, full turn",17400 kg,,"Static tipping load, full turn",17280 kg,,"Static tipping load, full turn","17,975 kg",,"Static tipping load, full turn",24885 kg,,"Static tipping load, full turn",26025 kg,,Breakout force,387 kN  39500 kgf,,"Static tipping load, full turn",37080 kg,,Oscillation,Rear axle oscillation angle 10°,,Front,"Fixed, full-floating",,Breakout force,677 kN  69000 kgf,,Breakout force,705 kN  71900 kgf,
Pump flow (litre/min),165,Pump flow (litre/min),165,Feeder,58 ltr/min,Ripper lift,1 x 180 mm,Ripper lift,1 x 180 mm,Control Valves:,Control Valves:,,,Travel motor,Variable capacity,All spool control valves externally mounted beside the hydraulic tank. Variable piston pump with capacity (discharge flow) of 366 ltr/min for implement at rated engine rpm.,All spool control valves externally mounted beside the hydraulic tank. Variable piston pump with capacity (discharge flow) of 366 ltr/min for implement at rated engine rpm.,,,,,,,,,Type,"Dual-path, hydrostatic transmission System",Relief valve setting,27.5 MPa  280 kg/cm²,,,Relief valve setting,27.5 MPa  280 kg/cm²,,,Ripper lift,1 x 110 mm,Travel speeds,,Travel speeds,,Ripper lift,1 x 125 mm,Ripper lift,125 mm,Travel speeds,,Ripper lift,2 x 130 mm,Parking brakes,"Spring-applied, hydraulically released, with speed application protection",,Wheel brake locks,Switch-activated,,Parking brakes,"Multiple disc, spring-applied, hydraulically released, dry brakes on inboard end of each wheel motor rotor shaft.",,Parking brakes,"Multiple disc, spring-applied, hydraulically released, dry brakes on inboard end of each wheel motor rotor shaft. Rated to hold on ±15% grade at maximum gross vehicle weight.",,Wheel brake locks,Switch-activated,,Traction system,Wheel Spin-Side Control,,Material,400 Brinell hardness high tensile strength steel,Target area (inside length x width),5590 mm x 3380 mm,Target area (inside length x width),5640 mm x 3380 mm,Target area (inside length x width),6600 mm x 3870 mm,Target area (inside length x width),6450 mm x 3870 mm,Target area (inside length x width),7070 mm x 5150 mm,Heating,Exhaust heating (option),Heating,Exhaust heating (option),Implement circuits,380 kgf/cm3,Implement circuits,380 kgf/cm3,Swing,2 x axial piston motor with swing holding brake,Parking brake,Mechanical disc brake,Relief Valve Setting,,Travel circuit,355 kgf/cm3,Swing circuit,276 kgf/cm3,Relief Valve Setting,,Relief Valve Setting,,Relief Valve Setting,,Gradeability,58 %,Relief Valve Setting,,,Travel,2 x axial piston motor with parking brake,Relief Valve Setting,,,Relief Valve Setting,,Relief Valve Setting,,,Travel circuit,380 kgf/cm3,,Travel circuit,380 kgf/cm3,,Relief Valve Setting,,Relief Valve Setting,,,Relief Valve Setting,,Relief Valve Setting,,,High pressure in line filters,200 microns,Relief Valve Setting,,Relief Valve Setting,,Relief Valve Setting,,Relief Valve Setting,,Relief Valve Setting,,High pressure in line filters,200 microns,Relief Valve Setting,,Relief Valve Setting,,Relief Valve Setting,,Relief Valve Setting,,Gradeability,50 %,Relief Valve Setting,,Relief Valve Setting,,Relief Valve Setting,,Gradeability,50 %,Implement circuits,270 kgf/cm3,Gradeability,50 %,Relief Valve Setting,,Relief Valve Setting,,Relief Valve Setting,,P-mode,,,Gear 1-3 @ 2000 rpm,135 kW / 180 HP,,Fuel tank,500 ltr,,TRANSMISSION,- Two speed hydrostatic transmission.  - Dual variable displacement pumps driving axial piston motors,TRANSMISSION,- Two speed hydrostatic transmission.  - Dual variable displacement pumps driving axial piston motors.,Option,120 l/min,,Drive system,Four-wheel drive,,Breakout force,64 kN  6530 kgf,Drive system,Four-wheel drive,Drive system,Four-wheel drive,Drive system,Four-wheel drive,Breakout force,131 kN  13375 kgf,,Breakout force,162 kN  16470 kgf,,Breakout force,154 kN  15720 kgf,Breakout force,"158 kN  16,100 kgf",,Breakout force,158 kN  16100 kgf,,Breakout force,"180 kN  18,400 kgf",,Breakout force,168 kN  17140 kgf,,Breakout force,168 kN  17140 kgf,,Breakout force,"212 kN  21,600 kgf",,Breakout force,267 kN  27200 kgf,,Breakout force,267 kN  27200 kgf,,Standard boom,3990 mm,,Breakout force,355 kN  36200 kgf,,Service brakes,Combined inch/brake pedal actuate on all four wheels via hydrostatic drive and dry disc at front axle,,Rear,"Centre-pin support, full-floating, 22° total oscillation",,Drive system,Four-wheel drive,,Drive system,Four-wheel drive,
Relief valve pressure (bar),250,Relief valve pressure (bar),250,Conveyor,38 ltr/min,Ripper tilt,1 x 200 mm,Ripper tilt,1 x 200 mm,"Spool control valves for SIGMADOZER, Semi-U tilt dozer and Full-U tilt dozer.","Spool control valves for SIGMADOZER, Semi-U tilt dozer and Full-U tilt dozer.",,,Travel speeds,,Relief valve setting . . . for implement,29.8 MPa  304 kg/cm²,,,,,,,,,Travel motor,Variable capacity,Control Valves:,Control Valves:,,,Control Valves:,Control Valves:,,,Type,"Dual-path, hydrostatic transmission System",Forward,0 - 9 km/h,Forward,0 - 9 km/h,Type,"Dual-path, hydrostatic transmission System",Pitch angle,38o- 52o,Forward,0 - 10.1 km/h,Travel speeds,,Electric dynamic retarder (max.),2387 kW / 3200 HP. Continuously rated high-density blown grids with retard at engine idle and retard in reverse propulsion,,Parking brakes,"Spring-applied, hydraulically released, with speed application protection",,Electric dynamic retarder (max.),3207 kW / 4300 HP,,Electric dynamic retarder (max.),4026 kW / 5400 HP. Continuously rated high-density blown grids with retard at engine idle and retard in reverse propulsion,,Parking brakes,"Multiple disc, spring-applied, hydraulically released, dry brakes on inboard end of each wheel motor rotor shaft. Rated to hold on ±15% grade at maximum gross vehicle weight.",,Service brakes,"Oil-cooled, hydraulic actuated, multiple disc brakes at each wheel",,Material thickness:,Material thickness:,Heating,Exhaust heating,Heating,Exhaust heating (option),Heating,Exhaust heating,Heating,Exhaust heating (option),Heating,Exhaust heating,Material,130 kg/mm2 high tensile strength steel,Material,130 kg/mm2 high tensile strength steel,Travel circuit,380 kgf/cm3,Travel circuit,380 kgf/cm3,Relief Valve Setting,,Driven by,Hydrostatic,Implement circuits,355 kgf/cm3,Swing circuit,276 kgf/cm3,Pilot circuit,33 kgf/cm3,Implement circuits,355 kgf/cm3,Implement circuits,380 kgf/cm3,Implement circuits,380 kgf/cm3,Travel speeds,2.3 / 4.3 km/h,Implement circuits,380 kgf/cm3,,Swing,2 x axial piston motor with swing holding brake,Implement circuits,380 kgf/cm3,,Implement circuits,380 kgf/cm3,Implement circuits,380 kgf/cm3,,Swing circuit,299 kgf/cm3,,Swing circuit,290 kgf/cm3,,Implement circuits,380 kgf/cm3,Implement circuits,380 kgf/cm3,,Implement circuits,380 kgf/cm3,Implement circuits,380 kgf/cm3,,Type,Squirrel cage induction motor,Implement circuits,265 kgf/cm3,Implement circuits,380 kgf/cm3,Implement circuits,265 kgf/cm3,Implement circuits,380 kgf/cm3,Implement circuits,380 kgf/cm3,System,24 V,Implement circuits,380 kgf/cm3,Implement circuits,380 kgf/cm3,Implement circuits,270 kgf/cm3,Implement circuits,380 kgf/cm3,Travel speed,Max 2.1 km/h,Implement circuits,270 kgf/cm3,Implement circuits - Backhoe,325 kgf/cm3,Implement circuits - Backhoe,325 kgf/cm3,Travel speed,Max 2.5 km/h,Travel circuit,270 kgf/cm3,Travel speed,Max 2.4 km/h,Implement circuits,320 kgf/cm3,Implement circuits,270 kgf/cm3,Implement circuits,270 kgf/cm3,Gear 1-3 @ 2000 rpm,118 kW / 158 HP,,Gear 4-6 @ 2000 rpm,150 kW / 200 HP,,Coolant,58 ltr,,TYRES,- 10 x 16.5 8 ply rating  - Spare rim and tyre,TYRES,- 10 x 16.5 8 ply rating  - Spare rim and tyre,No. of boom/bucket cylinders,2/1,,Front,"Fixed, full-floating",,Drive system,Four-wheel drive,Front,"Fixed, semi-floating",Front,"Fixed, semi-floating",Front,"Fixed, semi-floating",Drive system,Four-wheel drive,,Drive system,Four-wheel drive,,Drive system,Four-wheel drive,Drive system,Four-wheel drive,,Drive system,Four-wheel drive,,Drive system,Four-wheel drive,,Drive system,Four-wheel drive,,Drive system,Four-wheel drive,,Drive system,Four-wheel drive,,Drive system,Four-wheel drive,,Drive system,Four-wheel drive,,Drive system,Four-wheel drive,,Drive system,Four-wheel drive,,Parking brake,Dry disc,,Reduction gear,Spiral bevel gear,,Front,"Fixed, full-floating",,Front,"Fixed, full-floating",
​Related Information,​Efficient and powerful operation is obtained from the Syncro System CLSS system,Travel length (mm),5895,Option,28 ltr/min,Travel speeds,,Travel speeds,,Blade lift,"Raise, hold, lower, and float",,,Forward,0 - 8.5 km/h,Control Valves:,Control Valves:,,,,,,,,,Travel speeds,,Spool control valves for Semi-U tilt dozer and Full-U tilt dozer.,Spool control valves for Semi-U tilt dozer and Full-U tilt dozer.,,,Spool control valves for Super Dozer,Spool control valves for Super Dozer,,,Travel motor,Variable capacity,Reverse,0 - 9 km/h,Reverse,0 - 9 km/h,Travel speeds,,Travel speeds,,Reverse,0 - 13.0 km/h,Forward,0 - 11.3 km/h,Standard,ISO3471 (ROPS)  ISO3449 (FOPS),,Electric dynamic retarder (max.),2983 kW / 4000 HP. Continuously rated high-density blown grids with retard at engine idle and retard in reverse propulsion,,Standard,ISO3449 (ROPS)  ISO3449 (FOPS),,Standard,ISO3471 (ROPS)  ISO3449 (FOPS),,Electric dynamic retarder (max.),4026 kW / 5400 HP. Continuously rated high-density blown grids with retard at engine idle and retard in reverse propulsion,,Secondary brakes,Automatically applied prior to hydraulic system pressure dropping below level required to meet secondary stopping requirements. Meets ISO3450,,Bottom,19 mm,Material,160 kg/mm2 high tensile strength steel,Material,160 kg/mm2 high tensile strength steel,Material,160 kg/mm2 high tensile strength steel,Material,130 kg/mm2 high tensile strength steel,Material,400 Brinell hardness high tensile strength steel,Material thickness:,Material thickness:,Material thickness:,Material thickness:,Pilot circuit,33 kgf/cm3,Pilot circuit,33 kgf/cm3,Implement circuits,320 kgf/cm3,Swing reduction,Planetary gear,Travel circuit,355 kgf/cm3,Pilot circuit,33 kgf/cm3,Steering control,Two levers with pedals,Travel circuit,355 kgf/cm3,Travel circuit,380 kgf/cm3,Travel circuit,380 kgf/cm3,Service brake,Hydraulic lock,Travel circuit,380 kgf/cm3,,Fan,2 x axial piston motors,Travel circuit,380 kgf/cm3,,Travel circuit,380 kgf/cm3,Travel circuit,380 kgf/cm3,,Pilot circuit,33 kgf/cm3,,Pilot circuit,33 kgf/cm3,,Travel circuit,380 kgf/cm3,Travel circuit,380 kgf/cm3,,Travel circuit,380 kgf/cm3,Travel circuit,380 kgf/cm3,,Power Output,900 kW,Travel circuit,265 kgf/cm3,Travel circuit,380 kgf/cm3,Travel circuit,265 kgf/cm3,Travel circuit,380 kgf/cm3,Travel circuit,380 kgf/cm3,Batteries (Series/Parallel),2 x 2 x 12 V,Travel circuit,380 kgf/cm3,Travel circuit,380 kgf/cm3,Travel circuit,270 kgf/cm3,Travel circuit,380 kgf/cm3,Service brake,Hydraulic brake,Travel circuit,270 kgf/cm3,Implement circuit - Loading shovel,300 kgf/cm3,Implement circuit - Loading shovel,300 kgf/cm3,Service brake,Hydraulic brake,Swing circuit,210 kgf/cm3,Service brake,Hydraulic brake,Travel circuit,350 kgf/cm3,Travel circuit,270 kgf/cm3,Travel circuit,270 kgf/cm3,Gear 4-6 @ 2000 rpm,131 kW / 176 HP,,Gear 7-8 @ 2100 rpm,163 kW / 218 HP,,Engine,38 ltr,,HYDRAULICS & CONTROLS,- Komatsu Closed-center Load Sensing System (CLSS).  - Auxiliary circuit for attachments.,HYDRAULICS & CONTROLS,- Komatsu Closed-center Load Sensing System (CLSS).  - Auxiliary circuit for attachments.  - Additional 'Super Flow' circuit for high flow attachments,Type,Double-action,,Rear,"Centre-pin support, full-floating, 16° total oscillation",,Front,"Fixed, semi-floating",Rear,"Center-pin support, semi-floating, 24° total oscillation",Rear,"Centre-pin support, semi-floating, 24° total oscillation",Rear,"Centre-pin support, semi-floating, 24° total oscillation",Front,"Fixed, semi-floating",,Front,"Fixed, semi-floating",,Front,"Fixed, semi-floating",Front,"Fixed, semi-floating",,Front,"Fixed, semi-floating",,Front,"Fixed, semi-floating",,Front,"Fixed, semi-floating",,Front,"Fixed, semi-floating",,Front,"Fixed, semi-floating",,Front,"Fixed, full-floating",,Front,"Fixed, full-floating",,Front,"Fixed, full-floating",,Front,"Fixed, full-floating",,Hydraulic pump,"Piston pump, in common with loader control",,Differential gear,Straight bevel gear,,Rear,"Centre-pin support, full-floating, 22° total oscillation",,Rear,"Centre-pin support, full-floating, 20° total oscillation",
Transmission type,Full Power Shift,Travel height (mm),3780,Operating weight,"3,400 kg",Forward,0 - 11.6 km/h,Forward,0 - 11.6 km/h,Blade tilt,"Right, hold, and left",,,Reverse,0 - 8.5 km/h,Spool control valves for Semi-U tilt dozer and Full-U tilt dozer.,Spool control valves for Semi-U tilt dozer and Full-U tilt dozer.,,,,,,,,,Forward,0 - 8.5 km/h,Blade lift,"Raise, hold, lower, and float",,,Blade lift,"Raise, hold, lower, and float",,,Travel speeds,,Type,"Planetary gear, double-reduction",Type,"Planetary gear, double-reduction",Forward,0 - 11.2 km/h,Forward,0 - 11.3 km/h,Type,Hydrostatic Steering system,Reverse,0 - 13.6 km/h,Radiator frontal area,4.65 m2,,Standard,SAEJ1040 (ROPS)  ISO3449 (FOPS),,Radiator frontal area,6.24 m2,,Alternator,GTA-39,,Standard,ISO3471 (ROPS)  ISO3449 (FOPS),,Wheel brake locks,Switch-activated,,Front,12 mm,Material thickness:,Material thickness:,Material thickness:,Material thickness:,Material thickness:,Material thickness:,Material thickness:,Material thickness:,Material thickness:,Material thickness:,Bottom,14 mm,Bottom,16 mm,Hydraulic Cylinders,Bore x Stroke x Rod diameter,Hydraulic Cylinders,Bore x Stroke x Rod diameter,Travel circuit,350 kgf/cm3,Swing circle lubrication,Grease-bathed,Swing circuit,298 kgf/cm3,Hydraulic Cylinders,Bore x Stroke x Rod diameter,Drive method,Fully hydrostatic,Swing circuit,298 kgf/cm3,Swing circuit,295 kgf/cm3,Swing circuit,295 kgf/cm3,Driven by,Hydraulic motor,Swing circuit,295 kgf/cm3,,Relief Valve Setting,,Swing circuit,295 kgf/cm3,,Swing circuit,295 kgf/cm3,Swing circuit,295 kgf/cm3,,Hydraulic Cylinders,Bore x Stroke x Rod diameter,,Hydraulic Cylinders,Bore x Stroke x Rod diameter,,Swing circuit,295 kgf/cm3,Swing circuit,295 kgf/cm3,,Swing circuit,295 kgf/cm3,Swing circuit,285 kgf/cm3,,Voltage,6.000 - 7.200 V,Swing circuit,220 kgf/cm3,Swing circuit,285 kgf/cm3,Swing circuit,220 kgf/cm3,Swing circuit,285 kgf/cm3,Swing circuit,285 kgf/cm3,Alternator,260 A,Swing circuit,285 kgf/cm3,Swing circuit,295 kgf/cm3,Swing circuit,220 kgf/cm3,Swing circuit,285 kgf/cm3,Parking brake,"Wet, multiple-disc",Swing circuit,220 kgf/cm3,Travel circuit,350 kgf/cm3,Travel circuit,350 kgf/cm3,Parking brake,"Wet, multiple-disc",Hydraulic Cylinders,Bore x Stroke x Rod diameter,Parking brake,"Wet, multiple-disc",Swing circuit,290 kgf/cm3,Swing circuit,215 kgf/cm3,Swing circuit,215 kgf/cm3,Gear 7-8 @ 2100 rpm,144 kW / 193 HP,,E-mode,,,Transmission,25 ltr,,OPERATOR ENVIRONMENT,"- ROPS/FOPS cabin with side guards.  - Seat, suspension type with safety switch.  - Retractable seat belt.  - Safety bar with built in gauges and safety switch.  - Servo controls for direction and loader actuation.  - Bucket float.  - Horn.  - Travel alarm.  - Hand and foot throttle.",OPERATOR ENVIRONMENT,"- ROPS/FOPS cabin with side guards.  - Seat, suspension type with safety switch.  - Retractable seat belt.  - Safety bar with built in gauges and safety switch.  - Servo controls for direction and loader actuation.  - Bucket float.  - Horn.  - Travel alarm.  - Hand and foot throttle.",Bore diameter × stroke:,,,Reduction gear,Spiral bevel gear,,Rear,"Centre-pin support, semi-floating, 16° total oscillation",Reduction gear,Spiral bevel gear,Reduction gear,Spiral bevel gear,Reduction gear,Spiral bevel gear,Rear,"Centre-pin support, semi-floating, 24° total oscillation",,Rear,"Centre-pin support, semi-floating, 24° total oscillation",,Rear,"Centre-pin support, semi-floating, 24° total oscillation",Rear,"Centre-pin support, semi-floating, 26° total oscillation",,Rear,"Centre-pin support, semi-floating, 26° total oscillation",,Rear,"Centre-pin support, semi-floating, 18° total oscillation",,Rear,"Centre-pin support, semi-floating, 26° total oscillation",,Rear,"Centre-pin support, semi-floating, 26° total oscillation",,Rear,"Centre-pin support, semi-floating, 26° total oscillation",,Rear,"Centre-pin support, full-floating, 24° total oscillation",,Rear,"Centre-pin support, full-floating, 20° total oscillation",,Rear,"Centre-pin support, full-floating, 26° total oscillation",,Rear,"Centre-pin support, full-floating, 22° total oscillation",,Capacity (at rated rpm),53 ltr/min,,Final reduction gear,"Planetary gear, single reduction, oil bath",,Reduction gear,Spiral bevel gear,,Reduction gear,Spiral bevel gear,
Drive,2WD / 4WD,Width (mm),2320,Seal of track,Sealed track,Reverse,0 - 14 km/h,Reverse,0 - 14 km/h,Additional control valve required for variable digging angle multi-shank ripper and giant ripper.,Additional control valve required for variable digging angle multi-shank ripper and giant ripper.,,,Type,Two-stage planetary gear,Blade lift,"Raise, hold, lower, and float",,,,,,,,,Reverse,0 - 8.5 km/h,Blade tilt,"Right, hold, and left",,,Blade tilt,"Right, hold, and left",,,Forward,0 - 9 km/h,Sprocket,Segmented sprocket teeth are bolt-on,Sprocket,Segmented sprocket teeth are bolt-on,Reverse,0 - 13.4 km/h,Reverse,0 - 13.6 km/h,Minimum turning radius,1.99 - 2.24 m,Type,Hydrostatic Steering system,Alternator,GTA-49,,Radiator frontal area,6.24 m2,,Alternator,GTA-51,,Dual fan main blower,453 m³/min,,Radiator frontal area,7.02 m2,,Parking brakes,"Multiple disc, spring-applied, hydraulically released, dry brakes on inboard end of each wheel motor rotor shaft. Rated to hold on ±15% grade at maximum gross vehicle weight.",,Sides,9 mm,Bottom,25 mm,Bottom,19 mm,Bottom,25 mm,Bottom,19 mm,Bottom,19 mm,Front,8 mm,Front,8 mm,Boom,2-120 mm x 1334 mm x 85 mm,Boom,2-140 mm x 1480 mm x 100 mm,Swing circuit,280 kgf/cm3,Service brake,Hydraulic lock,Pilot circuit,33 kgf/cm3,Boom,2-105 mm x 1055 mm x 70mm,Maximum drawbar pull,123 kN 12500 kgf,Pilot circuit,33 kgf/cm3,Pilot circuit,33 kgf/cm3,Pilot circuit,33 kgf/cm3,Service brake,Hydraulic lock,Pilot circuit,33 kgf/cm3,,Implement circuits,300 kgf/cm3,Pilot circuit,33 kgf/cm3,,Pilot circuit,33 kgf/cm3,Pilot circuit,33 kgf/cm3,,Boom,2-130 mm x 1385 mm x 90 mm,,Boom,2-120 mm x 1385 mm,,Pilot circuit,33 kgf/cm3,Pilot circuit,33 kgf/cm3,,Pilot circuit,33 kgf/cm3,Pilot circuit,33 kgf/cm3,,Amperage,96 A - 80 A,Pilot circuit,32 kgf/cm3,Pilot circuit,33 kgf/cm3,Pilot circuit,32 kgf/cm3,Pilot circuit,33 kgf/cm3,Pilot circuit,33 kgf/cm3,Standard working lights,14 LED lights,Pilot circuit,33 kgf/cm3,Pilot circuit,33 kgf/cm3,Pilot circuit,32 kgf/cm3,Pilot circuit,33 kgf/cm3,System,24 V,Pilot circuit,32 kgf/cm3,Swing circuit,260 kgf/cm3,Swing circuit,260 kgf/cm3,System,24 V,Boom,1-120 mm x 1015 mm x 70 mm,System,24 V,Heavy lift circuit,350 kgf/cm3,Pilot circuit,33 kgf/cm3,Steering control,Two levers with pedals,E-mode,,,Gear 1-6 @ 2000 rpm,135 kW / 180 HP,,Final drive,63 ltr,,OTHER STANDARD EQUIPMENT,"- Wiring for rear lights.  - Painting, Komatsu standard colouring.  - Tilt over cabin for ease of servicing.  - Komatsu Machine Tracking System, (KOMTRAX).",OTHER STANDARD EQUIPMENT,"- Wiring for rear lights.  - Painting, Komatsu standard colouring.  - Tilt over cabin for ease of servicing.  - Komatsu Machine Tracking System, (KOMTRAX).",Boom cylinder,80 × 714 mm,,Differential gear,Straight bevel gear,,Reduction gear,Spiral bevel gear,Differential gear,Torque proportioning,Differential gear,Torque proportioning,Differential gear,Torque proportioning,Reduction gear,Spiral bevel gear,,Reduction gear,Spiral bevel gear,,Reduction gear,Spiral bevel gear,Reduction gear,Spiral bevel gear,,Reduction gear,Spiral bevel gear,,Reduction gear,Spiral bevel gear,,Reduction gear,Spiral bevel gear,,Reduction gear,Spiral bevel gear,,Reduction gear,Spiral bevel gear,,Reduction gear,Spiral bevel gear,,Reduction gear,Spiral bevel gear,,Reduction gear,Spiral bevel gear,,Reduction gear,Spiral bevel gear,,Relief valve setting,17.5 MPa  178.6 kgf/cm2,,Service brakes,"Hydraulically actuated, wet disc brakes actuate on four wheels",,Differential gear,Straight bevel gear,,Differential gear,Conventional type,
