Final drive (each side),3.5 ltr,D85EXi-18,660 mm,Final drive (each side),31 ltr,DEF tank,None,Fuel tank,372 ltr,Fuel tank,400 ltr,Coolant,35 ltr,Cranking motors,Two 24 V,,Swing reduction,Planetary gear,Fuel tank,415 ltr,Hydraulic tank,60 ltr,Final drive (each side),8.1 ltr,Final drive (each side),24 - 27 ltr,"Maximum blade angle, right or left",90 degrees,,Side plate thickness,25 mm,,,,Top and bottom plate thickness,32 mm,,No. cutting edges,2,,HYDRAULICS & CONTROLS,"- SyncroSystem, Closed Load Sensing System (CLSS)  - Variable displacement axial piston pump and Load Independent Flow Divider.  - Proportional Pressure Controls (PPC) lock switch.  - Load Stabiliser System (LSS)  - Electro-hydraulic differential lock.  - Loader  - Proportional Pressure Controls (PPC) servo control type.  - Speed up function, self levelling and transmission kickdown.  - Bucket positioner, automatic (return to dig).  - Boom positioner / kickout.  - Backhoe (Sideshift arrangement)  - Proportional Pressure Controls (PPC) servo control type.  - Proportional Pressure Controls (PPC) servo control for stabilisers.  - Hydraulic sideshift.  - Power and Economy work mode selection.  - Electro-hydraulic boom lock and slide frame release lock.  - Swing transport lock and hydraulic cushions.  - Burst valve protection (boom and arm).  - Hammer piping (one way flow).  - Quick hitch piping, factory fitted.",Right,2000 mm,,Hoist cylinder,"Twin, two-stage telescopic type",Rail depth (minimum),864 mm,,Rail depth (minimum),864 mm,,Type,"Double-acting, piston type",,Hoist cylinder,"Twin, two-stage telescopic type",Hydraulic pump,Piston pump,,Hoist cylinder,"Twin, two-stage telescopic type",Swing reduction,Planetary gear,Type,Box-sectioned structure,Capacity (at rated rpm),4 x 230 L/min,,Swing reduction,Planetary gear,Service brake,Electric brake,Swing reduction,Planetary gear,,Swing reduction,Planetary gear,,Swing reduction,Planetary gear,Swing reduction,Planetary gear,,Service brake,Hydraulic lock,,Swing reduction,Planetary gear,Swing reduction,Planetary gear,Swing reduction,Planetary gear,,Service brake,Electric brake,Swing reduction,Planetary gear,Capacity,405 ltr/min,,Type,"Double-acting, piston type",,Hydraulic pump,Piston pump,,Swing reduction,Planetary gear,Swing reduction,Planetary gear,,Engine oil,290 ltr,Number of carrier rollers (each side),3,Bottom Dump,2-180 mm x 600 mm,Hydraulic motors and drives,1,Drive method,Fully hydrostatic,Driven by,Hydraulic motors,Number of shoes (each side),48,Swing lock,Mechanical disc brake,,Driven by,Hydrostatic,Driven by,Hydrostatic,Swing reduction,Planetary gear,Swing reduction,Planetary gear,Hydraulic pump,Piston pump,,Number of carrier rollers (each side),3,Hydraulic pump,Piston pump,,Engine oil,50 ltr,Type,Box-sectioned structure. Integral front bumper,Top and bottom plate thickness,32 mm,,Hydraulic pump,Piston pump,,Engine oil,35 ltr,Hydraulic pump,Piston pump,,Hydraulic pump,Piston pump,,Hydraulic pump,Piston pump,,Hydraulic pump,Piston pump,,Hydraulic pump,"Piston pump, in common with steering system",,Hydraulic pump,"Piston pump, in common with steering system",,Capacity,54 ltr/min,Hydraulic pump,Gear type pump,Hydraulic pump,Piston pump,,Capacity,78 ltr/min,"Bucket cylinder, bore x stroke",85 mm x 522 mm,,Hoist cylinder,"Twin, two-stage telescopic type",Loader Control:,Loader Control:,Swing reduction,Planetary gear,,,Hydraulic pump,"Piston pump, in common with steering system",Number of carrier rollers (each side),1,Operating brakes,"Combined inch brake pedal actuates maintenance free, wet multi-disc type brakes in the front axle Self-braking via the hydrostatic drive",,,,Hydraulic motor,,Swing reduction,Planetary gear,Engine,11.5 ltr,Engine,11.5 ltr,Swing reduction,Planetary gear,Swing lock,Mechanical disc brake,Swing reduction,Planetary gear,Swing circle lubrication,Grease-bathed,Swing speed,11.0 rpm,Ripper tilt cylinder bore,225 mm,,,Swing reduction,Planetary gear,Minimum turning radius,4.6 m,,,Swing reduction,Planetary gear,,,Hydraulic Oil Capacity (Refill):,Hydraulic Oil Capacity (Refill):,,,Number of ripper tilt cylinders,2,,,,,,,,,Ground pressure,1.03 kg/cm2
DEF tank,None,D85PXi-18,910 mm,"Transmission, bear gear, and steering system",90 ltr,Operating weight,"D85EX-15EO 28,100 kg  D85PX-15EO 27,650 kg",Engine oil,27 ltr,Radiator,28 ltr,Fuel tank,270 ltr,Plate material,482.6 MPa tensile strength steel,,Swing circle lubrication,Grease-bathed,Engine oil,30.5 ltr,Final drive (each side),3.5 ltr,Hydraulic tank,101 ltr,DEF tank,None,Blade tip angle,40° forward / 5° backward,,Drive axle mounting,Pin and spherical bushing,,,,Side plate thickness - rear,16 mm,,Length,2438 mm,,OPERATOR ENVIRONMENT,"- Large wide view ROPS / FOPS ergonomic cabin.  - Two door cabin with fully opening rear window.  - Steering wheel, adjustable.  - Air suspension seat, fabric covered.  - Seat belt, 78mm, retractable.  - Safe position seat sensor.  - Easy to view gauge and switch clusters.  - Air conditioner.  - Rear view mirrors, inside and out.  - Floor mat.  - Tinted windows  - AM/FM/CD/MP3 radio, domestic frequency range.",Left,2000 mm,,Relief pressure,20.6 MPa  210 kg/cm2,Top and bottom plate thickness,45 mm,,Top and bottom plate thickness,32 mm,,Number of boom cylinders,2,,Relief pressure,20.6 MPa  210 kg/cm2,Capacity,260 ltr/min,,Relief pressure,20.6 MPa  210 kg/cm2,Swing circle lubrication,Grease-bathed,Fuel tank,800 ltr,Relief valve setting,34.3 MPa  350 kgf/cm2,,Swing circle lubrication,Grease-bathed,Swing lock,Mechanical disc brake,Swing circle lubrication,Grease-bathed,,Swing circle lubrication,Grease-bathed,,Swing circle lubrication,Grease-bathed,Swing circle lubrication,Grease-bathed,,Swing lock,Mechanical disc brake,,Swing circle lubrication,Grease-bathed,Swing circle lubrication,Grease-bathed,Swing circle lubrication,Grease-bathed,,Swing lock,Mechanical disc break,Swing circle lubrication,Grease-bathed,Relief valve setting,31.4 MPa  320 kgf/cm2,,Number of boom cylinders,2,,Capacity,239 + 239 ltr/min,,Swing circle lubrication,Grease-bathed,Swing circle lubrication,Grease-bathed,,Hydraulic system,"5,900 ltr",Number of track rollers (each side),8,Travel Gear,Planetary gear,"Swing brake, service",Hydraulic brake,Maximum drawbar pull,686 kN 70000 kgf,Swing reduction,Planetary gear,Number of carrier rollers (each side),3,Swing speed,11.0 rpm,,Swing reduction,Planetary gear,Swing reduction,Planetary gear,Swing circle lubrication,Grease-bathed,Swing circle lubrication,Grease-bathed,Capacity,320 ltr/min,,Number of track rollers (each side),7,Capacity,320 ltr/min,,"Torque converter, transmission and retarder cooling",125 ltr,Fuel tank,2120 ltr,Side plate thickness,19 mm,,Capacity,239 + 239 ltr/min,,"Torque converter, transmission and retarder cooling",80 ltr,Capacity,260 ltr/min,,Capacity,205 ltr/min,,Capacity,205.5 ltr/min,,Capacity,260 ltr/min,,Capacity,180 ltr/min,,Capacity,150 ltr/min,,Relief valve setting,20.6 MPa  210 kgf/cm2,Capacity,61 ltr/min,Capacity,205 ltr/min,,Relief valve setting,20.6 MPa  210 kgf/cm2,Control valve,3-spool type,,Relief pressure,20.6 MPa  210 kg/cm2,Hydraulic pump,Gear type pump,Swing circle lubrication,Grease-bathed,,,Capacity,123 ltr/min,Number of track rollers (each side),7,Parking brake,Integrated wet multi-disc type brake,,,,Swing reduction,Planetary gear,Swing circle lubrication,Grease-bathed,"Final drive, each side",2.1 ltr,"Differential, each side",9 ltr,Swing circle lubrication,Grease-bathed,Swing speed,10 rpm,Swing circle lubrication,Grease-bathed,Swing lock,Mechanical disc,Center frame,X-frame leg,Hydraulic Oil Capacity (Refill):,Hydraulic Oil Capacity (Refill):,,,Swing circle lubrication,Grease-bathed,Gear,Forward,Reverse,,Swing circle lubrication,Grease-bathed,,,SIGMADOZER or Semi-U dozer or Full-U dozer,130 ltr,,,Ripper tilt cylinder bore,180 mm,,,,,,,,,Coolant,104 ltr
Operating weight,"7,670 - 8,540 kg",Ground contact area:,,DEF tank,None,,,Final drive (each side),8.1 ltr,Engine,26 ltr,Engine oil,20 ltr,Casting material,620.5 MPa tensile strength steel,,Swing lock,Mechanical disc brake,Final drive (each side),16.5-22 ltr,DEF tank,None,DEF tank,20.6 ltr,Operating weight,"19,510 - 21,890 kg",Service brake,"Foot operated, sealed oil disc brakes, hydraulically actuated on four tandem wheels.",,Drive axle alignment,Swing link between frame and axle,,,,Side plate thickness - front,16 mm,,Height,254 mm,,OTHER STANDARD EQUIPMENT,"- Back-up alarm.  - Engine shut-off system, electric.  - Painting, Komatsu standard colouring.  - Marks and plates, English (Aus & NZ).  - Battery isolation switch.  - Cap lock and cover lock.  - Internal storage.  - Dual LED beacons, rotating type with guards.  - Komatsu Machine Tracking System, (KOMTRAX).  - Fire extinguisher.",Maximum lift above ground,480 mm,,Hoist time,11.5 sec,Side plate thickness,25 mm,,Side plate thickness,16 mm,,"Boom cylinder, bore x stroke",360 mm x 1835 mm,,Hoist time,10 sec,Relief valve setting,34.3 MPa  350 kgf/cm2,,Hoist time,,Service brake,Hydraulic lock,Engine oil,80 ltr,Hydraulic Cylinders:,Hydraulic Cylinders:,,Service brake,Hydraulic lock,Swing speed,9.5 rpm,Service brake,Hydraulic lock,,Service brake,Hydraulic lock,,Service brake,Hydraulic lock,Service brake,Hydraulic lock,,Center frame,X-frame leg,,Service brake,Hydraulic lock,Service brake,Hydraulic lock,Service brake,Hydraulic lock,,Swing speed,12.4 rpm,Service brake,Hydraulic lock,Hydraulic Cylinders:,Hydraulic Cylinders:,,"Boom cylinder, bore x stroke",225 mm x 1196 mm,,Relief valve setting,34.3 MPa  350 kgf/cm2,,Service brake,Hydraulic lock,Service brake,Hydraulic lock,,Hydraulic oil tank,"3,900 ltr",Fuel tank,"13,925 ltr",Gradeability,65 %,"Service brake, parking","Wet, multiple-disc",Gradeability,70 %,Swing circle lubrication,Grease-bathed,Number of track rollers (each side),7,Center frame,X-frame leg,,Swing circle lubrication,Grease-bathed,Swing circle lubrication,Grease-bathed,Service brake,Hydraulic lock,Service brake,Hydraulic lock,Relief valve setting,34.3 MPa  350 kgf/cm2,,Fuel tank,"10,355 ltr",Relief valve setting,34.3 MPa  350 kgf/cm2,,Differentials (total),108 ltr,Engine oil,230 ltr,Drive axle mounting,Pin and spherical bushing,,Relief valve setting,34.3 MPa  350 kgf/cm2,,Differentials (total),71.5 ltr,Relief valve setting,34.3 MPa  350 kgf/cm2,,Relief valve setting,31.4 MPa  320 kgf/cm2,,Relief valve setting,31.4 MPa  320 kgf/cm2,,Relief valve setting,34.3 MPa  350 kgf/cm2,,Relief valve setting,30.4 MPa  310 kgf/cm2,,Relief valve setting,31.4 MPa  320 kgf/cm2,,Hydraulic Cylinders:,Hydraulic Cylinders:,Relief valve setting,20.6 MPa  210 kgf/cm2,Relief valve setting,31.4 MPa  320 kgf/cm2,,Hydraulic Cylinders:,Hydraulic Cylinders:,Hydraulic Cycle Time: (rated load in bucket),Hydraulic Cycle Time: (rated load in bucket),,Hoist time,10 sec,Capacity,54 ltr/min 14.3 U.S gal/min at rated rpm,Service brake,Hydraulic lock,,,Relief valve setting,20.6 MPa  210 kgf/cm2,Shoe size & type,500 mm steel city pattern,Cooling system,22.3 ltr,,,,Swing circle lubrication,Grease-bathed,Service brake,Hydraulic lock,Swing drive,2.5 ltr,Swing drive,2.8 ltr,Service brake,Hydraulic lock,Center frame,X-frame leg,Service brake,Hydraulic lock,Swing speed,10 rpm,Track frame,Box-bathed,Semi-U dozer,180 ltr,,,Service brake,Hydraulic lock,1st,3.3 km/h,4.2 km/h,,Service brake,Hydraulic lock,,,Ripper Equipment (Additional Volume):,Ripper Equipment (Additional Volume):,,,Hydraulic Oil Capacity (Refill):,Hydraulic Oil Capacity (Refill):,,,,,,,,,Fuel tank,625 ltr
,,D85EXi-18,40.260 cm2,Operating weight,"39,500 kg",,,Hydraulic tank,101 ltr,"Final drive, each side",4.5 ltr,Hydraulic tank,63 ltr,Rail width,305 mm,,Swing speed,12 rpm,"Torque converter, transmission, bevel gear, and steering system",48 ltr,Operating weight,"9,040 - 9,480 kg",Operating weight,"19,647 kg",,,Parking brake,"Manually actuated, spring applied, hydraulically released caliper.",,Steering,Accumulator assisted twin double acting cylinders provide constant rate steering. Emergency steering automatically applied by accumulator.,,,,Drive axle mounting,Pin and spherical bushing,,Thickness,25 mm,,WORK EQUIPMENT,"- Loader  - Multi Purpose bucket.  - Backhoe  - Boom, ""S"" shape type.  - Arm, telescopic type.  - Bucket solutions are available on request.",Maximum cutting depth,615 mm,,Type,Box-sectioned structure,Drive axle mounting,Pin and spherical bushing,,Drive axle mounting,Pin and spherical bushing,,Number of bucket cylinders,2,,Type,Box-sectioned structure,Hydraulic Cylinders:,Hydraulic Cylinders:,,Raise,13 sec,Swing lock,Mechanical disc brake,"Torque converter, transmission and retarder cooling",215 ltr,Type,"Double-acting, piston type",,Swing lock,Mechanical disc brake,Center frame,X-frame leg,Swing lock,Mechanical disc brake,,Swing lock,Mechanical disc brake,,Swing lock,Mechanical disc brake,Swing lock,Mechanical disc brake,,Track frame,Box-section,,Swing lock,Mechanical disc brake,Swing lock,Mechanical disc brake,Swing lock,Mechanical disc brake,,Center frame,X-frame leg,Swing lock,Mechanical disc brake,Type,"Double-acting, piston type",,Number of bucket cylinders,1,,Hydraulic Cylinders:,Hydraulic Cylinders:,,Swing lock,Mechanical disc brake,Swing lock,Mechanical disc brake,,DEF tank,587ltr,Coolant,2 x 430 ltr,Travel speeds,1.7 / 2.7 km/h,Swing ring teeth,External,Travel speeds,2.1 / 3.2 km/h,Swing lock,Oil disc brake,Fuel tank,"13,033 ltr",Track frame,Box-section,,Service brake,Hydraulic lock,Service brake,Hydraulic lock,Swing lock,Mechanical disc brake,Swing lock,Mechanical disc brake,Hydraulic Cylinders:,Hydraulic Cylinders:,,Coolant,2 x 360 ltr,Hydraulic Cylinders:,Hydraulic Cylinders:,,Final drives (total),32 ltr,Differential,439 ltr,Drive axle alignment,Swing link between frame and axle,,Hydraulic Cylinders:,Hydraulic Cylinders:,,Final drives (total),23 ltr,Hydraulic Cylinders:,Hydraulic Cylinders:,,Hydraulic Cylinders:,Hydraulic Cylinders:,,Hydraulic Cylinders:,Hydraulic Cylinders:,,Hydraulic Cylinders:,Hydraulic Cylinders:,,Hydraulic Cylinders:,Hydraulic Cylinders:,,Hydraulic Cylinders:,Hydraulic Cylinders:,,Type,"Double-acting, piston type",Hydraulic Cylinders:,Hydraulic Cylinders:,Hydraulic Cylinders:,Hydraulic Cylinders:,,Type,"Double-acting, piston type",Raise,5.3 sec,,Type,Box-sectioned structure,Relief valve setting,"20.6 MPa 210 kgf/cm2 3,000 psi",Swing lock,Mechanical disc brake,,,Hydraulic Cylinders:,Hydraulic Cylinders:,Fuel tank,195 ltr,Fuel tank,110 ltr,,,,Service brake,Hydraulic lock,Swing lock,"Wet, multiple-disc brake",Hydraulic tank,90 ltr,Hydraulic tank,140 ltr,Swing lock,Mechanical disc brake,Track frame,Box-section,Swing lock,Mechanical disc brake,Center frame,X-frame leg,Track type,Sealed track,U tilt dozer,180 ltr,,,Swing lock,Mechanical disc brake,2nd,6.2 km/h,8.0 km/h,,Swing lock,Mechanical disc brake,,,Giant ripper,38 ltr,,,Semi-U dozer or U dozer,130 ltr,,,,,,,,,Engine oil,37 ltr
,,D85PXi-18,63.340 cm2,,,,,DEF tank,None,Hydraulic system,209 ltr,Final drive (each side),4.0 ltr,Rail depth (minimum),864 mm,,Centre frame,X-frame leg,DEF tank,23.5 ltr,,,,,,,Fuel tank,390 ltr,,Turning circle diameter (SAE),29.7 m,,,,Drive axle alignment,Swing link between frame and axle,,FRONT FRAME STRUCTURE,FRONT FRAME STRUCTURE,,MATERIALS,- Operation and maintenance manual.  - Parts book.,"Maximum blade angle, right or left",90°,,Fuel tank,780 ltr,Drive axle alignment,Swing link between frame and axle,,Drive axle alignment,Swing link between frame and axle,,"Bucket cylinder, bore x stroke",300 mm x 985 mm,,Fuel tank,456 ltr,Type,"Double-acting, piston type",,Lower,14 sec,Swing speed,9.5 rpm,Differentials,95 ltr,"Number of cylinders, bore x stroke:",,,Swing speed,9.5 rpm,Track frame,Box-section,Swing speed,9.5 rpm,,Swing speed,11.7 rpm,,Swing speed,10.5 rpm,Swing speed,10.5 rpm,,Track type,Sealed track,,Swing speed,12.4 rpm,Swing speed,9.5 rpm,Swing speed,12.4 rpm,,Track frame,Box-section,Swing speed,11.7 rpm,Number of boom cylinders,2,,"Bucket cylinder, bore x stroke",280 mm x 729 mm,,Type,"Double-acting, piston type",,Swing speed,9.1 rpm,Swing speed,12.4 rpm,,Operating weight,"393,000 - 409,000 kg",Engine oil,2 x 290 ltr,Parking brake,Mechanical disc brake,Swing speed,4.6 rpm,Service brake,Hydraulic lock,Swing speed,6.8 rpm,Coolant,2 x 440 ltr,Track type,Sealed track,,Swing lock,Oil disc brake,Swing lock,Oil disc brake,Swing speed,9.1 rpm,Swing speed,9.1 rpm,Type,"Double-acting, piston type",,Engine oil,2 x 190 ltr,Type,"Double-acting, piston type",,Hydraulic system,167 ltr,Final drives (total),214 ltr,Steering,Accumulator assisted with twin double acting cylinders provide constant rate steering. Secondary steering automatically supplied by accumulator,,Type,"Double-acting, piston type",,Hydraulic system,103 ltr,Type,"Double-acting, piston type",,Type,"Double-acting, piston type",,Type,"Double-acting, piston type",,Type,"Double-acting, piston type",,Type,"Double-acting, piston type",,Type,"Double-acting, piston type",,Number of boom cylinders,2,Type,"Double-acting, piston type",Type,"Double-acting, piston type",,Number of boom cylinders,2,Dump,1.0 sec,,Fuel tank,484 ltr,Hydraulic Cylinders:,Hydraulic Cylinders:,Swing speed,12 rpm,,,Type,"Double-acting, piston type",Coolant,12.4 ltr,Engine,10.5 ltr,,,,Swing lock,"Wet, multiple-disc brake",Swing speed,11.0 rpm,DEF tank,None,DEF tank,None,Swing speed,9 rpm,Track type,Sealed track,Swing speed,9 rpm,Track frame,Box-section,Track adjuster,Hydraulic,Ripper Equipment (Additional Volume):,Ripper Equipment (Additional Volume):,,,Swing speed,9 rpm,3rd,11.2 km/h,14.0 km/h,,Swing speed,9 rpm,,,Multi-shank ripper,38 ltr,,,Ripper Equipment (Additional Volume):,Ripper Equipment (Additional Volume):,,,,,,,,,Final drive (each side),31 ltr
,,Ground pressure:,,,,,,Operating weight,"17,890 - 20,527 kg",,,DEF tank,None,Top and bottom plate thickness,45 mm,,Track frame,Box-section,Operating weight,"20,740 - 24,293 kg",,,,,,,DEF tank,37 ltr,,Reservoir,947 ltr,,,,Steering,Accumulator assisted with twin double acting cylinders provide constant rate steering. Secondary steering automatically supplied by accumulator.,,Frames are articulated by two hydraulic cylinders. Box-sectioned front and rear frames are steel plate welded construction and connected with an articulation pin. One-piece-frame design for the front frame in which hydraulic piping is installed offering excellent front visibility for more precise operations.,Frames are articulated by two hydraulic cylinders. Box-sectioned front and rear frames are steel plate welded construction and connected with an articulation pin. One-piece-frame design for the front frame in which hydraulic piping is installed offering excellent front visibility for more precise operations.,,WARRANTY,"- Premium warranty 36 months / 6,000 hours.  ""Specification on either backhoe variant unit is subject to change without notice""",Blade tip angle,40° forward / 5° backward,,Engine oil,80 ltr,Steering,Accumulator assisted twin double acting cylinders provide constant rate steering. Emergency steering automatically applied by accumulator.,,Steering,Accumulator assisted with twin double acting cylinders provide constant rate steering. Secondary steering automatically supplied by accumulator,,Control valve,2-spool type,,DEF tank,34.7 ltr,Number of boom cylinders,2,,Type,Box-sectioned structure. Integral front bumper,Center frame,X-frame,Final drives (total),42 ltr,Lift cylinder,2 – 260 mm x 1495 mm,,Center frame,X-frame,Track type,Sealed track,Center frame,X-frame leg,,Center frame,X-frame leg,,Center frame,X-frame leg,Center frame,X-frame leg,,Track adjuster,Hydraulic,,Center frame,X-frame leg,Fuel tank,605 ltr,Center frame,X-frame leg,,Track type,Sealed track,Center frame,X-frame leg,"Boom cylinder, bore x stroke",260 mm x 1368 mm,,Control valve,2-spool type,,Number of boom cylinders,2,,Center frame,X-frame leg,Swing torque,6900 kgm,,,,Hydraulic system,"11,500 ltr",Swing Gear,2 x Planetary gear,Track adjuster,Automatic Hydraulic type,Driven by,Hydraulic Motors,Center frame,H-frame leg,Engine oil,2 x 236 ltr,Track adjuster,Hydraulic,,Swing speed,8.3 rpm,Swing speed,8.3 rpm,Center frame,X-frame leg,Center frame,X-frame leg,Number of boom cylinders,2,,Hydraulic system,"6,000 ltr",Number of boom cylinders,2,,Suspension (total),21.4 ltr,Hydraulic system,316 ltr,Turning circle diameter (SAE),27.2 m,,Number of boom cylinders,2,,Suspension (total),10.4 ltr,Number of boom cylinders,2,,Number of boom cylinders,2,,Number of boom cylinders,2,,Number of boom cylinders,2,,Number of boom cylinders,2,,Number of boom cylinders,2,,"Boom cylinder, bore x stroke",125 mm x 673.5 mm,Number of boom cylinders,2,Number of boom cylinders,2,,"Boom cylinder, bore x stroke",130 mm x 717 mm,Lower (empty),3.0 sec,,Engine oil,50 ltr,Type,"Double-acting, piston type",Center frame,X-frame leg,,,Number of boom cylinders,2,Engine,11 ltr,Hydraulic system,50 ltr,,,,Swing speed,11.0 rpm,Swing torque,2991 kg.m,Operating weight,,Operating weight,"9,950 - 10,500 kg",Center frame,X-frame leg,Track adjuster,Hydraulic,Center frame,X-frame leg,Track type,Sealed track,Number of shoes (each side),43,Giant ripper,130 ltr,,,Center frame,X-frame leg,Suspension,Suspension,Oscillating equaliser bar and pivot shaft,Oscillating equaliser bar and pivot shaft,Center frame,X-frame leg,,,Tractor weight,"Including rated capacity of lubricant, coolant, full fuel tank, operator, and standard equipment.",37680 kg,,Giant ripper (variable),45 ltr,,,,,,,,,"Transmission, bear gear, and steering system",90 ltr
,,D85EXi-18,0.61 kgf/cm2,,,,,,,,,Operating weight,"12,710 - 13,100 kg",Side plate thickness - rear,25 mm,,Track type,Sealed track,,,,,,,,,Cooling system,30 ltr,,Filtration,In-line replaceable elements,,,,Turning circle diameter (SAE),29.3 m,,Height,400 mm,,,,Service brake,"Foot operated, oil disc brakes, hydraulically actuated on four tandem wheels, 13691 cm2 total braking surface.",,"Torque converter, transmission and retarder cooling",215 ltr,Turning circle diameter (SAE),29.7 m,,Turning circle diameter (SAE),28.4 m,,Control Positions:,Control Positions:,,Engine oil,50 ltr,"Boom cylinder, bore x stroke",140 mm x 881 mm,,Fuel tank,1308 ltr,Track frame,Box-section,Hydraulic system,149 ltr,Bucket cylinder,1 – 300 mm x 995 mm,,Track frame,Box-section,Track adjuster,Hydraulic,Track frame,Box-section,,Track frame,Box-bathed,,Track frame,Box-section,Track frame,Box-section,,Number of shoes (each side),45 - 49,,Track frame,Box-section,Coolant,37 ltr,Track frame,Box-section,,Track adjuster,Hydraulic,Track frame,Box-section,Number of bucket cylinders,1,,Control Positions:,Control Positions:,,"Boom cylinder, bore x stroke",200 mm x 1067 mm,,Track frame,Box-section,Center frame,X-frame leg,,,,Hydraulic oil tank,"7,750 ltr",Swing holding brakes,Mechanical disc brakes,Number of shoes (each side),46,Swing reduction,Planetary gear,Track frame,Box-section,Hydraulic system,"9,500 ltr",Number of shoes (each side),49,,Center frame,X-frame leg,Centre frame,H-frame leg,Track frame,Box-section,Track frame,Box-section,"Boom cylinder, bore x stroke",160 mm x 898 mm,,Hydraulic oil tank,"3,715 ltr","Boom cylinder, bore x stroke",160 mm x 898 mm,,Type,"Articulated type, fully hydraulic power steering with two double-acting cylinders",Transmission,129 ltr,Reservoir,511 ltr,,"Boom cylinder, bore x stroke",200 mm x 1067 mm,,Type,"Articulated type, fully hydraulic power steering with double-acting cylinders","Boom cylinder, bore x stroke",140 mm x 764 mm,,"Boom cylinder, bore x stroke",130 mm x 713 mm,,"Boom cylinder, bore x stroke",130 mm x 713 mm,,"Boom cylinder, bore x stroke",140 mm x 764 mm,,"Boom cylinder, bore x stroke",120 mm x 729 mm,,"Boom cylinder, bore x stroke",110 mm x 717 mm,,Number of bucket cylinders,1,"Boom cylinder, bore x stroke",140 mm x 729 mm,"Boom cylinder, bore x stroke",130 mm x 776 mm,,Number of bucket cylinders,1,Cooling system,9.1 ltr,,"Torque converter, transmission and retarder cooling",90 ltr,Number of lift cylinders,2,Track frame,Box-section,,,"Boom cylinder, bore x stroke",110 mm x 628 mm,"Final drive, each side",2.5 ltr,Axle front,9.1 ltr,,,,Swing torque,2991 kg.m,Center frame,X-frame leg,Without Blade,"12,920 - 13,060 kg",,,Track frame,Box-section,Number of shoes (each side),39,Track frame,Box-section,Track adjuster,Hydraulic,Number of carrier rollers (each side),1,Multi-shank ripper,130 ltr,,,Track frame,Box-section,Track roller frame,Track roller frame,"Cylindrical, high-tensile-strength steel construction","Cylindrical, high-tensile-strength steel construction",Track frame,Box-section,,,Operating weight,"Including Strengthened Dual tilt SIGMADOZER, giant ripper, steel cab, ROPS, operator, standard equipment, rated capacity of lubricant, coolant, and full fuel tank.",51530 kg,,Multi-shank ripper (variable),45 ltr,,,,,,,,,DEF tank,39 ltr
