,,DEF tank,23.5 ltr,,,,,,,,,,,Hoist and steering,"Dual, in-line, high-pressure",,"Final drive, each side",5.4 ltr,,,,,,,,,Circle reversing control hydraulic rotation,360°,,Pumps:,"Two pumps, single package, end of alternator",,,,Power-down,16 sec,,One gear pump for differential; capacity,17 ltr,,,,Circle reverse housing,7 ltr,,Effective cylinder stroke (front suspension),303 mm,Power-down,23 sec,,Power-down,16 sec,,Engine,280 ltr,,Maximum steering angle,38°,Dump,1.9 sec,,Supplementary steering,"Meets ISO5010, SAEJ1511",Engine,37 ltr,Mechanical stopper,7.7°,Cooling system,355 ltr,,Engine,35 ltr,Swing drive,15.6 ltr,Engine,37 ltr,,Engine,23.1 ltr,,Engine,23.1 ltr,Engine,23.1 ltr,,Hydraulic tank,126 ltr,,Engine,23.1 ltr,Track type,Sealed track,Engine,23.1 ltr,,Swing drive,7.1 ltr,Engine,23.1 ltr,Lower (empty),4.8 sec,,Torque converter and transmission,105 ltr,,Dump,2.3 sec,,Engine,37 ltr,Coolant,30.7 ltr,,,,,,Engine,120 ltr,Operating weight,"250,000 - 261,000 kg",Number of carrier rollers (each side),3,Engine,53 ltr,,,Hydraulic tank,126 ltr,,Coolant,58 ltr,Coolant,58 ltr,Engine,38 ltr,Engine,37 ltr,Dump,1.7 sec,,,,Dump,1.7 sec,,Speed range,6 speeds forward and 2 reverse,Torque converter,"3-elements, 1-stage, 2-phase",Float-down empty,12 sec,,Dump,2.3 sec,,Speed range,6 speeds forward and 2 reverse,Dump,1.6 sec,,Dump,1.8 sec,,Dump,1.8 sec,,Dump,1.6 sec,,Dump,1.9 sec,,Dump,2.0 sec,,Lower (empty),3.2 sec,Dump,1.9 sec,Dump,2.0 sec,,Lower (empty),3.3 sec,Minimum turning radius at centre of outside tyre,3680 mm,,Effective cylinder stroke (front suspension),250 mm,Raise,5.7 sec,Engine,16.0 ltr,,,Fuel tank,133 ltr,Ground clearance (mm),395,No. of steering cylinders,2,,,,Fuel tank,200 ltr,Coolant,17.7 ltr,Arm size (m) & type,2.5 standard,,,"Final drive, each side",0.7 ltr,DEF tank,None,"Final drive, each side",0.6 ltr,Hydraulic tank,56 ltr,DEF tank,None,Suspension,Suspension,Oscillating equaliser bar and pivot shaft,Oscillating equaliser bar and pivot shaft,"Final drive, each side",0.6 ltr,Number of track rollers,Number of track rollers,8,8,"Final drive, each side",0.7 ltr,,,Rollers and idlers,Rollers and idlers,Lubricated track rollers,Lubricated track rollers,3rd,11.8 km/h,15.8 km/h,,,,,,,,,
,,Hydraulic oil,69 ltr,,,,,,,,,,,Brake component cabinet,"Above deck, easily accessible with diagnostic test connections",,Swing drive,4.5 ltr,,,,,,,,,"A-shaped, u-section press formed and welded construction for maximum strength with a replaceable drawbar ball.","A-shaped, u-section press formed and welded construction for maximum strength with a replaceable drawbar ball.",,Hoist,Tandem gear pump with output of 1022 ltr/min at 1900 rpm and 17237 kPa,,,,Float-down empty,17 sec,,HYDRAULIC MOTOR:,,,,,Single piece rolled ring forging. Six circle support shoes with replaceable wear surface. Circle teeth hardened on front 180° of circle.,Single piece rolled ring forging. Six circle support shoes with replaceable wear surface. Circle teeth hardened on front 180° of circle.,,Rear axle oscillation:,,Float-down empty,24 sec,,Float-down empty,17 sec,,Hydraulic system,1300 ltr,,Effective cylinder stroke (front suspension),250 mm,Lower (empty),3.8 sec,,Minimum turning radius,10.1 m,"Final drive, each side",9.0 ltr,Torque converter,"3-elements, 1-stage, 2-phase",Fuel tank,1555 ltr,,"Final drive, each side",9.0 ltr,Swing motor,3.0 ltr,"Final drive, each side",9.0 ltr,,"Final drive, each side",5.0 ltr,,"Final drive, each side",8.0 ltr,"Final drive, each side",8.5 ltr,,DEF tank,None,,"Final drive, each side",5.0 ltr,Track adjuster,Hydraulic,"Final drive, each side",3.6 ltr,,Hydraulic tank,135 ltr,"Final drive, each side",5.0 ltr,Cooling system,337 ltr,,Type,"Articulated type, fully hydraulic power steering",,Lower (empty),4.1 sec,,"Final drive, each side",10.5 ltr,Engine,23.1 ltr,,,,,,"Travel gear, each side",85 ltr,Standard,15m3,Number of track rollers (each side),8,"Final drive, each side",20 ltr,,,DEF tank,13 ltr,,Engine,40 ltr,Engine,40 ltr,"Final drive, each side",11.0 ltr,"Final drive, each side",10.5 ltr,Lower (empty),4.2 sec,,,,Lower (empty),4.2 sec,,Lockup clutch,"Wet, single-disc clutch",Transmission,"Full-automatic, planetary-shaft type",Pumps:,"Two pumps, single package, end of alternator",,Lower (empty),4.1 sec,,Lockup clutch,"Wet, single-disc clutch",Lower (empty),3.1 sec,,Lower (empty),3.3 sec,,Lower (empty),3.3 sec,,Lower (empty),3.1 sec,,Lower (empty),3.5 sec,,Lower (empty),3.2 sec,,Cooling system,17 ltr,Lower (empty),3.3 sec,Lower (empty),3.3 sec,,Cooling system,22 ltr,Transmission,"Hydrostatic, 1 pump, 1 motor with speed range select","Hydrostatic, 1 pump, 1 motor with speed range select",Rear axle oscillation:,,Dump,1.9 sec,"Final drive, each side",3.3 ltr,,,Engine,12.5 ltr,Boom size (m) & type,4.29 standard,Type,Double-action,,,,Coolant,17.7 ltr,Engine,11.5 ltr,Arm crowd force - ISO (kgf),6880,,,Hydraulic tank,55 ltr,Operating weight,"7,960 kg",Hydraulic tank,39 ltr,DEF tank,None,Operating weight,"14,560 - 14,870 kg",Track roller frame,Track roller frame,"Cylindrical, high-tensile-strength steel construction","Cylindrical, high-tensile-strength steel construction",Hydraulic tank,34 ltr,Number of carrier rollers,Number of carrier rollers,2,2,Hydraulic tank,55 ltr,,,K-Bogie undercarriage,K-Bogie undercarriage,Lubricated track rollers are resiliently mounted to the track frame with a bogie suspension system whose oscillating motion is cushioned by rubber pads.,Lubricated track rollers are resiliently mounted to the track frame with a bogie suspension system whose oscillating motion is cushioned by rubber pads.,Suspension,Suspension,Oscillating equalizer bar with shoulder pad and pivot shaft,Oscillating equalizer bar with shoulder pad and pivot shaft,,,,,,,,
,,D85EXi-18,30590 kg,,,,,,,,,,,Hoist,"Two 3-stage dual-acting outboard cylinders, internal cushion valve, over-centre dampening",,Hydraulic tank,121 ltr,,,,,,,,,Drawbar frame,210 x 22 mm,,Steering and brake,Pressure-compensating piston pump with output of 246 ltr/min at 1900 rpm and 18961 kPa,,,,Pumps:,"Two pumps, single package, in-line",,Piston-type hydraulic motor. Output power used for blade rotation.,Piston-type hydraulic motor. Output power used for blade rotation.,,,,Diametre (outside),1530 mm,,Oil stopper,6.8°,Pumps:,"Two pumps, single package, end of alternator",,Pumps:,,,"Differential, final drive, axle front",670 ltr,,Rear axle oscillation:,,Cooling system,61 ltr,,Maximum steering angle,41°,Swing drive,16.5 ltr,Transmission,"Full-automatic, planetary type",Engine,108 ltr,,Swing drive,13.7 ltr,Hydraulic tank,188 ltr,Swing drive,16.5 ltr,,Swing drive,7.2 ltr,,Swing drive,7.2 ltr,Swing drive,8.2 ltr,,Operating weight,,,Swing drive,6.5 ltr,Number of shoes (each side),48,Swing drive,6.5 ltr,,Generator motor,6 ltr,Swing drive,7.2 ltr,Fuel tank,1555 ltr,,Steering angle,40° each direction,,Cooling system,150 ltr,,Swing drive,20 ltr,"Final drive, each side",5.0 ltr,,,,,,Swing drive,2 x 30 ltr,Other optional available sizes,18m3,Fuel tank,1360 ltr,Swing drive,2 x 24.5 ltr,,,Operating weight,,,"Final drive, each side",10 ltr,"Final drive, each side",10 ltr,Swing drive,20 ltr,Swing drive,20 ltr,Cooling system,133 ltr,,,,Cooling system,110 ltr,,Forward,"Torque converter drive in 1st gear, direct drive in 1st lockup and all higher gears",Speed range,7 forward and 1 reverse,Hoist and brake cooling,Tandem gear pump with output of 666 ltr/min at 1900 rpm and 18961 kPa,,Cooling system,147 ltr,,Forward,"Torque converter drive in 1st gear, direct drive in 1st lockup and all higher gears",Cooling system,78 ltr,,Cooling system,60.6 ltr,,Cooling system,30.5 ltr,,Cooling system,80 ltr,,Cooling system,35.1 ltr,,Cooling system,33.3 ltr,,Fuel tank,177 ltr,Cooling system,25 ltr,Cooling system,32 ltr,,Fuel tank,186 ltr,Speed ranges,2,2,Oil stopper,6.8°,Lower (empty),3.2 sec,Swing drive,4.5 ltr,,,Hydraulic system,47 ltr,Arm size (m) & type,2.13 standard,Bore diameter × stroke,60 × 369 mm,,,,Engine,11.5 ltr,"Final drive, each side",2.1 ltr,Bucket crowd force - ISO (kgf),9520,,,DEF tank,None,,,DEF tank,None,Operating weight,"8,500 - 8,750 kg",Boom size (m) & type,4.6 standard,Rollers and idlers,Rollers and idlers,Lubricated track rollers,Lubricated track rollers,DEF tank,None,Extreme service shoes:,Ground contact area:,Ground pressure:,Ground pressure:,DEF tank,None,,,Extreme service track shoes,Extreme service track shoes,Lubricated tracks. Unique seals prevent entry of foreign abrasives into pin to bushing clearances to provide extended service life. Track tension is easily adjusted with grease gun.,Lubricated tracks. Unique seals prevent entry of foreign abrasives into pin to bushing clearances to provide extended service life. Track tension is easily adjusted with grease gun.,Track roller frame,Track roller frame,"Cylindrical, high-tensile-strength steel construction","Cylindrical, high-tensile-strength steel construction",,,,,,,,
,,D85PXi-18,29520 kg,,,,,,,,,,,Hoist times:,,,DEF tank,29.6 ltr,,,,,,,,,FRONT FRAME STRUCTURE,FRONT FRAME STRUCTURE,,System relief pressures:,,,,,Hoist and brake cooling,Tandem gear pump with output of 931 ltr/min at 1900 rpm and 18960 kPa,,Horsepower,49 kW / 66 HP,,,,Circle reversing control hydraulic rotation,360°,,Mechanical stopper,7.7°,Hoist,Tandem gear pump with output of 1022 ltr/min at 1900 rpm and 17237 kPa,,Hoist,Tandem gear pump with output of 851 ltr/min at 1900 rpm and 17240 kPa,,"Differential, final drive, axle rear",670 ltr,,Oil stopper,6.8°,Fuel tank,413 ltr,,Effective cylinder stroke:,,Hydraulic tank,188 ltr,Speed range,7 speeds forward and 1 reverse,Hydraulic system,1020 ltr,,Hydraulic tank,188 ltr,DEF tank,None,Hydraulic tank,188 ltr,,Hydraulic tank,135 ltr,,Hydraulic tank,132 ltr,Hydraulic tank,132 ltr,,PC228US-8 Without Blade,"23,070 - 23,210 kg",,Hydraulic tank,135 ltr,Number of carrier rollers (each side),2,Hydraulic tank,135 ltr,,DEF tank,12.6 ltr,Hydraulic tank,132 ltr,Engine,130 ltr,,Minimum turning radius at centre of outside tyre,8280 mm,,Fuel tank,718 ltr,,Hydraulic tank,248 ltr,Swing drive,6.5 ltr,,,,,,Hydraulic tank,1300 ltr,,,Coolant,142 ltr,Hydraulic tank,470 ltr,,,PC228US-11,"23,520 - 24,300 kg",,Swing drive,2 x 13 ltr,Swing drive,2 x 13 ltr,Hydraulic tank,248 ltr,Hydraulic tank,248 ltr,Fuel tank,473 ltr,,,,Fuel tank,473 ltr,,Reverse,Torque converter drive and direct drive in all gear,Lockup clutch,"Wet, multiple-disc clutch",Steering and brake,Pressure-compensating piston pump with output of 254 ltr/min at 1900 rpm and 19134 kPa,,Fuel tank,718 ltr,,Reverse,Torque converter drive and direct drive in all gear,Fuel tank,380 ltr,,Fuel tank,300 ltr,,Fuel tank,300 ltr,,Fuel tank,380 ltr,,Fuel tank,245 ltr,,Fuel tank,186 ltr,,Engine,15.5 ltr,Fuel tank,245 ltr,Fuel tank,325 ltr,,Engine,23 ltr,Travel speed,Forward & Reverse,Forward & Reverse,Mechanical stopper,8.1°,Cooling system,26.5 ltr,Hydraulic tank,121 ltr,,,Axle front,14 ltr,Arm crowd force - ISO (kgf),7300,Smallest turn (outer edge of  tyre 455/70 R20),4.130 mm,,,,"Final drive, each side",2.1 ltr,Swing drive,2.5 ltr,Digging depth - maximum (mm),5520,,,Operating weight,"4,860 - 4,980 kg",,,Operating weight,"3,620 - 3,770 kg",,,Arm size (m) & type,2.5 standard,K-Bogie undercarriage,K-Bogie undercarriage,Lubricated track rollers are resiliently mounted to the track frame with a bogie suspension system whose oscillating motion is cushioned by rubber pads.,Lubricated track rollers are resiliently mounted to the track frame with a bogie suspension system whose oscillating motion is cushioned by rubber pads.,Operating weight,"3,150 - 3,300 kg",910 mm  Additional weight - 1830 kg,82340 cm²,102 kPa / 1.04 kg/cm²,102 kPa / 1.04 kg/cm²,Operating weight,"5,140 - 5,260 kg",,,Number of shoes (each side),Number of shoes (each side),39,39,Rollers and idlers,Rollers and idlers,Lubricated track rollers,Lubricated track rollers,,,,,,,,
,,D85EXi-18 with Ripper,33090 kg,,,,,,,,,,,Power-up loaded,21 sec,,Operating weight,"17,710 – 18,390 kg",,,,,,,,,Height,300 mm,,Hoist and brake cooling,17237 kPa,,,,Steering and brake,Pressure-compensating piston pump with output of 246 ltr/min at 1900 rpm,,HYDRAULIC CYLINDERS:,HYDRAULIC CYLINDERS:,,,,"A-shaped, u-section press formed and welded construction for maximum strength with a replaceable drawbar ball.","A-shaped, u-section press formed and welded construction for maximum strength with a replaceable drawbar ball.",,Torque converter,"3-elements, 1-stage, 2-phase",Steering and brake,Pressure-compensating piston pump with output of 246 ltr/min at 1900 rpm and 18961 kPa,,Steering and brake,Pressure-compensating piston pump with output of 246 ltr/min at 1900 rpm and 18961 kPa,,Torque converter and transmission,350 ltr,,Mechanical stopper,8.1°,Engine,38 ltr,,Front suspension,320 mm,DEF tank,None,Lockup clutch,"Wet, single-disc clutch",Axle front,370 ltr,,DEF tank,39 ltr,Operating weight,"35,680 - 36,220 kg",DEF tank,None,,DEF tank,None,,Hydraulic system,253 ltr,DEF tank,None,,PC228US-8 With Blade,"25,610 - 25,750 kg",,DEF tank,None,Number of track rollers (each side),8,DEF tank,None,,Operating weights,"21,810 - 22,050 kg",Hydraulic System,244 ltr,Hydraulic system,725 ltr,,Torque converter,"Three-elements, single-stage, single-phase","Three-elements, single-stage, single-phase",Engine,86 ltr,,DEF tank,None,Hydraulic tank,132 ltr,,,,,,PTO,30 ltr,,,Engine,86 ltr,DEF tank,None,,,PC228USLC-11,"23,890 - 24,670 kg",,Hydraulic tank,360 ltr,Hydraulic tank,360 ltr,DEF tank,39,DEF tank,None,Engine,37 ltr,,,,Engine,37 ltr,,Shift control,Electronic shift control with automatic clutch modulation in all gear,Forward,Torque converter drive 1st and 2nd gear with direct drive lock-up in 1st through 7th,System relief pressures:,,,Engine,86 ltr,,Shift control,Electronic shift control with automatic clutch modulation in all gear,Engine,38 ltr,,Engine,23 ltr,,Engine,23 ltr,,Engine,38 ltr,,Engine,23 ltr,,Engine,23 ltr,,Hydraulic system,58 ltr,Engine,23 ltr,Engine,30 ltr,,Hydraulic system,67 ltr,1st,0 - 5 km/h,0 - 5 km/h,Torque converter,"3-elements, 1-stage, 2-phase",Fuel tank,177 ltr,DEF tank,None,,,Axle rear,14.5 ltr,Bucket digging force - ISO (kgf),9000,Cabin in conformity with ISO 3471 with ROPS (roll over protective structure) in conformity with SAE J1040c and FOPS (falling object protective structure) in conformity with ISO 3449. The pressurised cabin is mounted upon hydro-bearings and is noise dampened. Tiltable for best servicing access.,,,,,Swing drive,2.5 ltr,Hydraulic tank,69.0 ltr,Digging reach - maximum (mm),8290,,,,,,,,,,,Arm crowd force - ISO (kgf),6300,Extreme service track shoes,Extreme service track shoes,Lubricated tracks. Unique seals prevent entry of foreign abrasives into pin to bushing clearances to provide extended service life. Track tension is easily adjusted with grease gun.,Lubricated tracks. Unique seals prevent entry of foreign abrasives into pin to bushing clearances to provide extended service life. Track tension is easily adjusted with grease gun.,,,,,,,,,,,Grouser height - single grouser,Grouser height - single grouser,88 mm,88 mm,K-Bogie undercarriage,K-Bogie undercarriage,Lubricated track rollers are resiliently mounted to the track frame with a bogie suspension system whose oscillating motion is cushioned by rubber pads.,Lubricated track rollers are resiliently mounted to the track frame with a bogie suspension system whose oscillating motion is cushioned by rubber pads.,,,,,,,,
,,D85PXi-18 with Ripper,32020 kg,,,,,,,,,,,Power-down,16 sec,,"Length, overall (mm)",8690,,,,,,,,,Width,300 mm,,Steering and brake,27579 kPa,,,,System relief pressures:,,,"Double-acting piston type hydraulic cylinders: two for blade lifting, one for drawbar shifting, one for blade sideshifting, one for front wheel leaning, one for blade tipping, two for front wheel steering and two for frame articulation. Pilot check valves assure positive cylinder action (excluding a blade sideshift cylinder).","Double-acting piston type hydraulic cylinders: two for blade lifting, one for drawbar shifting, one for blade sideshifting, one for front wheel leaning, one for blade tipping, two for front wheel steering and two for frame articulation. Pilot check valves assure positive cylinder action (excluding a blade sideshift cylinder).",,,,Drawbar frame,210 x 25 mm,,Transmission,"Full-automatic, planetary type",System relief pressures:,,,System relief pressures:,,,Brake oil,75 ltr,,Torque converter,"3-elements, 1-stage, 2-phase",Hydraulic system,173 ltr,,Rear suspension,127 mm,Operating weight,"35,800 - 36,330 kg",Forward,"Torque converter drive in 1st gear, direct drive in 1st lockup and all higher gears",Axle rear,370 ltr,,Operating weight,"35,950 - 37,440 kg","Length, overall (mm)",11145,Operating weight,,,Operating weight,,,DEF tank,23.1 ltr,Operating weight,,,PC228USLC-8 Without Blade,"23,750 - 23,990 kg",,Operating weight,"23,330 kg","Length, overall (mm)",11145,Operating weight,,,"Length, overall (mm)",9425,DEF tank,23.1 ltr,Axle front,360 ltr,,Transmission,"Full-powershift, automatic planetary type","Full-powershift, automatic planetary type",Hydraulic system,443 ltr,,Operating weight,"44,400 - 44,850 kg",Hydraulic system,234 ltr,,,,,,DEF tank,None,,,"Final drive, each side",21 ltr,Operating weight,"78,600 - 79,800 kg",,,,PC228US-11,PC228USLC-11,DEF tank,None,DEF tank,None,Operating weight,"47,890 - 49,680 kg",Operating weight,"46,440 - 47,470 kg",Hydraulic system,337 ltr,,,,Hydraulic system,337 ltr,,Maximum travel speed,55.9 km/h,Reverse,Torque converter drive,Hoist,17237 kPa,,Hydraulic system,443 ltr,,Maximum travel speed,58.6 km/h,Hydraulic system,173 ltr,,Hydraulic system,142 ltr,,Hydraulic system,139 ltr,,Hydraulic system,173 ltr,,Hydraulic system,92 ltr,,Hydraulic system,80 ltr,,Axle front,18 ltr,Hydraulic system,89 ltr,Hydraulic system,139 ltr,,Axle front,18 ltr,2nd,0 - 20 km/h,0 - 20 km/h,Transmission,"Full-automatic, planetary type",Engine,15.5 ltr,Operating weight,"17,370 - 17,440 kg",,,Transmission,4.4 ltr,Digging depth - maximum (mm),4820,,,,,,Hydraulic tank,69.0 ltr,DEF tank,12.6 ltr,Maximum reach @ ground level,8170,,,,,,,,,,,Bucket crowd force - ISO (kgf),9500,Number of shoes (each side),Number of shoes (each side),41,41,,,,,,,,,,,Shoe width (standard),Shoe width (standard),610 mm,610 mm,Extreme service track shoes,Extreme service track shoes,Lubricated tracks. Unique seals prevent entry of foreign abrasives into pin to bushing clearances to provide extended service life. Track tension is easily adjusted with grease gun.,Lubricated tracks. Unique seals prevent entry of foreign abrasives into pin to bushing clearances to provide extended service life. Track tension is easily adjusted with grease gun.,,,,,,,,
,,,,,,,,,,,,,,Float-down empty,17 sec,,"Track length on ground (mm), Transport",4760,,,,,,,,,Side,16 / 32mm,,Quick disconnects standard for power disabled truck and for systems diagnostics,Quick disconnects standard for power disabled truck and for systems diagnostics,,,,Hoist and brake cooling,17237 kPa,,CONTROL VALVES:,CONTROL VALVES:,,,,FRONT FRAME STRUCTURE,FRONT FRAME STRUCTURE,,Speed range,7 speeds forward and 1 reverse,Hoist and brake cooling,17237 kPa,,Hoist,17240 kPa,,Brake cooling,290 ltr,,Transmission,"Full-automatic, planetary type",Axle front,59 ltr,,Rear axle oscillation,6.5°,Boom size (m) & type,6.47 Heavy duty,Reverse,Torque converter drive,Torque converter and transmission,180 ltr,,"Length, overall (mm)",11145,Track length on ground (mm),4030,PC300-8M0,"33,490- 33,870 kg",,PC220-8M0,"24,110 - 24,440 kg",,Operating weight,"29,800 - 31,210 kg",PC270-8,"27,850 - 28,320 kg",,PC228USLC-8 With Blade,"26,430 - 26,670 kg",,"Length, overall (mm)",9625,Track length on ground (mm),4030,PC200-8M0,"20,940 - 21,180 kg",,Track length on ground (mm),3655,Operating weight,"25,380 - 26,240 kg",Axle rear,360 ltr,,Travel speed,Forward,Reverse,Axle front,185 ltr,,Boom size (m) & type,7.1 Standard,DEF tank,23.1 ltr,,,,,,Operating weight,"195,000 - 204,120 kg",,,Swing drive,2 x 20 ltr,Boom size (m) & type,7.1 Heavy duty,,,"Length, overall (mm)",8830,8920,Operating weight,"63,300 kg",Operating weight,"60,200 - 61,900 kg","Length, overall (mm)",11930,"Length, overall (mm)",11590,Axle front,95 ltr,,,,Axle front,95 ltr,,Standard tyre,29.5 R25,Shift control,Electronic shift control with automatic clutch modulation in all gears,Steering and brake,27580 kPa,,Axle front,155 ltr,,Standard tyre,23.5 R25,Axle front,57 ltr,,Axle front,40 ltr,,Axle front,40 ltr,,Axle front,57 ltr,,Axle front,27 ltr,,Axle front,18.5 ltr,,Axle rear,18 ltr,Axle front,24 ltr,Axle front,49 ltr,,Axle rear,18 ltr,Standard tyres,12.5-R18,,Speed range,7 speeds forward and 1 reverse,Hydraulic system,58 ltr,"Length, overall (mm)",8565,,,Type,"Articulated type, fully hydraulic power steering",Digging reach - maximum (mm),7285,,,,,,DEF tank,12.6 ltr,Operating weight,"15,140 – 15,500 kg",Swing radius (mm),2190,,,,,,,,,,,Digging depth - maximum (mm),5480,Grouser height - single grouser,Grouser height - single grouser,105 mm,105 mm,,,,,,,,,,,Ground contact area,Ground contact area,42456 cm2,42456 cm2,Number of shoes (each side),Number of shoes (each side),41,41,,,,,,,,
,,,,,,,,,,,,,,Pumps:,"Two pumps, single package, in-line",,Track gauge (mm),1990,,,,,,,,,"Upper, Lower",25 mm,,Cooling system,719 ltr,,,,Steering and brake,20685 kPa,,Two 5-spool type control valves for work equipment controls. Relief valve built into control valves for sure control.,Two 5-spool type control valves for work equipment controls. Relief valve built into control valves for sure control.,,,,Height,300 mm,,Lockup clutch,"Wet, single-disc clutch",Steering and brake,27579 kPa,,Steering and brake,27580 kPa,,Type,"Articulated type, fully hydraulic power steering",,Speed range,7 speeds forward and 1 reverse,Axle rear,59 ltr,,Torque converter,"3-elements, 1-stage, 2-phase",Arm size (m) & type,3.2 Heavy duty,Shift control,Electronic shift control with automatic clutch modulation in all gears,Type,"Articulated type, full-hydraulic power steering",,Track length on ground (mm),4030,Track gauge (mm),2590,PC300LC-8M0,"34,140 - 34,520 kg",,PC220LC-8M0,"24,860 - 25,190 kg",,"Length, overall (mm)",10265,PC270LC-8,"28,870 - 29,340 kg",,,PC228US-8,PC228USLC-8,Track length on ground (mm),3655,Track gauge (mm),2590,PC200LC-8M0,"21,720 - 21,960 kg",,Track gauge (mm),2380,Arm Length,3000 mm,Torque converter and transmission,140 ltr,,1st gear,6.4 km/h,7.1 km/h,Axle rear,193 ltr,,Arm size (m) & type,3.4 Standard,Operating weight,,,,,,,,,,,Hydraulic tank,670 ltr,Arm size (m) & type,2.945 Heavy duty,,,Track length on ground (mm),3460,3655,"Length, overall (mm)",11980,Boom size (m) & type,7.7 Standard,Track length on ground (mm),4350,Track length on ground (mm),4350,Axle rear,95 ltr,,,,Axle rear,95 ltr,,Empty weight,35005 kg,Maximum travel speed,56.5 km/h,Cooling system,441 ltr,,Axle rear,155 ltr,,Empty weight,25395 kg,Axle rear,56 ltr,,Axle rear,40 ltr,,Axle rear,40 ltr,,Axle rear,56 ltr,,Axle rear,25.5 ltr,,Axle rear,18 ltr,,Transfer case,5 ltr,Axle rear,24 ltr,Axle rear,40 ltr,,Transfer case,5 ltr,Operating weight,"5,035 - 5,380 kg",,Lockup clutch,"Wet, single-disc clutch",Axle front,18.5 ltr,Track length on ground (mm),3170,,,Steering angle,40° each direction,Maximum reach @ ground level,7315,,,,,,Operating weight,"15,630 – 16,030 kg","Length, overall (mm)",7260,,,,,,,,,,,,,Digging reach - maximum (mm),8300,Shoe width (standard),Shoe width (standard),710 mm,710 mm,,,,,,,,,,,Ground pressure (tractor),Ground pressure (tractor),87.3 kPa / 0.89 kg/cm²,87.3 kPa / 0.89 kg/cm²,Grouser Height:,Grouser Height:,Grouser Height:,Grouser Height:,,,,,,,,
