Type,"Dual-path, hydrostatic transmission System",Blade angle (SIGMADOZER),1 x 150 mm,Blade tilt,1 x 160 mm,Ripper lift,2 x 130 mm,Blade angle,2 x 110 mm,Crusher,230 ltr/min,Blade angle,2 x 90 mm,Total friction area per brake,103729 cm2,,Swing,1 x axial piston motor with swing holding brake,Blade angle,2 x 110 mm,Blade angle,2 x 80 mm,Blade angle,2 x 110 mm,Blade angle,2 x 110 mm,P-mode,,,Wheel brake locks,Switch-activated,,Pump type,Variable displacement piston,Wheel brake locks,Switch-activated,,Parking brake,"Mechanical, dry, disc type actuated on transmission output shaft. Spring-applied and air-released.",,Pump type,Variable displacement piston,NET FLYWHEEL HORSEPOWER (MANUAL MODE):,NET FLYWHEEL HORSEPOWER (MANUAL MODE):,,Payload,63000 kg,Secondary brakes,Automatically applied prior to hydraulic system pressure dropping below level required to meet secondary stopping requirements,,Emergency brakes,Automatically applied prior to hydraulic system pressure dropping below level required to meet secondary stopping requirements,,Breakout force,1275 kN  130000 kgf,,Payload,40000 kg,"Static tipping load, full turn","17,975 kg",,Payload,91700 kg,Swing,1 x axial piston motor with swing holding brake,Payload,63000 kg,Breakout force,705 kN  71900 kgf,,Swing,1 x axial piston motor with swing holding brake,Relief Valve Setting,,Swing,1 x axial piston motor with swing holding brake,,Swing,1 x axial piston motor with swing holding brake,,Swing,1 x axial piston motor with swing holding brake,Swing,1 x axial piston motor with swing holding brake,,Implement circuits,355 kgf/cm3,,Swing,1 x axial piston motor with swing holding brake,Swing,1 x axial piston motor with swing holding brake,Swing,1 x axial piston motor with swing holding brake,,Relief Valve Setting,,Swing,1 x axial piston motor with swing holding brake,Breakout force,677 kN  69000 kgf,,Front,"Fixed, full-floating",,"Static tipping load, full turn",37080 kg,,Swing,1 x axial piston motor with swing holding brake,Swing,1 x axial piston motor with swing holding brake,,Swing flow rate,"1,590 ltr/min",Travel control,2 foot pedals,Hydraulic Motors,,Swing flow rate,800 ltr/min,Travel,2 x axial piston motor with parking brake,Swing,2 x axial piston motor with swing holding brake,Travel control,2 foot pedals,Implement circuits,380 kgf/cm3,,Swing,2 x axial piston motor with swing holding brake,Swing,2 x axial piston motor with swing holding brake,Swing,1 x axial piston motor with swing holding brake,Swing,1 x axial piston motor with swing holding brake,"Static tipping load, full turn",24885 kg,,Travel control,2 foot pedals,"Static tipping load, full turn",26025 kg,,Target area (inside length x width),5667 mm x 3194 mm,Target area (inside length x width),8150 mm x 5800 mm,Wheel brake locks,Switch-activated,,Breakout force,387 kN  39500 kgf,,Target area (inside length x width),5250 mm x 2685 mm,"Static tipping load, full turn",17280 kg,,"Static tipping load, full turn",13440 kg,,"Static tipping load, full turn","13,435 kg",,"Static tipping load, full turn",17400 kg,,"Static tipping load, full turn",9780 kg,,"Static tipping load, full turn",8930 kg,,Breakout force,106 kN  10840 kgf,"Static tipping load, full turn",9500 kg,"Static tipping load, full turn","13,710 kg",,Breakout force,131 kN  13380 kgf,Oscillation,Rear axle oscillation angle 10°,,Payload,41000 kg,Breakout force,"11,000 kgf",Swing,1 x axial piston motor with swing holding brake,ELECTRICAL SYSTEM,"- Alternator, 12 Volt 40 Ampere.  - Batteries, 1 x 12 Volt, 80 Ah.  - Starting Motor, 12 Volt.","Static tipping load, full turn",5460 kg,Travel circuit,355 kgf/cm3,Maximum pump flow,75 l/min,,ELECTRICAL SYSTEM,"- Alternator, 12 Volt 40 Ampere.  - Batteries, 1 x 12 Volt, 80 Ah.  - Starting Motor, 12 Volt.",Swing,1 x piston motor with swing holding brake,Swing,1 x piston motor with swing holding brake,Service brake,Hydraulic lock,Swing,1 x piston motor with swing holding brake,Swing,1 x axial piston motor with swing holding brake,Relief Valve Setting,,Swing,1 x axial piston motor with swing holding brake,Swing,1 x piston motor with swing holding brake,Implement circuits,355 kgf/cm3,All spool valves externally mounted beside the hydraulic tank. Plunger type hydraulic pump with capacity (discharge flow) of 542 ltr/min for at rated engine rpm.,All spool valves externally mounted beside the hydraulic tank. Plunger type hydraulic pump with capacity (discharge flow) of 542 ltr/min for at rated engine rpm.,,,Swing,1 x axial piston motor with swing holding brake,All spool valves externally mounted beside the hydraulic tank. Plunger type hydraulic pump with capacity (discharge flow) of 542 ltr/min for at rated engine rpm.,All spool valves externally mounted beside the hydraulic tank. Plunger type hydraulic pump with capacity (discharge flow) of 542 ltr/min for at rated engine rpm.,,,Swing,1 x axial piston motor with swing holding brake,Maximum drawbar pull,1700 kg,Relief valve setting,27.5 MPa  280 kg/cm²,,,"Closed-center load sensing system (CLSS) designed for precise and responsive control, and for efficient simultaneous operation.","Closed-center load sensing system (CLSS) designed for precise and responsive control, and for efficient simultaneous operation.",,,,,,,,,Blade tilt,1 x 160 mm
Travel motor,Variable capacity,Ripper lift,2 x 130 mm,Ripper lift,1 x 180 mm,Travel speeds,,Travel speeds,,Feeder,58 ltr/min,Ripper lift,1 x 110 mm,Traction system,Wheel Spin-Side Control,,Relief Valve Setting,,Ripper lift,125 mm,Type,"Dual-path, hydrostatic transmission System",Travel speeds,,Ripper lift,1 x 125 mm,Gear 1-3 @ 2000 rpm,135 kW / 180 HP,,Parking brakes,"Multiple disc, spring-applied, hydraulically released, dry brakes on inboard end of each wheel motor rotor shaft. Rated to hold on ±15% grade at maximum gross vehicle weight.",,Pump flow (litre/min),165,Parking brakes,"Multiple disc, spring-applied, hydraulically released, dry brakes on inboard end of each wheel motor rotor shaft.",,Fuel tank,500 ltr,,Pump flow (litre/min),165,P-mode,,,Target area (inside length x width),6600 mm x 3870 mm,Wheel brake locks,Switch-activated,,Wheel brake locks,Switch-activated,,Drive system,Four-wheel drive,,Target area (inside length x width),5640 mm x 3380 mm,Breakout force,"212 kN  21,600 kgf",,Target area (inside length x width),7070 mm x 5150 mm,Relief Valve Setting,,Target area (inside length x width),6450 mm x 3870 mm,Drive system,Four-wheel drive,,Relief Valve Setting,,Implement circuits,380 kgf/cm3,Relief Valve Setting,,,Relief Valve Setting,,,Relief Valve Setting,,Relief Valve Setting,,,Travel circuit,380 kgf/cm3,,Relief Valve Setting,,Relief Valve Setting,,Relief Valve Setting,,,Implement circuits,380 kgf/cm3,Relief Valve Setting,,Drive system,Four-wheel drive,,Rear,"Centre-pin support, full-floating, 22° total oscillation",,Breakout force,355 kN  36200 kgf,,Relief Valve Setting,,Relief Valve Setting,,,High pressure in line filters,200 microns,Gradeability,50 %,Travel,2 x axial piston motor with parking brake,High pressure in line filters,200 microns,Swing,2 x axial piston motor with swing holding brake,Relief Valve Setting,,Gradeability,50 %,Travel circuit,380 kgf/cm3,,Relief Valve Setting,,Relief Valve Setting,,Relief Valve Setting,,Relief Valve Setting,,Breakout force,267 kN  27200 kgf,,Gradeability,50 %,Breakout force,267 kN  27200 kgf,,Heating,Exhaust heating (option),Material,400 Brinell hardness high tensile strength steel,Parking brakes,"Spring-applied, hydraulically released, with speed application protection",,Standard boom,3990 mm,,Heating,Exhaust heating (option),Breakout force,168 kN  17140 kgf,,Breakout force,158 kN  16100 kgf,,Breakout force,"158 kN  16,100 kgf",,Breakout force,168 kN  17140 kgf,,Breakout force,162 kN  16470 kgf,,Breakout force,131 kN  13375 kgf,,Drive system,Four-wheel drive,Breakout force,154 kN  15720 kgf,Breakout force,"180 kN  18,400 kgf",,Drive system,Four-wheel drive,Service brakes,Combined inch/brake pedal actuate on all four wheels via hydrostatic drive and dry disc at front axle,,Target area (inside length x width),5590 mm x 3380 mm,Drive system,Four-wheel drive,Relief Valve Setting,,TRANSMISSION,- Two speed hydrostatic transmission.  - Dual variable displacement pumps driving axial piston motors.,Breakout force,64 kN  6530 kgf,Swing circuit,276 kgf/cm3,Option,120 l/min,,TRANSMISSION,- Two speed hydrostatic transmission.  - Dual variable displacement pumps driving axial piston motors,Relief Valve Setting,,Relief Valve Setting,,Parking brake,Mechanical disc brake,Relief Valve Setting,,Relief Valve Setting,,Implement circuits,270 kgf/cm3,Relief Valve Setting,,Relief Valve Setting,,Travel circuit,355 kgf/cm3,Relief valve setting,27.5 MPa  280 kg/cm²,,,Relief Valve Setting,,Relief valve setting,27.5 MPa  280 kg/cm²,,,Relief Valve Setting,,Gradeability,58 %,Control Valves:,Control Valves:,,,All spool control valves externally mounted beside the hydraulic tank. Variable piston pump with capacity (discharge flow) of 366 ltr/min for implement at rated engine rpm.,All spool control valves externally mounted beside the hydraulic tank. Variable piston pump with capacity (discharge flow) of 366 ltr/min for implement at rated engine rpm.,,,,,,,,,Ripper lift,1 x 180 mm
Travel speeds,,Travel speeds,,Ripper tilt,1 x 200 mm,Forward,0 - 10.1 km/h,Forward,0 - 9 km/h,Conveyor,38 ltr/min,Type,"Dual-path, hydrostatic transmission System",Service brakes,"Oil-cooled, hydraulic actuated, multiple disc brakes at each wheel",,Implement circuits,380 kgf/cm3,Pitch angle,38o- 52o,Travel motor,Variable capacity,Forward,0 - 9 km/h,Type,"Dual-path, hydrostatic transmission System",Gear 4-6 @ 2000 rpm,150 kW / 200 HP,,Electric dynamic retarder (max.),4026 kW / 5400 HP. Continuously rated high-density blown grids with retard at engine idle and retard in reverse propulsion,,Relief valve pressure (bar),250,Electric dynamic retarder (max.),3207 kW / 4300 HP,,Coolant,58 ltr,,Relief valve pressure (bar),250,Gear 1-3 @ 2000 rpm,118 kW / 158 HP,,Heating,Exhaust heating,Parking brakes,"Multiple disc, spring-applied, hydraulically released, dry brakes on inboard end of each wheel motor rotor shaft. Rated to hold on ±15% grade at maximum gross vehicle weight.",,Parking brakes,"Spring-applied, hydraulically released, with speed application protection",,Front,"Fixed, full-floating",,Heating,Exhaust heating (option),Drive system,Four-wheel drive,,Heating,Exhaust heating,Implement circuits,380 kgf/cm3,Heating,Exhaust heating (option),Front,"Fixed, full-floating",,Implement circuits,380 kgf/cm3,Travel circuit,380 kgf/cm3,Implement circuits,380 kgf/cm3,,Implement circuits,380 kgf/cm3,,Implement circuits,380 kgf/cm3,Implement circuits,380 kgf/cm3,,Swing circuit,290 kgf/cm3,,Implement circuits,380 kgf/cm3,Implement circuits,380 kgf/cm3,Implement circuits,380 kgf/cm3,,Travel circuit,380 kgf/cm3,Implement circuits,380 kgf/cm3,Front,"Fixed, full-floating",,Reduction gear,Spiral bevel gear,,Drive system,Four-wheel drive,,Implement circuits,380 kgf/cm3,Implement circuits,380 kgf/cm3,,System,24 V,Travel speed,Max 2.4 km/h,Swing,2 x axial piston motor with swing holding brake,Type,Squirrel cage induction motor,Relief Valve Setting,,Implement circuits,320 kgf/cm3,Travel speed,Max 2.5 km/h,Swing circuit,299 kgf/cm3,,Implement circuits - Backhoe,325 kgf/cm3,Implement circuits - Backhoe,325 kgf/cm3,Implement circuits,380 kgf/cm3,Implement circuits,380 kgf/cm3,Drive system,Four-wheel drive,,Travel speed,Max 2.1 km/h,Drive system,Four-wheel drive,,Material,130 kg/mm2 high tensile strength steel,Material thickness:,Material thickness:,Electric dynamic retarder (max.),2387 kW / 3200 HP. Continuously rated high-density blown grids with retard at engine idle and retard in reverse propulsion,,Drive system,Four-wheel drive,,Material,130 kg/mm2 high tensile strength steel,Drive system,Four-wheel drive,,Drive system,Four-wheel drive,,Drive system,Four-wheel drive,,Drive system,Four-wheel drive,,Drive system,Four-wheel drive,,Drive system,Four-wheel drive,,Front,"Fixed, semi-floating",Drive system,Four-wheel drive,Drive system,Four-wheel drive,,Front,"Fixed, semi-floating",Parking brake,Dry disc,,Heating,Exhaust heating,Front,"Fixed, semi-floating",Implement circuits,380 kgf/cm3,TYRES,- 10 x 16.5 8 ply rating  - Spare rim and tyre,Drive system,Four-wheel drive,Pilot circuit,33 kgf/cm3,No. of boom/bucket cylinders,2/1,,TYRES,- 10 x 16.5 8 ply rating  - Spare rim and tyre,Implement circuits,355 kgf/cm3,Implement circuits,355 kgf/cm3,Driven by,Hydrostatic,Implement circuits,270 kgf/cm3,Implement circuits,270 kgf/cm3,Travel circuit,270 kgf/cm3,Implement circuits,265 kgf/cm3,Implement circuits,270 kgf/cm3,Swing circuit,276 kgf/cm3,Control Valves:,Control Valves:,,,Implement circuits,265 kgf/cm3,Control Valves:,Control Valves:,,,Implement circuits,270 kgf/cm3,Travel speeds,2.3 / 4.3 km/h,"Spool control valves for SIGMADOZER, Semi-U tilt dozer and Full-U tilt dozer.","Spool control valves for SIGMADOZER, Semi-U tilt dozer and Full-U tilt dozer.",,,Relief valve setting . . . for implement,29.8 MPa  304 kg/cm²,,,,,,,,,Ripper tilt,1 x 200 mm
Forward,0 - 8.5 km/h,Forward,0 - 11.3 km/h,Travel speeds,,Reverse,0 - 13.0 km/h,Reverse,0 - 9 km/h,Option,28 ltr/min,Travel motor,Variable capacity,Secondary brakes,Automatically applied prior to hydraulic system pressure dropping below level required to meet secondary stopping requirements. Meets ISO3450,,Travel circuit,380 kgf/cm3,Travel speeds,,Travel speeds,,Reverse,0 - 9 km/h,Travel speeds,,Gear 7-8 @ 2100 rpm,163 kW / 218 HP,,Standard,ISO3471 (ROPS)  ISO3449 (FOPS),,Travel length (mm),5895,Standard,ISO3449 (ROPS)  ISO3449 (FOPS),,Engine,38 ltr,,​Related Information,​Efficient and powerful operation is obtained from the Syncro System CLSS system,Gear 4-6 @ 2000 rpm,131 kW / 176 HP,,Material,160 kg/mm2 high tensile strength steel,Electric dynamic retarder (max.),4026 kW / 5400 HP. Continuously rated high-density blown grids with retard at engine idle and retard in reverse propulsion,,Electric dynamic retarder (max.),2983 kW / 4000 HP. Continuously rated high-density blown grids with retard at engine idle and retard in reverse propulsion,,Rear,"Centre-pin support, full-floating, 16° total oscillation",,Material,160 kg/mm2 high tensile strength steel,Front,"Fixed, semi-floating",,Material,400 Brinell hardness high tensile strength steel,Travel circuit,380 kgf/cm3,Material,130 kg/mm2 high tensile strength steel,Rear,"Centre-pin support, full-floating, 20° total oscillation",,Travel circuit,380 kgf/cm3,Pilot circuit,33 kgf/cm3,Travel circuit,380 kgf/cm3,,Travel circuit,380 kgf/cm3,,Travel circuit,380 kgf/cm3,Travel circuit,380 kgf/cm3,,Pilot circuit,33 kgf/cm3,,Travel circuit,380 kgf/cm3,Travel circuit,380 kgf/cm3,Travel circuit,380 kgf/cm3,,Pilot circuit,33 kgf/cm3,Travel circuit,380 kgf/cm3,Rear,"Centre-pin support, full-floating, 22° total oscillation",,Differential gear,Straight bevel gear,,Front,"Fixed, full-floating",,Travel circuit,380 kgf/cm3,Travel circuit,380 kgf/cm3,,Batteries (Series/Parallel),2 x 2 x 12 V,Service brake,Hydraulic brake,Fan,2 x axial piston motors,Power Output,900 kW,Implement circuits,320 kgf/cm3,Travel circuit,350 kgf/cm3,Service brake,Hydraulic brake,Pilot circuit,33 kgf/cm3,,Implement circuit - Loading shovel,300 kgf/cm3,Implement circuit - Loading shovel,300 kgf/cm3,Travel circuit,380 kgf/cm3,Travel circuit,380 kgf/cm3,Front,"Fixed, full-floating",,Service brake,Hydraulic brake,Front,"Fixed, full-floating",,Material thickness:,Material thickness:,Bottom,19 mm,Standard,ISO3471 (ROPS)  ISO3449 (FOPS),,Front,"Fixed, full-floating",,Material thickness:,Material thickness:,Front,"Fixed, semi-floating",,Front,"Fixed, semi-floating",,Front,"Fixed, semi-floating",,Front,"Fixed, semi-floating",,Front,"Fixed, semi-floating",,Front,"Fixed, semi-floating",,Rear,"Centre-pin support, semi-floating, 24° total oscillation",Front,"Fixed, semi-floating",Front,"Fixed, semi-floating",,Rear,"Centre-pin support, semi-floating, 24° total oscillation",Hydraulic pump,"Piston pump, in common with loader control",,Material,160 kg/mm2 high tensile strength steel,Rear,"Center-pin support, semi-floating, 24° total oscillation",Travel circuit,380 kgf/cm3,HYDRAULICS & CONTROLS,- Komatsu Closed-center Load Sensing System (CLSS).  - Auxiliary circuit for attachments.  - Additional 'Super Flow' circuit for high flow attachments,Front,"Fixed, semi-floating",Steering control,Two levers with pedals,Type,Double-action,,HYDRAULICS & CONTROLS,- Komatsu Closed-center Load Sensing System (CLSS).  - Auxiliary circuit for attachments.,Travel circuit,355 kgf/cm3,Travel circuit,355 kgf/cm3,Swing reduction,Planetary gear,Travel circuit,270 kgf/cm3,Travel circuit,270 kgf/cm3,Swing circuit,210 kgf/cm3,Travel circuit,265 kgf/cm3,Travel circuit,270 kgf/cm3,Pilot circuit,33 kgf/cm3,Spool control valves for Semi-U tilt dozer and Full-U tilt dozer.,Spool control valves for Semi-U tilt dozer and Full-U tilt dozer.,,,Travel circuit,265 kgf/cm3,Spool control valves for Super Dozer,Spool control valves for Super Dozer,,,Travel circuit,270 kgf/cm3,Service brake,Hydraulic lock,Blade lift,"Raise, hold, lower, and float",,,Control Valves:,Control Valves:,,,,,,,,,Travel speeds,
Reverse,0 - 8.5 km/h,Reverse,0 - 13.6 km/h,Forward,0 - 11.6 km/h,Type,Hydrostatic Steering system,Type,"Planetary gear, double-reduction",Operating weight,"3,400 kg",Travel speeds,,Wheel brake locks,Switch-activated,,Swing circuit,295 kgf/cm3,Forward,0 - 11.3 km/h,Forward,0 - 8.5 km/h,Type,"Planetary gear, double-reduction",Forward,0 - 11.2 km/h,E-mode,,,Alternator,GTA-39,,Travel height (mm),3780,Radiator frontal area,6.24 m2,,Transmission,25 ltr,,Transmission type,Full Power Shift,Gear 7-8 @ 2100 rpm,144 kW / 193 HP,,Material thickness:,Material thickness:,Standard,ISO3471 (ROPS)  ISO3449 (FOPS),,Standard,SAEJ1040 (ROPS)  ISO3449 (FOPS),,Reduction gear,Spiral bevel gear,,Material thickness:,Material thickness:,Rear,"Centre-pin support, semi-floating, 26° total oscillation",,Material thickness:,Material thickness:,Swing circuit,285 kgf/cm3,Material thickness:,Material thickness:,Reduction gear,Spiral bevel gear,,Swing circuit,285 kgf/cm3,Hydraulic Cylinders,Bore x Stroke x Rod diameter,Swing circuit,285 kgf/cm3,,Swing circuit,295 kgf/cm3,,Swing circuit,295 kgf/cm3,Swing circuit,295 kgf/cm3,,Hydraulic Cylinders,Bore x Stroke x Rod diameter,,Swing circuit,295 kgf/cm3,Swing circuit,285 kgf/cm3,Swing circuit,295 kgf/cm3,,Hydraulic Cylinders,Bore x Stroke x Rod diameter,Swing circuit,295 kgf/cm3,Reduction gear,Spiral bevel gear,,Final reduction gear,"Planetary gear, single reduction, oil bath",,Rear,"Centre-pin support, full-floating, 22° total oscillation",,Swing circuit,285 kgf/cm3,Swing circuit,295 kgf/cm3,,Alternator,260 A,Parking brake,"Wet, multiple-disc",Relief Valve Setting,,Voltage,6.000 - 7.200 V,Travel circuit,350 kgf/cm3,Swing circuit,290 kgf/cm3,Parking brake,"Wet, multiple-disc",Hydraulic Cylinders,Bore x Stroke x Rod diameter,,Travel circuit,350 kgf/cm3,Travel circuit,350 kgf/cm3,Swing circuit,285 kgf/cm3,Swing circuit,295 kgf/cm3,Rear,"Centre-pin support, full-floating, 24° total oscillation",,Parking brake,"Wet, multiple-disc",Rear,"Centre-pin support, full-floating, 20° total oscillation",,Bottom,16 mm,Front,12 mm,Radiator frontal area,4.65 m2,,Rear,"Centre-pin support, full-floating, 26° total oscillation",,Bottom,14 mm,Rear,"Centre-pin support, semi-floating, 26° total oscillation",,Rear,"Centre-pin support, semi-floating, 26° total oscillation",,Rear,"Centre-pin support, semi-floating, 26° total oscillation",,Rear,"Centre-pin support, semi-floating, 26° total oscillation",,Rear,"Centre-pin support, semi-floating, 24° total oscillation",,Rear,"Centre-pin support, semi-floating, 24° total oscillation",,Reduction gear,Spiral bevel gear,Rear,"Centre-pin support, semi-floating, 24° total oscillation",Rear,"Centre-pin support, semi-floating, 18° total oscillation",,Reduction gear,Spiral bevel gear,Capacity (at rated rpm),53 ltr/min,,Material thickness:,Material thickness:,Reduction gear,Spiral bevel gear,Swing circuit,295 kgf/cm3,OPERATOR ENVIRONMENT,"- ROPS/FOPS cabin with side guards.  - Seat, suspension type with safety switch.  - Retractable seat belt.  - Safety bar with built in gauges and safety switch.  - Servo controls for direction and loader actuation.  - Bucket float.  - Horn.  - Travel alarm.  - Hand and foot throttle.",Rear,"Centre-pin support, semi-floating, 16° total oscillation",Drive method,Fully hydrostatic,Bore diameter × stroke:,,,OPERATOR ENVIRONMENT,"- ROPS/FOPS cabin with side guards.  - Seat, suspension type with safety switch.  - Retractable seat belt.  - Safety bar with built in gauges and safety switch.  - Servo controls for direction and loader actuation.  - Bucket float.  - Horn.  - Travel alarm.  - Hand and foot throttle.",Swing circuit,298 kgf/cm3,Swing circuit,298 kgf/cm3,Swing circle lubrication,Grease-bathed,Swing circuit,215 kgf/cm3,Swing circuit,220 kgf/cm3,Hydraulic Cylinders,Bore x Stroke x Rod diameter,Swing circuit,220 kgf/cm3,Swing circuit,215 kgf/cm3,Hydraulic Cylinders,Bore x Stroke x Rod diameter,Blade lift,"Raise, hold, lower, and float",,,Swing circuit,220 kgf/cm3,Blade lift,"Raise, hold, lower, and float",,,Swing circuit,220 kgf/cm3,Driven by,Hydraulic motor,Blade tilt,"Right, hold, and left",,,Spool control valves for Semi-U tilt dozer and Full-U tilt dozer.,Spool control valves for Semi-U tilt dozer and Full-U tilt dozer.,,,,,,,,,Forward,0 - 11.6 km/h
Type,Two-stage planetary gear,Type,Hydrostatic Steering system,Reverse,0 - 14 km/h,Minimum turning radius,1.99 - 2.24 m,Sprocket,Segmented sprocket teeth are bolt-on,Seal of track,Sealed track,Forward,0 - 9 km/h,Parking brakes,"Multiple disc, spring-applied, hydraulically released, dry brakes on inboard end of each wheel motor rotor shaft. Rated to hold on ±15% grade at maximum gross vehicle weight.",,Pilot circuit,33 kgf/cm3,Reverse,0 - 13.6 km/h,Reverse,0 - 8.5 km/h,Sprocket,Segmented sprocket teeth are bolt-on,Reverse,0 - 13.4 km/h,Gear 1-6 @ 2000 rpm,135 kW / 180 HP,,Dual fan main blower,453 m³/min,,Width (mm),2320,Alternator,GTA-51,,Final drive,63 ltr,,Drive,2WD / 4WD,E-mode,,,Bottom,25 mm,Radiator frontal area,7.02 m2,,Radiator frontal area,6.24 m2,,Differential gear,Straight bevel gear,,Bottom,19 mm,Reduction gear,Spiral bevel gear,,Bottom,19 mm,Pilot circuit,33 kgf/cm3,Bottom,19 mm,Differential gear,Conventional type,,Pilot circuit,33 kgf/cm3,Boom,2-140 mm x 1480 mm x 100 mm,Pilot circuit,33 kgf/cm3,,Pilot circuit,33 kgf/cm3,,Pilot circuit,33 kgf/cm3,Pilot circuit,33 kgf/cm3,,Boom,2-120 mm x 1385 mm,,Pilot circuit,33 kgf/cm3,Pilot circuit,33 kgf/cm3,Pilot circuit,33 kgf/cm3,,Boom,2-120 mm x 1334 mm x 85 mm,Pilot circuit,33 kgf/cm3,Differential gear,Straight bevel gear,,Service brakes,"Hydraulically actuated, wet disc brakes actuate on four wheels",,Reduction gear,Spiral bevel gear,,Pilot circuit,33 kgf/cm3,Pilot circuit,33 kgf/cm3,,Standard working lights,14 LED lights,System,24 V,Implement circuits,300 kgf/cm3,Amperage,96 A - 80 A,Swing circuit,280 kgf/cm3,Heavy lift circuit,350 kgf/cm3,System,24 V,Boom,2-130 mm x 1385 mm x 90 mm,,Swing circuit,260 kgf/cm3,Swing circuit,260 kgf/cm3,Pilot circuit,33 kgf/cm3,Pilot circuit,33 kgf/cm3,Reduction gear,Spiral bevel gear,,System,24 V,Reduction gear,Spiral bevel gear,,Front,8 mm,Sides,9 mm,Alternator,GTA-49,,Reduction gear,Spiral bevel gear,,Front,8 mm,Reduction gear,Spiral bevel gear,,Reduction gear,Spiral bevel gear,,Reduction gear,Spiral bevel gear,,Reduction gear,Spiral bevel gear,,Reduction gear,Spiral bevel gear,,Reduction gear,Spiral bevel gear,,Differential gear,Torque proportioning,Reduction gear,Spiral bevel gear,Reduction gear,Spiral bevel gear,,Differential gear,Torque proportioning,Relief valve setting,17.5 MPa  178.6 kgf/cm2,,Bottom,25 mm,Differential gear,Torque proportioning,Pilot circuit,33 kgf/cm3,OTHER STANDARD EQUIPMENT,"- Wiring for rear lights.  - Painting, Komatsu standard colouring.  - Tilt over cabin for ease of servicing.  - Komatsu Machine Tracking System, (KOMTRAX).",Reduction gear,Spiral bevel gear,Maximum drawbar pull,123 kN 12500 kgf,Boom cylinder,80 × 714 mm,,OTHER STANDARD EQUIPMENT,"- Wiring for rear lights.  - Painting, Komatsu standard colouring.  - Tilt over cabin for ease of servicing.  - Komatsu Machine Tracking System, (KOMTRAX).",Pilot circuit,33 kgf/cm3,Pilot circuit,33 kgf/cm3,Service brake,Hydraulic lock,Steering control,Two levers with pedals,Pilot circuit,32 kgf/cm3,Boom,1-120 mm x 1015 mm x 70 mm,Pilot circuit,32 kgf/cm3,Pilot circuit,33 kgf/cm3,Boom,2-105 mm x 1055 mm x 70mm,Blade tilt,"Right, hold, and left",,,Pilot circuit,32 kgf/cm3,Blade tilt,"Right, hold, and left",,,Pilot circuit,32 kgf/cm3,Service brake,Hydraulic lock,Additional control valve required for variable digging angle multi-shank ripper and giant ripper.,Additional control valve required for variable digging angle multi-shank ripper and giant ripper.,,,Blade lift,"Raise, hold, lower, and float",,,,,,,,,Reverse,0 - 14 km/h
